algorithm,elapsed_time,iterations_done,total_iterations,iterations_per_second,book_index,similarity_score,,book_title,recommended_description
,,,,,11761.0,0.377,,The Theory and Practice of Hell,"A former Buchenwald prisoner's report to the Allied liberation forces describes the purpose, character, administration, and human impact of Nazi concentration camps. Reprint."
,,,,,11204.0,0.377,,à¤®à¥à¤¤à¥à¤¯à¥à¤à¤à¤¯,"The search for the meaning of Being is man's eternal quest and the subject of his greatest creations. Shivaji Sawant's Mrityunjaya is an outstanding instance of such a literary masterpiece in which a contemporary Marathi novelist investigates the meaning of the bewildering skein that is life through the personae of the Mahabharata protagonists. For over two decades since its first publication the vast non- Marathi and non-Hindi readership remained deprived of this remarkable exploration of the human psyche till the publication of this English translation by the Writers workshop â a contribution for which there is much to be grateful for. Mrityunjaya is the autobiography of Karna, and yet it is not just that. With deceptive case, Sawant brings into play an exceptional stylistic innovation by combining six ""dramatic soliloquies"" to form the nine books of this novel of epic dimensions. Four books are spoken by Karna. These are interspersed with a book each from the lips of his unwed mother Kunti, Duryodhana (who considers Karna his mainstay), Shon (Shatruntapa, his foster-brother, who here-worships him), his wife Vrishali to whom he is like a god and, last of all, Krishna. Sawant depicts an uncanny similarity between Krishna and Karna and hints at a mystic link between them, investing his protagonist with a more-than-human aura to offset the un-heroic and even unmanly acts which mar this tremendously complex and utterly fascinating creating of Vyasa."
,,,,,7933.0,0.362,,Hattie,"HATTIE begins with the endâthe end of a womanâs life. In a spare and powerful narrative, this soulful novel takes us on an intimate journey through the meaning of Hattieâs life and life in general, delving fearlessly into the complexity of our human relationships, our yearning for the divine, and the ways in which these paths cross throughout our lives. For Hattie, love and loss are so intertwined it is hard to separate the two. By sharing her stories, Hattie reconnects with parts of her lost life and loves and finds the courage to tell the whole truths of her lifeâin death she discovers her voice. HATTIE is a mystical, spiritual, and very human experience.HATTIE is an excellent choice for book clubs and includes a CONVERSATION GUIDE with questions for discussion."
,,,,,10691.0,0.344,,The Wisdom of Insecurity: A Message for an Age of Anxiety,"In this fascinating book, Alan Watts explores man's quest for psychological security, examining our efforts to find spiritual and intellectual certainty in the realms of religion and philosophy. The Wisdom of Insecurity underlines the importance of our search for stability in an age where human life seems particularly vulnerable and uncertain. Watts argues our insecurity is the consequence of trying to be secure and that, ironically, salvation and sanity lie in the recognition that we have no way of saving ourselves."
,,,,,1819.0,0.314,,Nothing You Don't Already Know,"Nothing you don't already know is a brief guide to making the most of your life. It's for everyone who wants to take on the journey of fulfilling their potential and live a deeply meaningful life. In 2015, the author started sharing his writings about life on his Instagram page. This book holds a selection of his most popular quotes and writings that have already positively impacted thousands of people. Alexander is a Dutch inspirational speaker who's teachings are about living with purpose, overcoming fear, transformation, and making a difference.This concise handbook is full of remarkable reminders about meaning, purpose, and self-realization.The title refers to the idea that if you learn something profound, it's not as if you have learned something new. Rather, it's as if something is being unveiled to you that you have always known."
,,,,,13053.0,0.304,,Being and Nothingness,"Being & Nothingness is without doubt one of the most significant philosophical books of the 20th century. The central work by one of the century's most influential thinkers, it altered the course of western philosophy. Its revolutionary approach challenged all previous assumptions about the individual's relationship with the world. Known as 'the Bible of existentialism', its impact on culture & literature was immediate & was felt worldwide, from the absurdist drama of Samuel Beckett to the soul-searching cries of the Beat poets.Being & Nothingness is one of those rare books whose influence has affected the mindset of subsequent generations. Seventy years after its 1st publication, its message remains as potent as ever--challenging readers to confront the fundamental dilemmas of human freedom, choice, responsibility & action."
,,,,,10532.0,0.302,,The Gospel According to Jesus Christ,"This is a skeptic's journey into the meaning of God and of human existence. At once an ironic rendering of the life of Christ and a beautiful novel, Saramago's tale has sparked intense discussion about the meaning of Christianity and the Church as an institution. Translated by Giovanni Pontiero."
,,,,,13249.0,0.297,,In Heaven as on Earth: A Vision of the Afterlife,"The best-selling author of The Road Less Traveled and In Search of Stones presents a novel of the afterlife that teaches important spiritual lessons for his life. The soul of Daniel - the author-psychiatrist who narrates this story - awakens in the afterlife infused with fear and excitement. Two spiritual ""greeters"" guide him as he begins to negotiate the ""corridors"" of this new environment, encountering welcome and unwelcome spirits. But ultimately only his own spiritual convictions and discoveries will lead him past seductive enchantment to the achievement of his destiny and an understanding of the fundamental moral principles that transcend mortality.Rich in lessons on finding a place and purpose in this life and beyond, Daniel's odyssey into eternity, like Dr. Peck's other inspirational classics, flows with nourishment for both the soul and the psyche."
,,,,,8778.0,0.295,,The Meaning of Life: A Guide to Finding Your Life's Purpose,"""What is the meaning of life?"" Throughout history, people have spent much of their lives trying to explain how the world works and why. Initially, they seek to live better lives and thrive. Ultimately, they seek to find purpose and significance in their existence.Experience the scientific and philosophical journey billions of years in the making to answer the question that all living beings capable of rational thought will ask themselves: why are we here? Over the course of that journey, you will come to understand how humans determine their meaning and, with some of your own analysis, discover your own purpose along the way."
,,,,,12692.0,0.294,,"The Way of the Superior Man: A Spiritual Guide to Mastering the Challenges of Women, Work, and Sexual Desire","The Ultimate Spiritual Guide for MenWhat is your true purpose in life? What do women really want? What makes a good lover? If you're a man reading this, you've undoubtedly asked yourself these questionsâbut you may not have had much luck answering them. Until now.In The Way of the Superior Man, David Deida explores the most important issues in men's livesâfrom career and family to women and intimacy to love and spirituality and relationshipsâto offer a practical guidebook for living a masculine life of integrity, authenticity, and freedom. Join this bestselling author and internationally renowned expert on sexual spirituality for straightforward advice, empowering skills, body practices, and more to help you realize a life of fulfillment, immediately and without compromise.""It is time to evolve beyond the macho jerk ideal, all spine and no heart,"" writes David Deida. ""It is also time to evolve beyond the sensitive and caring wimp ideal, all heart and no spine."" The Way of the Superior Man presents the ultimate challengeâand rewardâfor today's man: to discover the 'unity of heart and spine' through the full expression of consciousness and love in the infinite openness of the present moment.ContentsPart One: A Man's Way Part Two: Dealing With Women Part Three: Working With Polarity and Energy Part Four: What Women Really Want Part Five: Your Dark Side Part Six: Feminine Attractiveness Part Seven: Body Practices Part Eight: Men's and Women's Yoga of IntimacyExcerpt: This book is a guide for a specific kind of newly evolving man. This man is unabashedly masculineâhe is purposeful, confident, and directed, living his chosen way of life with deep integrity and humorâand he is sensitive, spontaneous, and spiritually alive, with a heart-commitment to discovering and living his deepest truth."
,,,,,5282.0,0.292,,Spiritual Symbols,"Spiritual Symbols with their Meaning, AoL Mindfulness Book #8. To all Mindfulness and Alchemy Explorers who see the beauty in every-day Nature & Universal sacred language of symbols and signs. We will not talk about spiritual symbols worshiped by major religions but about trees, numbers, spirals that we meet daily. Through symbols to mindfulness meditations. Symbols and signs are the languages of the soul. Symbols and signs are the language of dreams. Occultists believe that signs and symbols are given a supernatural power at their creation. Words, signs and symbols, images, colors, light, are all used for eons to convey a spiritual meaning. The Mystics of India In ancient India yogis observed the world as an illusion. Yet, the magic of the spiritual world stayed deeply connected to the sense world. Within the science of yoga, the way we treat our spine influences our health and well-being, the way we treat our thoughts, or the practice of meditation influences our current incarnation. The Mystics of Greece For the philosophers of ancient Babylonia and Greece the sense world was not considered an illusion. In the search for Divine, they turned towards art, towards symbols and signs within myths and legends. In mysterious ways the wisdom of the initiates poured into poets, artists, and thinkers. Manipulating the elements, they turned towards the Lady Science and carried her principles to the point that we are now able to manipulate the sound, the light, the matter and its manifestation. The Mystics of China Chinese created I Ching that within its symbolism reflects the universe in miniature. The book is at the heart of Confucian thought and Taoism, but also a common tool among the fortune tellers that use it as a divination text and a roadside oracle. The Mystics of Kabbalah Kabbalists designed the Tree of Life and the Tarot symbolism followed it. Kabbalah is an esoteric teaching, a science that explores metaphysical principles of the universe. Any material object and action from both the micro and the macro world is controlled by the spiritual forces. Kabbalah attempts to understand these spiritual sources, to know their nature and properties. Mystics Magic and God To a Chinese sage, a Yogi, and a Cabbalist Mystic, the earth is a field of activity that has to be transformed, so that it carries an imprint of human will. The Mystics, the Magi initiates, the guardians of the oracle mysteries acquired deep knowledge of the laws of the spiritual world and their interaction with the sense world. Some of them worked hard all through their lives to decipher the spiritual forces behind the forces of nature and to learn how to control the elements. Just as God is hidden, so are the inner secrets of Her divine message. We read about them, hear them uttered, but we cannot possibly comprehend their meaning unless we have a direct experience of their truth. That is why to be able to talk to our souls we use meditation, we use rituals, symbols and signs, we use dreams and careful observation of soulsâ subconscious messages. The mystics of our past help us in this quest. From Zarathustra who comes from the ancient Persian spiritual culture, to Pythagoras who comes from the Greco-Latin cultural epoch, to Lao Tzu, Buddha and Christ, they all carry the keys to the secrets of the most varied mysteries. In March 2015, Artof4Elements developed and launched the Alchemy of Love Mindfulness Training Series of 9 fiction and non-fiction books with 7 authors focusing on spiritual growth, creativity and mindfulness. A series of many genre's, including poetry, personal development, historical fiction, the world of Alchemy of Love Mindfulness Training explores numerous self development themes. The main theme that books and courses explore is mindfulness, alchemy, and reaching ones highest potential."
,,,,,10435.0,0.289,,Autobiography of a Yogi,"This acclaimed autobiography presents a fascinating portrait of one of the great spiritual figures of our time. With engaging candor, eloquence, and wit, Paramahansa Yogananda narrates the inspiring chronicle of his life: the experiences of his remarkable childhood, encounters with many saints and sages during his youthful search throughout India for an illumined teacher, ten years of training in the hermitage of a revered yoga master, and the thirty years that he lived and taught in America. Also recorded here are his meetings with Mahatma Gandhi, Rabindranath Tagore, Luther Burbank, the Catholic stigmatist Therese Neumann, and other celebrated spiritual personalities of East and West. Autobiography of a Yogi is at once a beautifully written account of an exceptional life and a profound introduction to the ancient science of Yoga and its time-honored tradition of meditation. The author clearly explains the subtle but definite laws behind both the ordinary events of everyday life and the extraordinary events commonly termed miracles. His absorbing life story thus becomes the background for a penetrating and unforgettable look at the ultimate mysteries of human existence. Considered a modern spiritual classic, the book has been translated into more than twenty languages and is widely used as a text and reference work in colleges and universities. A perennial bestseller since it was first published sixty years ago, Autobiography of a Yogi has found its way into the hearts of millions of readers around the world."
,,,,,11508.0,0.289,,Destiny of Souls: New Case Studies of Life Between Lives,"A pioneer in uncovering the secrets of life, internationally recognized spiritual hypnotherapist Dr. Michael Newton takes you once again into the heart of the spirit world. His groundbreaking research was first published in the bestsellingÂ Journey of Souls, the definitive study on the afterlife. Now, inÂ Destiny of Souls, the saga continues with 70 case histories of real people who were regressed into their lives between lives. Dr. Newton answers the requests of the thousands of readers of the first book who wanted more details about various aspects of life on the other side.Â Destiny of SoulsÂ is also designed for the enjoyment of first-time readers who haven't readÂ Journey of Souls.Â  Explore the meaning behind your own spiritual memories as you read the stories of people in deep hypnosis, and learn fascinating details about: âOur purpose on EarthâSoul matesÂ and spirit guidesâSpiritual settings and where souls go after deathâSoul travel between livesâWays spirits connect with and comfort the livingâThe soul-brain connectionÂ Â Â Â Â Â Â Â Â âWhy we choose certain bodies"
,,,,,13239.0,0.285,,The Nazi Doctors: Medical Killing and the Psychology of Genocide,"Nazi doctors did more than conduct bizarre experiments on concentration-camp inmates; they supervised the entire process of medical mass murder, from selecting those who were to be exterminated to disposing of corpses. Lifton (The Broken Connection; The Life of the Self shows that this medically supervised killing was done in the name of ""healing,"" as part of a racist program to cleanse the Aryan body politic. After the German eugenics campaign of the 1920s for forced sterilization of the ""unfit,"" it was but one step to ""euthanasia,"" which in the Nazi context meant systematic murder of Jews. Building on interviews with former Nazi physicians and their prisoners, Lifton presents a disturbing portrait of careerists who killed to overcome feelings of powerlessness. He includes a chapter on Josef Mengele and one on Eduard Wirths, the ""kind, decent"" doctor (as some inmates described him) who set up the Auschwitz death machinery. Lifton also psychoanalyzes the German people, scarred by the devastation of World War I and mystically seeking regeneration. This profound study ranks with the most insightful books on the Holocaust."
,,,,,156.0,0.283,,Veronika Decides to Die,"In his latest international bestseller, the celebrated author of The Alchemist addresses the fundamental questions asked by millions: What am I doing here today? and Why do I go on living?Twenty-four-year-old Veronika seems to have everything she could wish for: youth and beauty, plenty of attractive boyfriends, a fulfilling job, and a loving family. Yet something is lacking in her life. Inside her is a void so deep that nothing could possibly ever fill it. So, on the morning of November 11, 1997, Veronika decides to die. She takes a handful of sleeping pills expecting never to wake up.Naturally Veronika is stunned when she does wake up at Villete, a local mental hospital, where the staff informs her that she has, in fact, partially succeeded in achieving her goal. While the overdose didn't kill Veronika immediately, the medication has damaged her heart so severely that she has only days to live.The story follows Veronika through the intense week of self-discovery that ensues. To her surprise, Veronika finds herself drawn to the confinement of Villete and its patients, who, each in his or her individual way, reflect the heart of human experience. In the heightened state of life's final moments, Veronika discovers things she has never really allowed herself to feel before: hatred, fear, curiosity, love, and sexual awakening. She finds that every second of her existence is a choice between living and dying, and at the eleventh hour emerges more open to life than ever before.In Veronika Decides to Die, Paulo Coelho takes the reader on a distinctly modern quest to find meaning in a culture overshadowed by angst, soulless routine, and pervasive conformity. Based on events in Coelho's own life, Veronika Decides to Die questions the meaning of madness and celebrates individuals who do not fit into patterns society considers to be normal. Poignant and illuminating, it is a dazzling portrait of a young woman at the crossroads of despair and liberation, and a poetic, exuberant appreciation of each day as a renewed opportunity."
,,,,,12377.0,0.28,,A Dog's Purpose,"This is the remarkable story of one endearing dog's search for his purpose over the course of several lives. More than just another charming dog story, this touches on the universal quest for an answer to life's most basic question: Why are we here? Surprised to find himself reborn as a rambunctious golden haired puppy after a tragically short life as a stray mutt, Bailey's search for his new life's meaning leads him into the loving arms of 8 year old Ethan. During their countless adventures Bailey joyously discovers how to be a good dog. But this life as a beloved family pet is not the end of Bailey's journey. Reborn as a puppy yet again, Bailey wonders, will he ever find his purpose? Heartwarming, insightful, and often laugh out loud funny, this book is not only the emotional and hilarious story of a dog's many lives, but also a dog's eye commentary on human relationships and the unbreakable bonds between man and man's best friend. This story teaches us that love never dies, that our true friends are always with us, and that every creature on earth is born with a purpose."
,,,,,609.0,0.279,,"Don't Just Fly, SOAR: The Inspiration and tools you need to rise above adversity and create a life by design","Are you struggling to rise above adversity? Looking for the deeper purpose for your life? Don't Just Fly, tells a deeply personal account of an immigrant conqueror. Markey unveils her own fractured heart, coherent to the sound of humanities cries and painted by her own tears. Cultured calligraphy glides from her quill to depict traces of humankind and specifically where real victory dwells. Only you can define the tapestry of your character and the fashion that it spills into our world. This testimony is more than words, it is life changing motivation to live better. It is a witness that you can achieve professional success, change the narrative dished out to you, harness meaningful relationships, ignite your self-worth and find peace in the most intense storms of life. Drenched with palatable experience and insightful gleans Kelly shows that the power to change your life depends on you despite unfavourable circumstances. A book that's ignites you to find your goodness guide. In this book, Kelly draws on her life experience wisdom intended to supply guidance and daily help, with all the pitfalls and possibilities to benefit you towards understanding how Define your purpose and vision for life Understand the lessons & blessings of your past Create authentic & meaningful relationships Thrive in a world that sometimes feels unfair Design the future that inspires youDon't Just Fly, SOAR includes 25 powerful self-help tools for transforming your life and creating a future by design. Each points you toward a better and robust custom of living.This book will guide you to the healing power of empathy and complement the incredible influence of resilience that lurks within you. It will inspire you to shoot for the stars and leave your legacy in the world! _______________________________________________________________________ 'This book is powerful, it will teach you, it will equip you and it will shape you for a healthier walk in life...what an extraordinary journey and experience that turned out an exceptional woman of our era.' - Liz Naidoo. Editor. Woman of Faith Magazine'I believe our personal stories are sources of transformation for others...This book will transform your life and birth a new you. Congratulations on picking it up.' - Dr Samuel Ekundayo"
,,,,,12032.0,0.278,,A Path with Heart: A Guide Through the Perils and Promises of Spiritual Life,"âThis important guidebook shows in detail and with great humor and insight the way to practice the Buddhaâs universal teachings here in the West. Jack Kornfield is a wonderful storyteller and a great teacher.ââThich Nhat HanhâJack is helping to pave the path for American Buddhism, bringing essential basics into our crazy modern lives. And the language he uses is as simple and as lovely as our breath.ââNatalie GoldbergÂ Perhaps the most important book yet written on meditation, the process of inner transformation, and the integration of spiritual practice into our American way of life,Â  A Path with HeartÂ  brings alive one by one the challenges of spiritual living in the modern world. Written by a teacher, psychologist, and meditation master of international renown, this warm, inspiring, and expert book touches on a wide range of essential issues including many rarely addressed in spiritual books. From compassion, addiction, and psychological and emotional healing, to dealing with problems involving relationships and sexuality, to the creation of a Zen-like simplicity and balance in all facets of life, it speaks to the concerns of many modern spiritual seekers, both those beginning on the path and those with years of experience.Â A Path with HeartÂ  is filled with practical techniques, guided meditations, stories, koans, and other gems of wisdom that can help ease your journey through the world. The authorâs own profoundâand sometimes humorousâexperiences and gentle assistance will skillfully guide you through the obstacles and trials of spiritual and contemporary life to bring a clarity of perception and a sense of the sacred into your everyday experience. Reading this book will touch your heart and remind you of the promises inherent in meditation and in a life of the the blossoming of inner peace, wholeness, and understanding, and the achievement of a happiness that is not dependent on external conditions.Â Sure to be a classic,Â  A Path with HeartÂ  shows us how we can bring our spirituality to flower every day of our lives. It is a wise and gentle guidebook for an odyssey into the soul that enables us to achieve a deeper, more satisfying life in the world."
