algorithm,elapsed_time,iterations_done,total_iterations,iterations_per_second,book_index,similarity_score,,book_title,recommended_description
,,,,,1216.0,0.213,,A Pocket for Corduroy,"Come along with Corduroy as he goes on an all-new adventure.Corduroy, with his unaffected simplicity and childlike emotion, is one of the best-loved bears in children's books. His story has become an irresistible childhood classic, beloved by generations of readers of all ages.
Don Freeman
 was born in San Diego, California, and moved to New York City to study art, making his living as a jazz trumpeter. With this loss of his trumpet on a subway train, Mr. Freeman turned his talents to art full-time. In the 1940s he began writing and illustrating children's books; his many popular titles include Beady Bear, Dandelion, Mop Top and Norman the Doorman. At the time of his death in 1978, the Los Angeles Times wrote: ""Ingeniousness and humor, theatricality and commonality, humanity and beauty: these elements survive in his picture books."""
,,,,,2343.0,0.213,,Surprised by Joy: The Shape of My Early Life,"Surprised by Joy: The Shape of My Early Life is a partial autobiography describing Lewis' conversion to Christianity. The book overall contains less detail concerning specific events than typical autobiographies. This is because his purpose in writing wasn't primarily historical. His aim was to identify & describe the events surrounding his accidental discovery of & consequent search for the phenomenon he labelled ""Joy"". This word was the best translation he could make of the German idea of Sehnsucht, longing. That isn't to say the book is devoid of information about his life. He recounts his early years with a measure of amusement sometimes mixed with pain. However, while he does describe his life, the principal theme of the book is Joy as he defined it. This Joy was a longing so intense for something so good & so high up it couldn't be explained with words. He's struck with ""stabs of joy"" throughout life. He finally finds what it's for at the end. He writes about his experiences at Malvern College in 1913, aged 15. Though he described the school as ""a very furnace of impure loves"" he defended the practice as being ""the only chink left thru which something spontaneous & uncalculating could creep in."" The book's last two chapters cover the end of his search as he moves from atheism to theism & then from theism to Christianity. He ultimately discovers the true nature & purpose of Joy & its place in his own life. The book isn't connected with his unexpected marriage in later life to Joy Gresham. The marriage occurred long after the period described, though not long after the book was published. His friends were quick to notice the coincidence, remarking he'd really been ""Surprised by Joy"". ""Surprised by Joy"" is also an allusion to Wordsworth's poem, ""Surprised by Joy-Impatient As The Wind"", relating an incident when Wordsworth forgot the death of his beloved daughter."
,,,,,259.0,0.213,,The Illustrated Man,"That The Illustrated Man has remained in print since being published in 1951 is fair testimony to the universal appeal of Ray Bradbury's work. Only his second collection (the first was Dark Carnival, later reworked into The October Country), it is a marvelous, if mostly dark, quilt of science fiction, fantasy, and horror. In an ingenious framework to open and close the book, Bradbury presents himself as a nameless narrator who meets the Illustrated Man--a wanderer whose entire body is a living canvas of exotic tattoos. What's even more remarkable, and increasingly disturbing, is that the illustrations are themselves magically alive, and each proceeds to unfold its own story, such as ""The Veldt,"" wherein rowdy children take a game of virtual reality way over the edge. Or ""Kaleidoscope,"" a heartbreaking portrait of stranded astronauts about to reenter our atmosphere--without the benefit of a spaceship. Or ""Zero Hour,"" in which invading aliens have discovered a most logical ally--our own children. Even though most were written in the 1940s and 1950s, these 18 classic stories will be just as chillingly effective 50 years from now. --Stanley WiaterContents:Â· Prologue: The Illustrated Man Â· ss * Â· The Veldt [âThe World the Children Madeâ] Â· ss The Saturday Evening Post Sep 23 â50 Â· Kaleidoscope Â· ss Thrilling Wonder Stories Oct â49 Â· The Other Foot Â· ss New Story Magazine Mar â51 Â· The Highway [as by Leonard Spalding] Â· ss Copy Spr â50 Â· The Man Â· ss Thrilling Wonder Stories Feb â49 Â· The Long Rain [âDeath-by-Rainâ] Â· ss Planet Stories Sum â50 Â· The Rocket Man Â· ss Macleanâs Mar 1 â51 Â· The Fire Balloons [ââIn This Sign...ââ] Â· ss Imagination Apr â51 Â· The Last Night of the World Â· ss Esquire Feb â51 Â· The Exiles [âThe Mad Wizards of Marsâ] Â· ss Macleanâs Sep 15 â49; F&SF Win â50 Â· No Particular Night or Morning Â· ss * Â· The Fox and the Forest [âTo the Futureâ] Â· ss Colliers May 13 â50 Â· The Visitor Â· ss Startling Stories Nov â48 Â· The Concrete Mixer Â· ss Thrilling Wonder Stories Apr â49 Â· Marionettes, Inc. [Marionettes, Inc.] Â· ss Startling Stories Mar â49 Â· The City [âPurposeâ] Â· ss Startling Stories Jul â50 Â· Zero Hour Â· ss Planet Stories Fll â47 Â· The Rocket [âOutcast of the Starsâ] Â· ss Super Science Stories Mar â50 Â· Epilogue Â· aw *"
,,,,,12453.0,0.213,,Maus II: A Survivor's Tale: And Here My Troubles Began,"Acclaimed as a quiet triumph and a brutally moving work of art, the first volume of Art Spieglman's Maus introduced readers to Vladek Spiegleman, a Jewish survivor of Hitler's Europe, and his son, a cartoonist trying to come to terms with his father, his father's terrifying story, and History itself. Its form, the cartoon (the Nazis are cats, the Jews mice), succeeds perfectly in shocking us out of any lingering sense of familiararity with the events described, approaching, as it does, the unspeakable through the diminutive.This second volume, subtitled And Here My Troubles Began, moves us from the barracks of Auschwitz to the bungalows of the Catskills. Genuinely tragic and comic by turns, it attains a complexity of theme and a precision of thought new to comics and rare in any medium. Maus ties together two powerful stories: Vladek's harrowing tale of survival against all odds, delineating the paradox of daily life in the death camps, and the author's account of his tortured relationship with his aging father. At every level this is the ultimate survivor's tale - and that too of the children who somehow survive even the survivors."
,,,,,11550.0,0.213,,The Divan,"The Persian poet Hafez (1320-1389) is best known as a Sufi mystic who incorporated elements of Sufism into his verses. The state of God-Realisation is symbolised through union with a Beloved, and drinking the wine of spiritual love.This compact version of the Divan of Hafez is a facsimile illuminated manuscript, complete with beautiful Persian calligraphy and miniature illustrations. There are 43 ghazals, translated into English by classical scholar Gertrude Bell. It is a truly beautiful introduction not only to the works of this beloved Sufi mystic, but also to the artistry of Mahmoud Farshchian. It is like getting two books in one: poetry and art.""Hafiz has no peer."" â GoethePoetry is the greatest literary form of ancient Persia and modern Iran, and the fourteenth-century poet known as Hafiz is its preeminent master. Little is known about the poet's life, and there are more legends than facts relating to the particulars of his existence. This mythic quality is entirely appropriate for the man known as ""The Interpreter of Mysteries"" and ""The Tongue of the Hidden,"" whose verse is regarded as oracular by those seeking guidance and attempting to realize wishes.A mere fraction of what is presumed to have been an extensive body of work survives. This collection is derived from Hafiz's Divan (collected poems), a classic of Sufism. The short poems, called ghazals, are sonnet-like arrangements of varied numbers of couplets. In the tradition of Persian poetry and Sufi philosophy, each poem corresponds to two interpretations, sensual and mystic.This outstanding translation of Hafiz's poetry was created by historian and Arabic scholar Gertrude Bell, who observed, ""These are the utterances of a great poet, the imaginative interpreter of the heart of man; they are not of one age, or of another, but for all time."""
,,,,,7479.0,0.213,,H is for Hawk,"As a child, Helen Macdonald was determined to become a falconer. She learned the arcane terminology and read all the classic books, including T.H. White's tortured masterpiece, ""The Goshawk,"" which describes White's struggle to train a hawk as a spiritual contest.When her father dies and she is knocked sideways by grief, she becomes obsessed with the idea of training her own goshawk. She buys Mabel for Â£800 on a Scottish quayside and takes her home to Cambridge. Then she fills the freezer with hawk food and unplugs the phone, ready to embark on the long, strange business of trying to train this wildest of animals.Destined to be a classic of nature writing, ""H is for Hawk"" is a record of a spiritual journey - an unflinchingly honest account of Macdonald's struggle with grief during the difficult process of the hawk's taming and her own untaming. At the same time, it's a kaleidoscopic biography of the brilliant and troubled novelist T. H. White, best known for ""The Once and Future King."" It's a book about memory, nature and nation, and how it might be possible to try to reconcile death with life and love."
,,,,,485.0,0.212,,21 Lessons for the 21st Century,"In Sapiens, he explored our past. In Homo Deus, he looked to our future. Now, one of the most innovative thinkers on the planet turns to the present to make sense of today's most pressing issues.How do computers and robots change the meaning of being human? How do we deal with the epidemic of fake news? Are nations and religions still relevant? What should we teach our children?Yuval Noah Harari's 21 Lessons for the 21st Century is a probing and visionary investigation into today's most urgent issues as we move into the uncharted territory of the future. As technology advances faster than our understanding of it, hacking becomes a tactic of war, and the world feels more polarized than ever, Harari addresses the challenge of navigating life in the face of constant and disorienting change and raises the important questions we need to ask ourselves in order to survive.In twenty-one accessible chapters that are both provocative and profound, Harari builds on the ideas explored in his previous books, untangling political, technological, social, and existential issues and offering advice on how to prepare for a very different future from the world we now live in: How can we retain freedom of choice when Big Data is watching us? What will the future workforce look like, and how should we ready ourselves for it? How should we deal with the threat of terrorism? Why is liberal democracy in crisis?Harari's unique ability to make sense of where we have come from and where we are going has captured the imaginations of millions of readers. Here he invites us to consider values, meaning, and personal engagement in a world full of noise and uncertainty. When we are deluged with irrelevant information, clarity is power. Presenting complex contemporary challenges clearly and accessibly, 21 Lessons for the 21st Century is essential reading."
,,,,,9351.0,0.212,,Go Tell It!,"Your Story Can Be An Essential and Powerful Part of Your Mission on EarthDebby Efurdâs fondest memories as a child was spent with my grandmother for story time. Fairy tales, fables, stories from her youth â¦ they swept Debby away to another world. As one story ended, Debby would beg for more.When she was older, Debby fell in love with Bible stories and was eager to hear stories in Sunday School about Joseph or David or Moses. Then one day she heard the Greatest Story Ever Told and met and fell in love with the Main Character â Jesus Christ. That made all the difference.Somewhere along Debbyâs life journey, though, Debby forgot who was in charge. Thatâs when life turned upside down. Decades later, after many trials and triumphs, she turned control back to the One who provides hope and transformation. Yes, stories can inspire, motivate, spur you to action â¦ like an arrow right at your heart. Go Tell It! provides compelling stories of hope and transformation of lives who have each made a â180â by finding and sharing their voices. Whether your personal story revolves around one moment, one ministry, or a multitude of life events, the key is to point to the One who makes your transformation possible. All it takes is a willing heart and the courage to be honest â¦ one story at a time."
,,,,,10472.0,0.212,,Way of the Peaceful Warrior: A Book That Changes Lives,"The 20th Anniversary Edition with a New Afterword and Revisions by Dan Millman. A book that could change your When Dan Millman was a young man, he expected that hard work would eventually bring a life of comfort, wisdom, and happiness. Yet, despite his many successes, he was haunted by the feeling that something was missing. Awakened by dark dreams one night, Dan found himself at a gas station with an old man named Socrates, and his world was changed forever. Guided by this eccentric old warrior, and inspired by a young woman named Joy, Dan began a spiritual odyssey into realms of light and shadow, romance and mystery, toward a final confrontation that would deliver or destroy him. Inspirational and spiritual This autobiographical novel is one of the most beloved spiritual sagas of our time. For decades, friends and families around the world have shared the book that teaches the way of the peaceful warrior. Life as a peaceful warrior is a life of meditation, mindfulness, compassion, and acceptance. Help in these tumultuous In this 20th anniversary edition, the author offers an updated afterword for a new generation of readers looking for grounding in tumultuous times. Way of the Peaceful Warrior is the iconic first book from Dan Millman. His other guides to peaceful warrior life include The Life You Were Born to Live and The Hidden School . If you loved The Heart of the Shaman , The Magic Mala , and The Celestine Prophecy , youâll be moved by the inspiration and spirituality of Way of the Peaceful Warrior ."
,,,,,12968.0,0.212,,Loving Ordinary Life: The Self-Help Book for People Who Are Tired of Self-Help Books,"Loving Ordinary Life is written for us: living, emotional people.We all want to live a happy life, but we can easily fall into a state of despondency. We prefer to smile, but more often we frown.We like being inspired, but most likely, we canât recall the last time when we were.There are many books and courses about self-motivation and inspiration. You might have heard hundreds of platitudes and affirmations. Each of them sounds valid but their utility is limited when you actually find yourself stuck in a pit of pain and despair.Loving Ordinary Life is meant to make a functional difference. Itâs not a treatment for depression. It is about living a life where depression has no place.Loving Ordinary Life is your guide. It is designed so that you can open any page and find the inspiration to act and improve your life when youâre feeling down. Each chapter in Loving Ordinary Life is a tool for moving from a negative idle state to a positive proactive state. It displays to you the art of being present, free, and genuine every day.If you want to be more fulfilled and enjoy life more, if youâre open to quality changes, Loving Ordinary Life will become your loyal companion.Everything is within your power. You are the master of your life. How you experience it depends only on you. Take the lead.âVery little is needed to make a happy life; it is all within yourself, in your way of thinking.""Marcus Aurelius"
,,,,,5831.0,0.212,,Earth Abides,"A disease of unparalleled destructive force has sprung up almost simultaneously in every corner of the globe, all but destroying the human race. One survivor, strangely immune to the effects of the epidemic, ventures forward to experience a world without man. What he ultimately discovers will prove far more astonishing than anything he'd either dreaded or hoped for."
,,,,,7926.0,0.211,,Waiting to Live,"Dr. Asa Don Brownâs insightful message of unconditional love will transpire your way of thinking. Dr. Brown reveals a profound way of looking at life, forgiveness, and happiness. He explores with the reader the concepts of love and forgiveness. He has a poignant way of evoking the internal and spiritual side of life. His message will inspire you to begin living today. Why are you Waiting to Live?"
,,,,,12310.0,0.21,,The Essential Rumi,"This revised and expanded edition of The Essential Rumi includes a new introduction by Coleman Barks and more than 80 never-before-published poems.Through his lyrical translations, Coleman Barks has been instrumental in bringing this exquisite literature to a remarkably wide range of readers, making the ecstatic, spiritual poetry of thirteenth-century Sufi Mystic Rumi more popular than ever.The Essential Rumi continues to be the bestselling of all Rumi books, and the definitive selection of his beautiful, mystical poetry."
,,,,,5870.0,0.21,,Faulty Family,"When Daniel arrives in America to begin his undergraduate education, he was looking to break from an upbringing in isolation at a missionary school, and maybe even learn something - or anything at all - about his father, the international man of mystery. He soon discovers America surpasses his expectations as he is introduced to the full range of freedoms afforded by his new environment. A faulty family he ran away from is substituted with a host family of peculiar benefits. Meanwhile a new revelation threatens to shatter his treasured hopes about his father, risking everything he has gained, tasted, and loved in the new country. Nina is a gorgeous stay-at-home MD, who gave up her medical career to be a dedicated full-time mother to her children. So was everyone led to believe. She has secretly been resenting the lost dreams and meaning for life as her grown children leave home to go to school. The new-found freedom and a new addition to the family, an international student matched to be her son's college roommate, introduce passion and possibilities in the otherwise stale and dull life in Edina, MN. Can she explore and rekindle the thrills of her youth and reclaim her life force without risking her comfortable and secure life? This book is intended for mature audiences."
,,,,,667.0,0.21,,The Power of Now: A Guide to Spiritual Enlightenment,"Alternate cover edition of ISBN 9781577314806.To make the journey into the Now we will need to leave our analytical mind and its false created self, the ego, behind. From the very first page of Eckhart Tolle's extraordinary book, we move rapidly into a significantly higher altitude where we breathe a lighter air. We become connected to the indestructible essence of our Being, âThe eternal, ever present One Life beyond the myriad forms of life that are subject to birth and death.â Although the journey is challenging, Eckhart Tolle uses simple language and an easy question-and-answer format to guide us.A word-of-mouth phenomenon since its first publication, The Power of Now is one of those rare books with the power to create an experience in readers, one that can radically change their lives for the better."
,,,,,10007.0,0.209,,The Cat Who Saved Books,"The Cat Who Saved Books is a heart-warming story about finding courage, caring for others â and the tremendous power of books.Grandpa used to say it all the time: 'books have tremendous power'. But what is that power really?Natsuki Books was a tiny second-hand bookshop on the edge of town. Inside, towering shelves reached the ceiling, every one crammed full of wonderful books. Rintaro Natsuki loved this space that his grandfather had created. He spent many happy hours there, reading whatever he liked. It was the perfect refuge for a boy who tended to be something of a recluse.After the death of his grandfather, Rintaro is devastated and alone. It seems he will have to close the shop. Then, a talking tabby cat called Tiger appears and asks Rintaro for help. The cat needs a book lover to join him on a mission. This odd couple will go on three magical adventures to save books from people who have imprisoned, mistreated and betrayed them. Finally, there is one last rescue that Rintaro must attempt alone . . .Sosuke Natsukawa's international bestseller, translated from Japanese by Louise Heal Kawai, is a story for those for whom books are so much more than words on paper."
,,,,,8741.0,0.209,,A-Ma Alchemy of Love,"Spiritual Historical Novel. A-Ma is a historical spiritual novel set in the 17th century (Age of Enlightenment) Macao that follows lives and spiritual insights of settlers of this little peninsula in the middle of China. A-Ma main protagonist is Ama, an African alchemist, Goddess, a guru, a lover, a story-teller that inspires and gathers artists, preachers, priests, philosophers from all around the world within the magic settings of her coffee house. She believes in a spiritual truth that we all can live our highest potential, discovering the gold within. Traveling through space and time, we find ourselves in the midst of an amazing blend of Chinese, Portuguese and Africans that live together on this little peninsula. This magic place, that is rapidly growing as a centre of trade offers a pot for the highest alchemy practice ever, the alchemy of humanity, creating an energy matrix that will change the lives of generations to come.We are transferred into the time of strong religious clashes and dogmas, and the scientific revolution, where our protagonists join the fight of the enlightened minds of the time, such as Giordano Bruno and Da-Vinci for the establishment of the New World. Through Ruben, a Portuguese Jesuit Priest who came to China to convert the Chinese into Christians, and through Ama and her family, friends, followers and enemies, we enter into the insights and challenges of the time they lived in, we join their attempts to learn from both the Eastern and Western philosophy, and we witness their personal inner transformation. In China some prominent historical events shaped the future of Western and Eastern philosophical thought and civilization. All the events and manuscripts mentioned within the book: the Dutch attack to Macao 24th of June 1622, the Reform of the Chinese Calendar during 1630s, Father Schallâs Appointment to the Chinese Board of Mathematicians (during 1650s), Witches Hunt, and Witches Manual, etc, are carefully researched historical facts. The book uses history to create the connection between actions of the individuals that live surrounded by magic. A-Ma takes us on an exploration journey discovering the secrets of the bond we all have created during the millions of life-times on Earth, the bond of consciousness and suffering. Will Ruben manage to break this bond and enter into the world of alchemical transformation discovering his own divine potential? Will love that guides him, transform him, will his friend, guru and lover, Ama manage to break the matrix of habits, thoughts and patterns that surrounds them? Will Amaâs friends manage to reach enlightenment, will human society manage to shred the veil of dogmas that encircles it, or will the forces of Dark Ages be stronger or will Ama be prosecuted as a witch? Interspersed with graphic sketches of life in Europe and Macao in 16th century, this work presents a historic and imaginative fable of the Chinese & Portuguese way of life within this little settlement that at the time could have been a centre of spiritual progress of the Age of Reason. The book has 12 chapters, narrated by the people, Gods, & spirits that knew Ama. Historical, philosophical and spiritual fiction, A-Ma explores the human and social alchemy."
