algorithm,elapsed_time,iterations_done,total_iterations,iterations_per_second,book_index,similarity_score,,book_title,recommended_description
,,,,,12401.0,0.247,,On Tyranny: Twenty Lessons from the Twentieth Century,"A historian of fascism offers a guide for surviving and resisting Americaâs turn towards authoritarianism.On November 9th, millions of Americans woke up to the impossible: the election of Donald Trump as president. Against all predictions, one of the most-disliked presidential candidates in history had swept the electoral college, elevating a man with open contempt for democratic norms and institutions to the height of power.Timothy Snyder is one of the most celebrated historians of the Holocaust. In his books Bloodlands and Black Earth, he has carefully dissected the events and values that enabled the rise of Hitler and Stalin and the execution of their catastrophic policies. With Twenty Lessons, Snyder draws from the darkest hours of the twentieth century to provide hope for the twenty-first. As he writes, âAmericans are no wiser than the Europeans who saw democracy yield to fascism, Nazism and communism. Our one advantage is that we might learn from their experience.âTwenty Lessons is a call to arms and a guide to resistance, with invaluable ideas for how we can preserve our freedoms in the uncertain years to come."
,,,,,8981.0,0.246,,"If I Could Live Again: A heart wrenching, thought provoking novel that spans lifetimes","Sometimes dreams do come true-but not in the way we expect.Spanning three generations and nearly one hundred years, this is a heart-wrenching story about love, loss, family-both blood and the people you choose, spiritual connection, and a dream coming true in an unexpected way.In 1925, Margaret, born with a gift for music, is growing up in an abusive and unloving home, caring for her younger siblings and working hard on their dairy farm in Nova Scotia. She aspires to be a successful singer/songwriter but as life moves along and she settles in Alberta, it becomes less and less likely that she will ever achieve her dream.In 2015, as Sarah is going through her parents' belongings after their unexpected deaths, she stumbles across a box of transcripts of stories she told them when she was a child. The tales take on a more personal meaning when she falls in love with Alex, and as she spends time with his family, begins to feel a spiritual bond to Margaret.How are these two women connected?If I Could Live Again will touch your heart and inspire you to never let go of your dreams."
,,,,,12164.0,0.245,,The Evolving Self: A Psychology for the Third Millennium,"The author of the bestselling Flow (more than 125,000 copies sold) offers an intelligent, inspiring guide to life in the future.In this wise, humane inquiry, Csikszentmihalyi (Flow: The Psychology of Optimal Experience) argues that genetically programmed behaviors that once helped humans adapt and multiply now threaten our survival. These traits include obsessions with food and sex, addiction to pleasure, excessive rationality and a tendency to focus on the negative. A University of Chicago psychology professor, the author also believes we must free our minds of cultural illusions such as ethnocentric superiority or identification with one's possessions. He urges readers to find ways to reduce the oppression, exploitation and inequality that are woven into the fabric of society. Further, he wants us to control the direction of human evolution by pursuing challenging activities that lead to greater complexity while opposting chaos and conformity. Each chapter concludes with self-help questions and mental exercises designed to help readers apply the insights of this literate manifesto to their daily lives."
,,,,,8233.0,0.244,,I Am Dynamite! A Life of Nietzsche,"A groundbreaking new biography of philosophy's greatest iconoclast Friedrich Nietzsche is one of the most enigmatic figures in philosophy, and his conceptsâthe Ãbermensch, the will to power, slave moralityâhave fundamentally reshaped our understanding of the human condition. But what do most people really know of Nietzscheâbeyond the mustache, the scowl, and the lingering association with nihilism and fascism? Where do we place a thinker who was equally beloved by Albert Camus, Ayn Rand, Martin Buber, and Adolf Hitler?Nietzsche wrote that all philosophy is autobiographical, and in this vividly compelling, myth-shattering biography, Sue Prideaux brings readers into the world of this brilliant, eccentric, and deeply troubled man, illuminating the events and people that shaped his life and work. From his placid, devoutly Christian upbringingâovershadowed by the mysterious death of his fatherâthrough his teaching career, lonely philosophizing on high mountains, and heart-breaking descent into madness, Prideaux documents Nietzsche's intellectual and emotional life with a novelist's insight and sensitivity.She also produces unforgettable portraits of the people who were most important to him, including Richard and Cosima Wagner, Lou SalomÃ©, the femme fatale who broke his heart; and his sister Elizabeth, a rabid German nationalist and anti-Semite who manipulated his texts and turned the Nietzsche archive into a destination for Nazi ideologues.  I Am Dynamite! is the essential biography for anyone seeking to understand history's most misunderstood philosopher."
,,,,,10961.0,0.244,,The Practicing Mind: Bringing Discipline and Focus into Your Life,"Present moment awareness is an essential ingredient in life if one expects to experience any degree of authentic peace and contentment. It has been acknowledged for centuries as the cornerstone of spiritual awakening in all traditions of Eastern thought. In the West, however, it is still a relatively unrecognized concept of living. The Western mind is always restless, never content with the moment. Its internal dialogue is always firing off thoughts filled with emotional content and pulling the individual out of the present and into the past or future. But individuals raised in Western culture are becoming increasingly more aware of their overall sense of mental exhaustion, their lack of discipline and their inability to focus on demand. They are willing to expend the energy necessary to experience inner peace and a quiet mind that is waiting to follow the direction of their will. They are realizing that the endless struggle to fulfill the insatiable appetite of instant gratification is fruitless and tiresome at best. They are ripe for a new path in life and eager for a new set of instructions. This is the purpose of The Practicing Mind. It comprehensively deals with helping the individual understand exactly what present moment awareness is, how we are raised in a manner contradictory to this, and how we change our mindset to make this a part of our daily living. This book is accessible to readers of all philosophical backgrounds. Regardless of your perspective, you will find the book's insights most compelling.You can find the wisdom of both The Practicing Mind and The Meditating Mind in the combination The Total Mindset.For your convenience, THE PRACTICING MIND is now in mp3 CD audiobook format."
,,,,,206.0,0.244,,Schindler's List,"In the shadow of Auschwitz, a flamboyant German industrialist grew into a living legend to the Jews of Cracow. He was a womaniser, a heavy drinker and a bon viveur, but to them he became a saviour. This is the extraordinary story of Oskar Schindler, who risked his life to protect Jews in Nazi-occupied Poland and who was transformed by the war into a man with a mission, a compassionate angel of mercy."
,,,,,11320.0,0.243,,Mindful Being,"Mindful Being Personal Development Course is a 12 Modules Mindfulness Training Course with 100s of Spiritual Transformation Tools that combines meditation, mindfulness exercises, soulâs diary, spiritual diary, relationship contracts, circle of life, creativity tools, and many other daily spiritual transformation tools to help the explorer live his/her highest potential. Alchemy of Love Mindfulness Exercises are exploring: 1. Body - Health: Adopting healthy habits that empower the physical body (nutrition, exercise) - Daily Routine: Creating a daily routine that inspires creativity and personal growth. 2. Mind - Practicing Concentration and Learning How to Meditate - Exercising Will-Power: Building the motivation and discipline - Exploring Love and Relationships: Improving the ability to connect with one-self and others - Nurturing Creative Intelligence: Living authentically, and expressing the creative flow. 3. Soul - Understanding Purpose and Core Beliefs - Learning how to listen to the Soul - Learning Mindfulness through Self-Awareness, Self-Remembering and Mindful Conscious Living"
,,,,,12149.0,0.242,,The Intern Blues: The Timeless Classic About the Making of a Doctor,"While supervising a small group of interns at a major New York medical center, Dr. Robert Marion asked three of them to keep a careful diary over the course of a year. Andy, Mark, and Amy vividly describe their real-life lessons in treating very sick children; confronting child abuse and the awful human impact of the AIDS epidemic; skirting the indifference of the hospital bureaucracy; and overcoming their own fears, insecurities, and constant fatigue. Their stories are harrowing and often funny; their personal triumph is unforgettable. This updated edition of The Intern Blues includes a new preface from the author discussing the status of medical training in America today and a new afterword updating the reader on the lives of the three young interns who first shared their stories with readers more than a decade ago."
,,,,,10726.0,0.242,,The Te of Piglet,"In The Te of Piglet, the Piglet character of the Winnie the Pooh books explains the Chinese concept of Te, meaning 'power' or 'virtue'.[4] Hoff elucidates the Taoist concept of 'Virtue â of the small'; though, he also uses it as an opportunity to elaborate on his introduction to Taoism. It is written with many embedded stories from the A. A. Milne Winnie the Pooh books, both for entertainment and because they serve as tools for explaining Taoism. In the book Piglet is shown to possess great power â a common interpretation of the word Te, which more commonly means Virtue â not only because he is small, but also because he has a great heart or, to use a Taoist term, Tz'u. The book goes through the other characters â Tigger, Owl, Rabbit, Eeyore and Pooh â to show the various aspects of humanity that Taoism says get in the way of living in harmony with the Tao."
,,,,,6850.0,0.242,,Supernova,"Everyone is born for a purpose, and for Evania Laylen, that vocation is about to make itself known.  Guilt ridden after the death of her parents, Evania sinks into a deep depression. Living only for the addiction, and the man who saved her, she gives up on life. That is until the enigmatic Desmond Kane enters and shows her the life she was born to live. Thrust into a secret, action-packed world of good versus evil, Evania must rid her life of the addictive temptation, prepare her body for battle, and learn to embrace the possible in a world of impossible."
,,,,,10509.0,0.242,,Sam's Letters to Jennifer,"Grief-stricken by a recent tragedy, Jennifer returns to the resort village where she grew up to help her beloved grandmother. There, Jennifer will discover new meaning in life and experience not one, but two of the most amazing love stories ever."
,,,,,185.0,0.241,,Stepping Beyond Intention,"Beyond Intention is a transformational life tool that enable you to break through the stuck states, mental and emotional blocks between you and living a joyful life of purpose. Developed from years of personal experience and refined by my fellow Dreamers around the globe over years of mentoring, sharing and indeed personal growth, the paradigm augments a range of modalities as a framework for effecting deliberate, real and lasting change in your life."
,,,,,8962.0,0.24,,Why Buddhism is True: The Science and Philosophy of Meditation and Enlightenment,"From one of Americaâs greatest minds, a journey through psychology, philosophy, and lots of meditation to show how Buddhism holds the key to moral clarity and enduring happiness.Robert Wright famously explained in The Moral Animal how evolution shaped the human brain. The mind is designed to often delude us, he argued, about ourselves and about the world. And it is designed to make happiness hard to sustain. But if we know our minds are rigged for anxiety, depression, anger, and greed, what do we do? Wright locates the answer in Buddhism, which figured out thousands of years ago what scientists are only discovering now. Buddhism holds that human suffering is a result of not seeing the world clearlyâand proposes that seeing the world more clearly, through meditation, will make us better, happier people. In Why Buddhism is True, Wright leads readers on a journey through psychology, philosophy, and a great many silent retreats to show how and why meditation can serve as the foundation for a spiritual life in a secular age. At once excitingly ambitious and wittily accessible, this is the first book to combine evolutionary psychology with cutting-edge neuroscience to defend the radical claims at the heart of Buddhist philosophy. With bracing honesty and fierce wisdom, it will persuade you not just that Buddhism is trueâwhich is to say, a way out of our delusionâbut that it can ultimately save us from ourselves, as individuals and as a species."
,,,,,8253.0,0.24,,The Kindly Ones,"Named one of the ""100 Best Books of the Decade"" by The Times of London   ""Oh my human brothers, let me tell you how it happened.""    A former Nazi officer, Dr. Maximilien Aue has reinvented himself, many years after the war, as a middle-class family man and factory owner in France. An intellectual steeped in philosophy, literature, and classical music, he is also a cold-blooded assassin and the consummate bureaucrat. Through the eyes of this cultivated yet monstrous man we experience in disturbingly precise detail the horrors of the Second World War and the Nazi genocide of the Jews. Eichmann, Himmler, GÃ¶ring, Speer, Heydrich, HÃ¶ssâeven Hitler himselfâplay a role in Max's story. An intense and hallucinatory historical epic, The Kindly Ones is also a morally challenging read. It holds a mirror up to humanityâand the reader cannot look away."
,,,,,12188.0,0.239,,War Is a Force That Gives Us Meaning,"As a veteran war correspondent, Chris Hedges has survived ambushes in Central America, imprisonment in Sudan, and a beating by Saudi military police. He has seen children murdered for sport in Gaza and petty thugs elevated into war heroes in the Balkans. Hedges, who is also a former divinity student, has seen war at its worst and knows too well that to those who pass through it, war can be exhilarating and even addictive: ""It gives us purpose, meaning, a reason for living.""Drawing on his own experience and on the literature of combat from Homer to Michael Herr, Hedges shows how war seduces not just those on the front lines but entire societies, corrupting politics, destroying culture, and perverting the most basic human desires. Mixing hard-nosed realism with profound moral and philosophical insight, War Is a Force That Gives Us Meaning is a work of terrible power and redemptive clarity whose truths have never been more necessary.Listening Length: 6 hours and 27 minutes"
,,,,,74.0,0.239,,My Life,"An exhaustive, soul-searching memoir, Bill Clinton's My Life is a refreshingly candid look at the former president as a son, brother, teacher, father, husband, and public figure. Clinton painstakingly outlines the history behind his greatest successes and failures, including his dedication to educational and economic reform, his war against a ""vast right-wing operation"" determined to destroy him, and the ""morally indefensible"" acts for which he was nearly impeached. My Life is autobiography as therapy--a personal history written by a man trying to face and banish his private demons. Clinton approaches the story of his youth with gusto, sharing tales of giant watermelons, nine-pound tumors, a charging ram, famous mobsters and jazz musicians, and a BB gun standoff. He offers an equally energetic portrait of American history, pop culture, and the evolving political landscape, covering the historical events that shaped his early years (namely the deaths of Martin Luther King Jr. and JFK) and the events that shaped his presidency (Waco, Bosnia, Somalia). What makes My Life remarkable as a political memoir is how thoroughly it is infused with Clinton's unassuming, charmingly pithy voice: I learned a lot from the stories my uncle, aunts, and grandparents told me: that no one is perfect but most people are good; that people can't be judged only by their worst or weakest moments; that harsh judgments can make hypocrites of us all; that a lot of life is just showing up and hanging on; that laughter is often the best, and sometimes the only, response to pain. However, that same voice might tire readers as Clinton applies his penchant for minute details to a distractible laundry list of events, from his youth through the years of his presidency. Not wanting to forget a single detail that might help account for his actions, Clinton overdoes it--do we really need to know the name of his childhood barber? But when Clinton sticks to the meat of his story--recollections about Mother, his abusive stepfather, Hillary, the campaign trail, and Kenneth Starr--the veracity of emotion and Kitchen Confidential-type revelations about ""what it is like to be President"" make My Life impossible to put down. To Clinton, ""politics is a contact sport,"" and while he claims that My Life is not intended to make excuses or assign blame, it does portray him as a fighter whose strategy is to ""take the first hit, then counterpunch as hard as I could."" While My Life is primarily a stroll through Clinton's memories, it is also a scathing rebuke--a retaliation against his detractors, including Kenneth Starr, whose ""mindless search for scandal"" protected the guilty while ""persecuting the innocent"" and distracted his Administration from pressing international matters (including strikes on al Qaeda). Counterpunch indeed. At its core, My Life is a charming and intriguing if flawed book by an equally intriguing and flawed man who had his worst failures and humiliations made public. Ultimately, the man who left office in the shadow of scandal offers an honest and open account of his life, allowing readers to witness his struggle to ""drain the most out of every moment"" while maintaining the character with which he was raised. It is a remarkably intimate, persuasive look at the boy he was, the President he became, and man he is today. --Daphne Durham"
,,,,,377.0,0.238,,A New Earth: Awakening to Your Life's Purpose,"The highly anticipated follow-up to the 2,000,000 copy bestselling inspirational book, ""The Power of Now""  With his bestselling spiritual guide ""The Power of Now,"" Eckhart Tolle inspired millions of readers to discover the freedom and joy of a life lived ?in the now.? In ""A New Earth,"" Tolle expands on these powerful ideas to show how transcending our ego-based state of consciousness is not only essential to personal happiness, but also the key to ending conflict and suffering throughout the world. Tolle describes how our attachment to the ego creates the dysfunction that leads to anger, jealousy, and unhappiness, and shows readers how to awaken to a new state of consciousness and follow the path to a truly fulfilling existence. ""The Power of Now"" was a question-and-answer handbook. ""A New Earth"" has been written as a traditional narrative, offering anecdotes and philosophies in a way that is accessible to all. Illuminating, enlightening, and uplifting, ""A New Earth"" is a profoundly spiritual manifesto for a better way of life?and for building a better world."
,,,,,12221.0,0.238,,Slaughterhouse-Five,"Selected by the Modern Library as one of the 100 best novels of all time, Slaughterhouse-Five, an American classic, is one of the world's great antiwar books. Centering on the infamous firebombing of Dresden, Billy Pilgrim's odyssey through time reflects the mythic journey of our own fractured lives as we search for meaning in what we fear most."
,,,,,7040.0,0.237,,Living History,"The Phenomenal #1 Worldwide BestsellerâWith a New AfterwordHillary Rodham Clinton is known to hundreds of millions of people around the world. Yet few beyond her close friends and family have ever heard her account of her extraordinary journey. She writes with candor, humor and passion about her upbringing in suburban, middle-class America in the 1950s and her transformation from Goldwater Girl to student activist to controversial First Lady.Living History is her revealing memoir of life through the White House years. It is also her chronicle of living history with Bill Clinton, a thirty-year adventure in love and politics that survives personal betrayal, relentless partisan investigations and constant public scrutiny.Hillary Rodham Clinton came of age during a time of tumultuous social and political change in America. Like many women of her generation, she grew up with choices and opportunities unknown to her mother or grandmother. She charted her own course through unexplored terrain -- responding to the changing times and her own internal compass -- and became an emblem for some and a lightning rod for others. Wife, mother, lawyer, advocate and international icon, she has lived through America's great political wars, from Watergate to Whitewater.The only First Lady to play a major role in shaping domestic legislation, Hillary Rodham Clinton traveled tirelessly around the country to champion health care, expand economic and educational opportunity and promote the needs of children and families, and she crisscrossed the globe on behalf of women's rights, human rights and democracy. She redefined the position of First Lady and helped save the presidency from an unconstitutional, politically motivated impeachment. Intimate, powerful and inspiring, Living History captures the essence of one of the most remarkable women of our time and the challenging process by which she came to define herself and find her own voice -- as a woman and as a formidable figure in American politics."
,,,,,7010.0,0.237,,"How the World Really Works: A Scientist's Guide to Our Past, Present and Future",This is his magnum opus. It distils his over 40 academic books into one peerlessly authoritative yet accessible masterpiece
,,,,,6613.0,0.237,,Suite FranÃ§aise,"The first two stories of a masterwork once thought lost, written by a pre-WWII bestselling author who was deported to Auschwitz and died before her work could be completed.By the early l940s, when Ukrainian-born IrÃ¨ne NÃ©mirovsky began working on what would become Suite FranÃ§aiseâthe first two parts of a planned five-part novelâshe was already a highly successful writer living in Paris. But she was also a Jew, and in 1942 she was arrested and deported to Auschwitz: a month later she was dead at the age of thirty-nine. Two years earlier, living in a small village in central Franceâwhere she, her husband, and their two small daughters had fled in a vain attempt to elude the Nazisâshe'd begun her novel, a luminous portrayal of a human drama in which she herself would become a victim. When she was arrested, she had completed two parts of the epic, the handwritten manuscripts of which were hidden in a suitcase that her daughters would take with them into hiding and eventually into freedom. Sixty-four years later, at long last, we can read NÃ©mirovsky's literary masterpiece The first part, ""A Storm in June,"" opens in the chaos of the massive 1940 exodus from Paris on the eve of the Nazi invasion during which several families and individuals are thrown together under circumstances beyond their control. They share nothing but the harsh demands of survivalâsome trying to maintain lives of privilege, others struggling simply to preserve their livesâbut soon, all together, they will be forced to face the awful exigencies of physical and emotional displacement, and the annihilation of the world they know. In the second part, ""Dolce,"" we enter the increasingly complex life of a German-occupied provincial village. Coexisting uneasily with the soldiers billeted among them, the villagersâfrom aristocrats to shopkeepers to peasantsâcope as best they can. Some choose resistance, others collaboration, and as their community is transformed by these acts, the lives of these these men and women reveal nothing less than the very essence of humanity.Suite FranÃ§aise is a singularly piercing evocationâat once subtle and severe, deeply compassionate, and fiercely ironicâof life and death in occupied France, and a brilliant, profoundly moving work of art."
,,,,,6276.0,0.237,,Here Lies Death,"On December 21, 2012, the processes of death and aging stop completely. Here Lies Death is the story of Kelsey and April, sisters who are forced to explore their own mortality because of unprecedented supernatural phenomena. As the world struggles to understand the psychological and sociological implications, Kelsey and April dive deeper into hopelessness and depravity. While the slow realization of life without death begins to burn itself into a new reality, the human race threatens to implode. What happens when there is no more death? Part fantasy, part science fiction, and part story of survival, read the acclaimed novel that sweeps across the human experience and digs into the darkest corners of the mind."
