algorithm,elapsed_time,iterations_done,total_iterations,iterations_per_second,book_index,similarity_score,,book_title,recommended_description
,,,,,10385.0,0.198,,Shantaram,"""It took me a long time and most of the world to learn what I know about love and fate and the choices we make, but the heart of it came to me in an instant, while I was chained to a wall and being tortured.""So begins this epic, mesmerizing first novel set in the underworld of contemporary Bombay. Shantaram is narrated by Lin, an escaped convict with a false passport who flees maximum security prison in Australia for the teeming streets of a city where he can disappear.Accompanied by his guide and faithful friend, Prabaker, the two enter Bombay's hidden society of beggars and gangsters, prostitutes and holy men, soldiers and actors, and Indians and exiles from other countries, who seek in this remarkable place what they cannot find elsewhere.As a hunted man without a home, family, or identity, Lin searches for love and meaning while running a clinic in one of the city's poorest slums, and serving his apprenticeship in the dark arts of the Bombay mafia. The search leads him to war, prison torture, murder, and a series of enigmatic and bloody betrayals. The keys to unlock the mysteries and intrigues that bind Lin are held by two people. The first is Khader Khan: mafia godfather, criminal-philosopher-saint, and mentor to Lin in the underworld of the Golden City. The second is Karla: elusive, dangerous, and beautiful, whose passions are driven by secrets that torment her and yet give her a terrible power.Burning slums and five-star hotels, romantic love and prison agonies, criminal wars and Bollywood films, spiritual gurus and mujaheddin guerrillasâthis huge novel has the world of human experience in its reach, and a passionate love for India at its heart. Based on the life of the author, it is by any measure the debut of an extraordinary voice in literature."
,,,,,1926.0,0.198,,In Search of Captain Zero: A Surfer's Road Trip Beyond the End of the Road,"In 1996, Allan Weisbecker sold his home and his possessions, loaded his dog and surfboards into his truck, and set off in search of his long-time surfing companion, Patrick, who had vanished into the depths of Central America. In this rollicking memoir of his quest from Mexico to Costa Rica to unravel the circumstances of Patrick's disappearance, Weisbecker intimately describes the people he befriended, the bandits he evaded, the waves he caught and lost en route to finding his friend.In Search of Captain Zero is, according to Outside magazine, ""A subtly affecting tale of friendship and duty. [It] deserves a spot on the microbus dashboard as a hell of a cautionary tale about finding paradise and smoking it away."" In Search of Captain A Surfer's Road Trip Beyond the End of the Road is a Booksense 76 Top Ten selection for September/October."
,,,,,12957.0,0.198,,American Story: A Lifetime Search for Ordinary People Doing Extraordinary Things,"The host of the NBC Today Shows popular segment shares his favorite stories of citizens making a difference around the country.For the six million people who watch the Emmy Awardwinning American Story with Bob Dotson on NBCs Today Show, Bob Dotsons reports celebrate the inspirational stories of everyday Americans. Dotson has been crisscrossing the country for more than forty yearslogging more than four million milesin search of people who have quietly but profoundly changed our lives and our country for the better. Now, in American Story, he presents a road map to the unsung heroes with thoughtful solutions to problems we all face, incredible ideas that work, and blueprints to living our dreams. This inspiring book includes the stories of the boss who came out of retirement to start a new company for his former employees who could not find work; the truck driver who taught microsurgery; the man youve never heard of who has 465 profitable patents, second only to Thomas Edison; the doctor who developed the vaccine to prevent whooping cough, who didnt retire until age 104.In the tradition of Tom Brokaws New York Times bestseller The Time of Our Lives, American Story is a deeply moving and endlessly fascinating alternative narrative for everyone who yearns to feel good about America."
,,,,,3955.0,0.197,,Born to Win: Transactional Analysis with Gestalt Experiments,"Born to Win can change lives for the better. This bestselling classic uses the well-known psychological method called transactional analysis (TA) to uncover the roles we unconsciously act out day after day. Its fifty gestalt exercises have helped a generation realize how they communicate with others and think about themselves. If you want to have more control over your life, work more efficiently, and love others happily, Born to Win will help bring out the insight and confidence of a born winner.The insights in the book are now fundamental to how we see ourselves. It was one of the first self-help books to analyze communication styles and its 50 gestalt exercises are as revealing as ever about the roles people reenact in their Parent and Child ego states. Photos.""For the general reader [Born to Win] is probably the clearest and most up-to-date statement of the current thinking in transactional analysis, and easily the best of the popular books.""--Psychology Today""Enriching, stimulating, rewarding reading is here for anyone interested in understanding himself, his relationship with others, and his goals.""--Kansas City Times"
,,,,,11988.0,0.197,,The Book of Secrets,"In this comprehensive and practical guide, the secrets of the ancient science of Tantra become available to a contemporary audience for the first time. Confined to small, hidden mystery schools for centuries, and often misunderstood and misinterpreted today. Tantra is not just a collection of techniques to enhance sexual experience. As Osho shows in these pages, it is a complete science of self-realizatoin, based on the cumulative wisdom of centuries of exploration into the meaning of life and consciousness. Tantra-the very word means ""technique""-is a set of powerful, transformative tools that can be used to bring new meaning andjoy to every aspect of our daily lives."
,,,,,2132.0,0.196,,Walden and Civil Disobedience,"Naturalist & philosopher Thoreau's timeless essays on the role of humanity in the world of nature, in society & government. This edition includes a concise introduction that gives readers important background information. A chronology of the author's life & work. A timeline of significant events that provides the book's historical context. An outline of key themes & plot points to help readers form their own interpretations. Detailed explanatory notes. Critical analysis, including contemporary perspectives on the work. Discussion questions to promote lively classroom & book group interaction. A list of recommended related books & films to broaden the reader's experience."
,,,,,7885.0,0.196,,Juniper,"This prequel to ""Wise Child"" recounts the childhood and spiritual initiation of Juniper, who will in turn pass down the secret teachings of the ""dorans"" to Wise Child. Readers will again enjoy the details of herb-gathering, spell-casting and mystic rituals. An atmospheric story that will both satisfy confirmed fantasy fans and involve readers new to the genre.""-- ""Bulletin, Center for Children's Books."
,,,,,9511.0,0.196,,The Spirit of the Disciplines: Understanding How God Changes Lives,"How to Live as Jesus LivedDallas Willard, one of today's most brilliant Christian thinkers and author of The Divine Conspiracy (Christianity Today's 1999 Book of the Year), presents a way of living that enables ordinary men and women to enjoy the fruit of the Christian life. He reveals how the key to self-transformation resides in the practice of the spiritual disciplines, and how their practice affirms human life to the fullest. The Spirit of the Disciplines is for everyone who strives to be a disciple of Jesus in thought and action as well as intention."
,,,,,12111.0,0.196,,All Rivers Run to the Sea,"In this first volume ofÂ his two-volume autobiography, Wiesel takes us from his childhood memories of a traditional and loving Jewish family in theÂ Romanian village of Sighet through the horrors of Auschwitz and Buchenwald and the years of spiritual struggle, to his emergence asÂ a witness for the Holocaust's martyrs and survivors andÂ for the State of Israel, and as a spokesman for humanity.Â  With 16 pages of black-and-white photographs.""From the abyss of the death campsÂ Wiesel has come as a messenger to mankind--not with a message of hate and revenge, but with one of brotherhood and atonement.""--From the citation for the 1986 Nobel Peace Prize"
,,,,,11305.0,0.196,,How to Live on 24 Hours a Day,"You have to live on twenty-four hours of daily time. Out of it you have to spin health, pleasure, money, content, respect, and the evolution of your immortal soul. This timeless classic is one of the first self-help books ever written and was a best-seller in both England and America. It remains as useful today as when it was written, and offers fresh and practical advice on how to make the most of the daily miracle of life."
,,,,,2489.0,0.196,,Mann Chalay Ka Sauda / ÙÙ ÚÙÛ Ú©Ø§ Ø³ÙØ¯Ø§,"An unforgettable spiritual journey! Undoubtedly, one of Ashfaq Ahmed's greatest works of literature. This drama will move you, inspire you, and probably even change your life."
,,,,,13311.0,0.196,,Journey to Virginland - Epistle 1,"Brimming with black humor and piercing satire, at turns picaresque and epistolary, Journey to Virginland explores the breakneck paradigm shifts of the 21st century, navigating through the morass with the guidance of Dog, the novel's loutish yet wise antihero. Through a devilishly iconoclastic story line, Dog parses the key cultural and religious failures that have made for a world held hostage by hyper-capitalism, consumerism, and post-9/11 realpolitik on the one hand, and an ominous resurgence of nationalism and religious extremism on the other.Yet far from basking in a prospect of doom, Dog embarks on an impassioned quest for identity and meaning, ultimately proposing an exuberant, decidedly life-affirming vision of human transformation.With its vibrant style, kaleidoscopic yet highly calibrated thematic diversity, and, ultimately, unfettered sense of humanity, Journey to Virginland establishes itself as a groundbreaking literary enterprise and a true original."
,,,,,9761.0,0.195,,Flow: The Psychology of Optimal Experience,"Psychologist Mihaly Csikszentmihalyi's investigations of ""optimal experience"" have revealed that what makes an experience genuinely satisfying is a state of consciousness called flow. During flow, people typically experience deep enjoyment, creativity, and a total involvement with life. Csikszentmihalyi demonstrates the ways this positive state can be controlled, not just left to chance. Flow: The Psychology of Optimal Experience teaches how, by ordering the information that enters our consciousness, we can discover true happiness, unlock our potential, and greatly improve the quality of our lives."
,,,,,9144.0,0.195,,The Annabran Rosary,"Experience the genius of the Annabran Rosary with enchanting pictorial accompaniments in this illustrated special edition. The Annabran Rosary is a sacred part of the revealed scripture of the Annabran religion, Annabran Documents, The Holy Book of Pantheism. It is here magnificently presented with visual meditations for each line. Enjoy the revelatory splendour of the Annabran Rosary here combined with exquisite images that visualise its divine meanings. Sacred to all Annabrans, the Annabran Rosary can now be seen as well as read in this delightful devotional suitable for spiritual pleasure and nourishment, meditation purposes and educational development in the Annabran religion for all ages."
,,,,,10987.0,0.195,,Tippy the Knight,"When Tippy the Knight was first written in the early 13th century, the Gramoan Continent wasnât ready for erotic stories in this period. The authorâs tales managed to survive to the present day but were mostly forgotten. Her characters and world were stolen, sanitized, and made into a series of childrenâs books about a bumbling, clumsy Knight.This is the real Tippy that was intended to be read about. He lives in a world of shifters, dragons, magic, war, and dark delights.When Etinne is locked up in a tower, she expects her husband, Tippy, to come for her. Heâll do it, but maybe not for the reason she thinks. Anyone who threatens his first, true love will face suffering and death.This is a male dragon shifter/human pairing with a HEA. It contains dark, explicit material and is only intended for mature readers."
,,,,,12341.0,0.195,,The Lies of Locke Lamora,"An orphanâs life is harshâand often shortâin the mysterious island city of Camorr. But young Locke Lamora dodges death and slavery, becoming a thief under the tutelage of a gifted con artist. As leader of the band of light-fingered brothers known as the Gentleman Bastards, Locke is soon infamous, fooling even the underworldâs most feared ruler. But in the shadows lurks someone still more ambitious and deadly. Faced with a bloody coup that threatens to destroy everyone and everything that holds meaning in his mercenary life, Locke vows to beat the enemy at his own brutal gameâor die trying."
,,,,,5354.0,0.194,,Infinite Jest,"A gargantuan, mind-altering tragi-comedy about the Pursuit of Happiness in America. Set in an addicts' halfway house and a tennis academy, and featuring the most endearingly screwed-up family to come along in recent fiction, Infinite Jest explores essential questions about what entertainment is and why it has come to so dominate our lives; about how our desire for entertainment affects our need to connect with other people; and about what the pleasures we choose say about who we are. Equal parts philosophical quest and screwball comedy, Infinite Jest bends every rule of fiction without sacrificing for a moment its own entertainment value. It is an exuberant, uniquely American exploration of the passions that make us humanâand one of those rare books that renew the idea of what a novel can do."
,,,,,6221.0,0.194,,Black Cross,"It is January 1944 â and as Allied troops prepare for D-day, Nazi scientists develop a toxic nerve gas that will repel and wipe out any invasion force. To salvage the planned assault, two vastly different but equally determined men are sent to infiltrate the secret concentration camp where the poison gas is being perfected on human subjects. Their only objective: destroy all traces of the gas and the men who created it â no matter how many lives may be lost...including their own.Stunning....From the very first page, Greg Iles takes his readers on an emotional roller-coaster ride, juxtaposing tension-filled action scenes, horrifying depictions of savage cruelty, and heart-stopping descriptions of sacrifice and bravery. A remarkable story from a remarkable writer.â â Booklist"
,,,,,9994.0,0.194,,Wildflower,"Wildflower is a portrait of Drew's life in stories as she looks back on the adventures, challenges, and incredible experiences of her earlier years. It includes tales of living on her own at 14 (and how laundry may have saved her life), getting stuck in a gas station overhang on a cross country road trip, saying goodbye to her father in a way only he could have understood, and many more adventures and lessons that have led her to the successful, happy, and healthy place she is today."
,,,,,8598.0,0.194,,Venture: A Collection of True Microfinance Stories,"Venture is a rich and readable collection of true microfinance stories. It is written for anyone who would like to better understand the realities faced by the the aspiring middle class in the world's least developed countries, the range of factors that affect their prospects for working their way out of poverty, and how microfinance can impact their lives.The entrepreneurs featured in this book are all members of Zidisha Microfinance, a web-based crowdfunding platform that allows low-income, computer-savvy entrepreneurs in developing countries to share their stories and negotiate microloans directly with individual lenders. As the world's first person-to-person lending service to eliminate intermediaries and connect individual web users and entrepreneurs across the international wealth divide, Zidisha is uniquely positioned to offer an undistorted depiction of the variety of individual stories and circumstances that come to play each time a microfinance loan is disbursed.Each story paints an unforgettable picture: A seventy-year-old goat farmer who relocates his home to better care for his ailing father, carrying the sticks and metal sheeting it was made from across the mountains on his back. A plump, beaming detergent saleslady who lives in a home no larger than an ordinary bathroom but has adopted five orphans. A cancer survivor who supports herself and two children by pounding millet for $1.58 per day. An irrepressible lady who supplies half of her neighborhood with much-needed IVs and other medical supplies by day, and by night checks into the local cybercafe to chat with Facebook friends on the other side of the world. A young man who has no arms but insists on working to support his able-bodied parents out of filial duty. An accounting student who pays for his university tuition by purchasing a taxi and splitting proceeds with a hired driver. A bright young lady who renounces college to care for her orphaned siblings and overcomes gender stereotypes to launch a thriving construction business.At its heart, Venture is a tribute to the remarkable community of Zidisha Microfinance entrepreneurs and countless others like them - a tribute to their grit, ambition and indomitable spirit in the face of overwhelming obstacles. We hope this book will help translate the statistics about poverty and the opportunities afforded by microfinance into human terms, and inspire readers to reach out and connect with their counterparts on the other side of the international wealth divide."
,,,,,11086.0,0.194,,Way to Be!: 9 Ways To Be Happy And Make Something Of Your Life,"From one of the world's foremost spiritual leaders, an inspiring book that provides young adults and their parents with a game plan for leading a better life.This inspiring, upbeat, life-affirming book shows teenagers and their families how to navigate through the moral minefields of contemporary life and how to truly enjoy the opportunities and blessings that the modern world has to offer.Drawing upon his faith as well as his personal experience, Gordon B. Hinckley provides his readers with a game plan for discovering and embracing the things in life that are valuable and worthwhile. He shows how our lives are shaped by the decisions we make every day about personal behavior -- and he shows how to make the right decisions with the help of nine guiding principles.With its vivid anecdotes, invaluable precepts, and timeless wisdom, Way to Be! will be a source of both inspiration and practical advice for young people everywhere who want to lead better, fuller, more satisfying lives."
,,,,,6591.0,0.194,,The Hour I First Believed,"Wally Lamb's two previous novels, She's Come Undone and I Know This Much Is True, struck a chord with readers. They responded to the intensely introspective nature of the books, and to their lively narrative styles and biting humor. In The Hour I First Believed, Lamb travels well beyond his earlier work and embodies in his fiction myth, psychology, family history stretching back many generations, and the questions of faith that lie at the heart of everyday life. The result is an extraordinary tour de force, at once a meditation on the human condition and an unflinching yet compassionate evocation of character.When forty-seven-year-old high school teacher Caelum Quirk and his younger wife, Maureen, a school nurse, move to Littleton, Colorado, they both get jobs at Columbine High School. In April 1999, Caelum returns home to Three Rivers, Connecticut, to be with his aunt who has just had a stroke. But Maureen finds herself in the school library at Columbine, cowering in a cabinet and expecting to be killed, as two vengeful students go on a carefully premeditated, murderous rampage. Miraculously she survives, but at a cost: she is unable to recover from the trauma. Caelum and Maureen flee Colorado and return to an illusion of safety at the Quirk family farm in Three Rivers. But the effects of chaos are not so easily put right, and further tragedy ensues. While Maureen fights to regain her sanity, Caelum discovers a cache of old diaries, letters, and newspaper clippings in an upstairs bedroom of his family's house. The colorful and intriguing story they recount spans five generations of Quirk family ancestors, from the Civil War era to Caelum's own troubled childhood. Piece by piece, Caelum reconstructs the lives of the women and men whose legacy he bears. Unimaginable secrets emerge; long-buried fear, anger, guilt, and grief rise to the surface. As Caelum grapples with unexpected and confounding revelations from the past, he also struggles to fashion a future out of the ashes of tragedy. His personal quest for meaning and faith becomes a mythic journey that is at the same time quintessentially contemporary -- and American.The Hour I First Believed is a profound and heart-rending work of fiction. Wally Lamb proves himself a virtuoso storyteller, assembling a variety of voices and an ensemble of characters rich enough to evoke all of humanity."
,,,,,6383.0,0.194,,Halo: Contact Harvest,"This is how it began...It is the year 2524. Harvest is a peaceful, prosperous farming colony on the very edge of human-controlled space. But we have trespassed on holy ground--strayed into the path of an aggressive alien empire known as the Covenant. What begins as a chance encounter between an alien privateer and a human freighter catapults mankind into a struggle for its very existence.But humanity is also locked in a bitter civil war known as the Insurrection. So the survival of Harvest's citizens falls to a squad of battle-weary UNSC Marines and their inexperienced colonial militia trainees. In this unlikely group of heroes, one stands above the rest...a young Marine staff sergeant named Avery Johnson."
,,,,,10414.0,0.194,,The Bhagavad Gita,"The Bhagavad Gita is an early epic poem that recounts the conversation between Arjuna the warrior and his charioteer Krishna, the manifestation of God. In the moments before a great battle, the dialogue sets out the important lessons Arjuna must learn to change the outcome of the war he is to fight, and culminates in Krishna revealing to the warrior his true cosmic form, counselling him to search for the universal perfection of life. Ranging from instructions on yoga postures to dense moral discussion, the Gita is one of the most important Hindu texts, as well as serving as a practical guide to living well."
,,,,,3363.0,0.193,,Dandelion Man the four loves,"It was that darn song, the one tied so closely to the memory that initiated the neural flash, one triggering another, setting in motion an irrepressible yearning. Should he? Could he? Would it be worth it? Dandelion Man is a nostalgic romp that delights in the four loves and the struggles of choice.""The story is both powerful and interesting."" CatholicFiction.net""As we search for love, we enter tangled webs of life and living. Dandelion Man - the four loves is a novel about relationships throughout the 1960s and 1970s and across generations... Enticing with a dedication to a very different era, 'Dandelion Man' is well worth considering for general fiction collections."" MaryCowper Midwest Book Review"
,,,,,7856.0,0.193,,The Odessa File,"The suicide of an elderly German Jew explodes into revelation after revelation: a Mafia-like organization called Odessa, a real-life fugitive known at the ""Butcher of Riga"", a young German journalist turned obsessed avenger...and ultimately, of a brilliant, ruthless plot to reestablish the worldwide power of SS mass murders and to carry out Hitler's chilling ""Final Solution."""
,,,,,8947.0,0.193,,Use of Weapons,"The man known as Cheradenine Zakalwe was one of Special Circumstances' foremost agents, changing the destiny of planets to suit the Culture through intrigue, dirty tricks and military action.The woman known as Diziet Sma had plucked him from obscurity and pushed him towards his present eminence, but despite all their dealings she did not know him as well as she thought.The drone known as Skaffen-Amtiskaw knew both of these people. It had once saved the woman's life by massacring her attackers in a particularly bloody manner. It believed the man to be a lost cause. But not even its machine could see the horrors in his past.Ferociously intelligent, both witty and horrific, USE OF WEAPONS is a masterpiece of science fiction."
