algorithm,elapsed_time,iterations_done,total_iterations,iterations_per_second,book_index,similarity_score,,book_title,recommended_description
,,,,,9432.0,0.094,,Always Look on the Bright Side of Life: A Sortabiography,"We know him best for his unforgettable roles on Monty Python - from the Flying Circus to The Meaning of Life. Now, Eric Idle reflects on the meaning of his own life in this entertaining memoir that takes us on an unforgettable journey from his childhood in an austere boarding school through his successful career in comedy, television, theater, and film. Coming of age as a writer and comedian during the Sixties and Seventies, Eric stumbled into the crossroads of the cultural revolution and found himself rubbing shoulders with the likes of George Harrison, David Bowie, and Robin Williams, all of whom became dear lifelong friends. With anecdotes sprinkled throughout involving other close friends and luminaries such as Mike Nichols, Mick Jagger, Steve Martin, Paul Simon, Lorne Michaels, and many more, as well as the Pythons themselves, Eric captures a time of tremendous creative output with equal parts hilarity and heart. In Always Look on the Bright Side of Life, named for the song he wrote for Life of Brian (the film which he originally gave the irreverent title Jesus Christ: Lust for Glory) and that has since become the number one song played at funerals in the UK, he shares the highlights of his life and career with the kind of offbeat humor that has delighted audiences for five decades. The year 2019 marks the fiftieth anniversary of The Pythons, and Eric is marking the occasion with this hilarious memoir chock full of behind-the-scenes stories from a high-flying life featuring everyone from Princess Leia to Queen Elizabeth."
,,,,,8253.0,0.094,,The Kindly Ones,"Named one of the ""100 Best Books of the Decade"" by The Times of London   ""Oh my human brothers, let me tell you how it happened.""    A former Nazi officer, Dr. Maximilien Aue has reinvented himself, many years after the war, as a middle-class family man and factory owner in France. An intellectual steeped in philosophy, literature, and classical music, he is also a cold-blooded assassin and the consummate bureaucrat. Through the eyes of this cultivated yet monstrous man we experience in disturbingly precise detail the horrors of the Second World War and the Nazi genocide of the Jews. Eichmann, Himmler, GÃ¶ring, Speer, Heydrich, HÃ¶ssâeven Hitler himselfâplay a role in Max's story. An intense and hallucinatory historical epic, The Kindly Ones is also a morally challenging read. It holds a mirror up to humanityâand the reader cannot look away."
,,,,,10544.0,0.094,,Immortality,"This breathtaking, reverberating survey of human nature finds Kundera still attempting to work out the meaning of life, without losing his acute sense of humour. It is one of those great unclassifiable masterpieces that appear once every twenty years or so.'It will make you cleverer, maybe even a better lover. Not many novels can do that.' Nicholas Lezard, GQ"
,,,,,10968.0,0.094,,Reimagined: How amazing people design lives they love,"Wonderful lives don't simply happen...Whether you're just getting started, are retiring, or are somewhere in between, the design of your life determines the quality of the life you'll experience. There are no exceptions to this rule. The problem is we're never taught about life, how it works, and how it can be shaped and designed. Perhaps this is why less than one percent of all people experience lives they love.So, if the good life isn't about money, fame, or the floor your office is on, what's it really about? Ian Breck, pioneering life researcher and life quality expert, takes you on a remarkable journey behind the scenes of life and living that will change the way you experience yours forever.Ian explores amazing lives from a unique perspective - from over 25 years of researching those who live them. Ian's groundbreaking work now drives a concise learning experience that empowers you to reimagine, redesign, and live the life you've always dreamed about in practical ways that are easily understandable and actionable. It's not nebulous methodology, new-age thinking, or a multi-step program. It's the true science and behaviors that define life and living.In this book, you'll discover and explore...* Life and life quality understandings you never knew about* Essential life skills required to discover, design, create, and maintain amazing life quality* 12 features people who live remarkable lives share* How to design a life around your passions and interests* How to understand many of life's most sophisticated challenges* How to reimagine your own life and create a powerful plan to live it amazingly* Interactive exercises that allow you to experience lessons from this book within the context of your own life* and much more!If you've ever wanted to reimagine and redesign your life, this book is the missing manual you've been looking for!The great news is that an exceptional, satisfying, and meaningful life is within your grasp - providing you understand life basics, and are willing to become creative with your own life's design. This book provides the knowledge, expertise, and insight you need to get there."
,,,,,10457.0,0.093,,Arrangement in Black and White,"She's white; he's black. But their conflicts are more than racial. Margy's from Iowa, an artist, the product of an abusive mother and neglectful father. Everet's from Connecticut, a civil rights lawyer on the rise toward greater recognition, and their lives take a tense turn when he decides to run for political office just as Margy moves forward in her own career. Arrangement in Black and White captures the conflicts that give edge and interest to all meaningful love stories, yet it does so with an eye toward modern women, interracial politics, and the human inability to balance passion with social, public life. It is a powerful story for contemporary readers."
,,,,,12593.0,0.093,,I Am That: Talks with Sri Nisargadatta Maharaj,"This collection of the timeless teachings of one of the greatest sages of India, Sri Nisargadatta Maharaj, is a testament to the uniqueness of the seer's life and work and is regarded by many as a ""modern spiritual classic"".I Am That preserves Maharaj's dialogues with the followers who came from around the world seeking his guidance in destroying false identities. The sage's sole concern was with human suffering and the ending of suffering. It was his mission to guide the individual to an understanding of his true nature and the timelessness of being. He taught that mind must recognize and penetrate its own state of being, ""being this or that, here or that, then or now,"" but just timeless being."
,,,,,12829.0,0.093,,The Path Made Clear: Discovering Your Life's Direction and Purpose,"Everyone has a purpose. And, according to Oprah Winfrey, ""Your real job in life is to figure out as soon as possible what that is, who you are meant to be, and begin to honor your calling in the best way possible.""That journey starts right here.In her latest book, The Path Made Clear, Oprah shares what she sees as a guide for activating your deepest vision of yourself, offering the framework for creating not just a life of success, but one of significance. The book's ten chapters are organized to help you recognize the important milestones along the road to self-discovery, laying out what you really need in order to achieve personal contentment, and what life's detours are there to teach us.Oprah opens each chapter by sharing her own key lessons and the personal stories that helped set the course for her best life. She then brings together wisdom and insights from luminaries in a wide array of fields, inspiring readers to consider what they're meant to do in the world and how to pursue it with passion and focus. These renowned figures share the greatest lessons from their own journeys toward a life filled with purpose.Paired with over 100 awe-inspiring photographs to help illuminate the wisdom of these messages, The Path Made Clear provides readers with a beautiful resource for achieving a life lived in service of your calling - whatever it may be."
,,,,,12692.0,0.092,,"The Way of the Superior Man: A Spiritual Guide to Mastering the Challenges of Women, Work, and Sexual Desire","The Ultimate Spiritual Guide for MenWhat is your true purpose in life? What do women really want? What makes a good lover? If you're a man reading this, you've undoubtedly asked yourself these questionsâbut you may not have had much luck answering them. Until now.In The Way of the Superior Man, David Deida explores the most important issues in men's livesâfrom career and family to women and intimacy to love and spirituality and relationshipsâto offer a practical guidebook for living a masculine life of integrity, authenticity, and freedom. Join this bestselling author and internationally renowned expert on sexual spirituality for straightforward advice, empowering skills, body practices, and more to help you realize a life of fulfillment, immediately and without compromise.""It is time to evolve beyond the macho jerk ideal, all spine and no heart,"" writes David Deida. ""It is also time to evolve beyond the sensitive and caring wimp ideal, all heart and no spine."" The Way of the Superior Man presents the ultimate challengeâand rewardâfor today's man: to discover the 'unity of heart and spine' through the full expression of consciousness and love in the infinite openness of the present moment.ContentsPart One: A Man's Way Part Two: Dealing With Women Part Three: Working With Polarity and Energy Part Four: What Women Really Want Part Five: Your Dark Side Part Six: Feminine Attractiveness Part Seven: Body Practices Part Eight: Men's and Women's Yoga of IntimacyExcerpt: This book is a guide for a specific kind of newly evolving man. This man is unabashedly masculineâhe is purposeful, confident, and directed, living his chosen way of life with deep integrity and humorâand he is sensitive, spontaneous, and spiritually alive, with a heart-commitment to discovering and living his deepest truth."
