algorithm,elapsed_time,iterations_done,total_iterations,iterations_per_second,book_index,similarity_score,,book_title,recommended_description
,,,,,12287.0,0.109,,Start with Why: How Great Leaders Inspire Everyone to Take Action,"Why do you do what you do?Why are some people and organizations more innovative, more influential, and more profitable than others? Why do some command greater loyalty from customers and employees alike? Even among the successful, why are so few able to repeat their success over and over?People like Martin Luther King Jr., Steve Jobs, and the Wright Brothers might have little in common, but they all started with why. It was their natural ability to start with why that enabled them to inspire those around them and to achieve remarkable things.In studying the leaders who've had the greatest influence in the world, Simon Sinek discovered that they all think, act, and communicate in the exact same wayâand it's the complete opposite of what everyone else does. Sinek calls this powerful idea The Golden Circle, and it provides a framework upon which organizations can be built, movements can be lead, and people can be inspired. And it all starts with WHY.Any organization can explain what it does; some can explain how they do it; but very few can clearly articulate why. WHY is not money or profitâthose are always results. WHY does your organization exist? WHY does it do the things it does? WHY do customers really buy from one company or another? WHY are people loyal to some leaders, but not others?Starting with WHY works in big business and small business, in the nonprofit world and in politics. Those who start with WHY never manipulate, they inspire. And the people who follow them don't do so because they have to; they follow because they want to.Drawing on a wide range of real-life stories, Sinek weaves together a clear vision of what it truly takes to lead and inspire. This book is for anyone who wants to inspire others or who wants to find someone to inspire them."
,,,,,2115.0,0.105,,The Art of Work,"Jeff Goins, a brilliant new voice counting Seth Godin and Jon Acuff among his fans, explains how to abandon the status quo and live a life that matters with true passion and purpose.The path to your life's work is difficult and risky, even scary, which is why few finish the journey. This is a book about discovering your life's work, that treasure of immeasurable worth we all long for. Its about the task you were born to do. As Jeff Goins explains, the search begins with passion but does not end there. Only when our interests connect with the needs of the world do we begin living for a larger purpose. Those who experience this intersection experience something exceptional and enviable. Though it is rare, such a life is attainable by anyone brave enough to try. Through personal experience, compelling case studies, and current research on the mysteries of motivation and talent, Jeff shows readers how to find their vocation and what to expect along the way."
,,,,,11069.0,0.104,,The Urantia Book,"You have just discovered the literary masterpiece that answers your questions about God, life in the inhabited universe, the history and future of this world, and the life of Jesus. The Urantia Book harmonizes history, science, and religion into a philosophy of living that brings new meaning and hope into your life. If you are searching for answers, read The Urantia Book! The world needs new spiritual truth that provides modern men and women with an intellectual pathway into a personal relationship with God. Building on the world's religious heritage, The Urantia Book describes an endless destiny for humankind, teaching that living faith is the key to personal spiritual progress and eternal survival. These teachings provide new truths powerful enough to uplift and advance human thinking and believing for the next 1000 years. A third of The Urantia Book is the inspiring story of Jesus' entire life and a revelation of his original teachings. This panoramic narrative includes his birth, childhood, teenage years, adult travels and adventures, public ministry, crucifixion, and 19 resurrection appearances. This inspiring story recasts Jesus from the leading figure of Christianity into the guide for seekers of all faiths and all walks of life."
,,,,,12134.0,0.103,,The Manchurian Candidate,"When its real, Conspiracy is no longer a theory"
,,,,,10902.0,0.103,,Mentor Me: GA=T+EâA Formula to Fulfill Your Greatest Achievement,"Mentor Me: GA=T+EâA Formula to Fulfill Your Greatest Achievement"" is a working, living dossier, as well as a journey to help people formulate and attain their Greatest Achievement in life.The author, Ken Poirot, integrates successful coaching strategies, lessons learned from life, and his eighteen-year career in financial services, to take you through an uplifting path of self-discovery and intuitive introspection. Through interactive exercises, personal stories, observations, and information gleaned from advanced training, he delivers knowledge everyone can utilize to improve their everyday lives.Are you ready to create and take action on your plan for happiness and success? Then you can have the social experience of living a motivational, inspirational, and influential life. Read along and see for yourself..."
,,,,,1427.0,0.103,,Lessons From Landon: Through the Seasons of Life,Morsels of a well-lived life are interfused in this collection of stories about a father and the lessons he has learned from his son who has special needs.
,,,,,672.0,0.102,,The Pilgrim's Progress,"This famous story of man's progress through life in search of salvation remains one of the most entertaining allegories of faith ever written. Set against realistic backdrops of town and country, the powerful drama of the pilgrim's trials and temptations follows him in his harrowing journey to the Celestial City.Along a road filled with monsters and spiritual terrors, Christian confronts such emblematic characters as Worldly Wiseman, Giant Despair, Talkative, Ignorance, and the demons of the Valley of the Shadow of Death. But he is also joined by Hopeful and Faithful.An enormously influential 17th-century classic, universally known for its simplicity, vigor, and beauty of language, The Pilgrim's Progress remains one of the most widely read books in the English language."
,,,,,12823.0,0.101,,The Lost Wife,"There on her forearm, next to a small brown birthmark, were six tattooed numbers. 'Do you remember me now?' he asked, trembling. She looked at him again, as if giving weight and bone to a ghost. 'Lenka, it's me,' he said. 'Josef. Your husband.' During the last moments of calm in prewar Prague, Lenka, a young art student, falls in love with Josef. They marry - but soon, like so many others, they are torn apart by the currents of war. In America Josef becomes a successful obstetrician and raises a family, though he never forgets the wife he thinks died in the camps. But in the Nazi ghetto of Terez??n - and later in Auschwitz - Lenka has survived, relying on her skills as an artist and the memories of a husband she believes she will never see again. Now, decades later, an unexpected encounter in New York brings Lenka and Josef back together. From the comfort of life in Prague before the occupation to the horrors of Nazi Europe, The Lost Wife explores the endurance of first love, the resilience of the human spirit and our capacity to remember."
,,,,,7700.0,0.101,,The Elite,"The Selection began with thirty-five girls. Now with the group narrowed down to the six Elite, the competition to win Prince Maxon's heart is fiercer than everâand America is still struggling to decide where her heart truly lies. Is it with Maxon, who could make her life a fairy tale? Or with her first love, Aspen?America is desperate for more time. But the rest of the Elite know exactly what they wantâand America's chance to choose is about to slip away."
,,,,,12164.0,0.1,,The Evolving Self: A Psychology for the Third Millennium,"The author of the bestselling Flow (more than 125,000 copies sold) offers an intelligent, inspiring guide to life in the future.In this wise, humane inquiry, Csikszentmihalyi (Flow: The Psychology of Optimal Experience) argues that genetically programmed behaviors that once helped humans adapt and multiply now threaten our survival. These traits include obsessions with food and sex, addiction to pleasure, excessive rationality and a tendency to focus on the negative. A University of Chicago psychology professor, the author also believes we must free our minds of cultural illusions such as ethnocentric superiority or identification with one's possessions. He urges readers to find ways to reduce the oppression, exploitation and inequality that are woven into the fabric of society. Further, he wants us to control the direction of human evolution by pursuing challenging activities that lead to greater complexity while opposting chaos and conformity. Each chapter concludes with self-help questions and mental exercises designed to help readers apply the insights of this literate manifesto to their daily lives."
,,,,,6875.0,0.098,,A Clockwork Orange,"In Anthony Burgess's influential nightmare vision of the future, criminals take over after dark. Teen gang leader Alex narrates in fantastically inventive slang that echoes the violent intensity of youth rebelling against society. Dazzling and transgressive, A Clockwork Orange is a frightening fable about good and evil and the meaning of human freedom. This edition includes the controversial last chapter not published in the first edition, and Burgessâs introduction, âA Clockwork Orange Resucked.â"
,,,,,1868.0,0.098,,An Average Joe's Pursuit for Financial Freedom: Change Your Perception of Money,An Average Joeâs Pursuit for Financial Freedom offers a different perspective on money than what is traditionally taught by our parents and in our school systems. The reason there is such a discrepancy between the wealthy and the poor is due to the difference in the way money is perceived. We are not born with the ability to maintain wealth: it is something that is learned. The knowledge of knowing how to make money work to generate passive income is something that anyone can learn as long as they are disciplined. An Average Joeâs Pursuit for Financial Freedom is based on practical concepts and discusses the problems that the majority of us face with our personal finance. The concepts in this book are based on theory by an author that practices what he writes about.
,,,,,10073.0,0.098,,Are We Rome?: The Fall of an Empire and the Fate of America,"Offers a compelling study that compares modern-day America to the rise and fall of ancient Rome, offering a series of warnings, nuanced lessons, and thought-provoking strategies designed to avoid the Roman Empire's fate."
,,,,,10804.0,0.098,,Leadership Lessons From Mom,"Learn the impact that a mother makes in the lessons taught through childhood and adults that creates the leaders of today. ""Leadership Lessons From Mom"" demonstrates the key impacts of teaching leadership lessons and how they relate to today's business environment.  Leadership Lessons From Mom is one mans story of the impact of the lessons learned throughout his lifetime from his mothers teaching. The lessons demonstrate a loving mothers concern and determination to teach the values of good character that sustain her son through the challenges of life, business and adulthood. The author correlates the lessons to business leadership and is a testament of the impact that all mothers make."
,,,,,829.0,0.097,,Being Mortal: Medicine and What Matters in the End,"In Being Mortal, author Atul Gawande tackles the hardest challenge of his profession: how medicine can not only improve life but also the process of its endingMedicine has triumphed in modern times, transforming birth, injury, and infectious disease from harrowing to manageable. But in the inevitable condition of aging and death, the goals of medicine seem too frequently to run counter to the interest of the human spirit. Nursing homes, preoccupied with safety, pin patients into railed beds and wheelchairs. Hospitals isolate the dying, checking for vital signs long after the goals of cure have become moot. Doctors, committed to extending life, continue to carry out devastating procedures that in the end extend suffering.Gawande, a practicing surgeon, addresses his profession's ultimate limitation, arguing that quality of life is the desired goal for patients and families. Gawande offers examples of freer, more socially fulfilling models for assisting the infirm and dependent elderly, and he explores the varieties of hospice care to demonstrate that a person's last weeks or months may be rich and dignified."
,,,,,485.0,0.097,,21 Lessons for the 21st Century,"In Sapiens, he explored our past. In Homo Deus, he looked to our future. Now, one of the most innovative thinkers on the planet turns to the present to make sense of today's most pressing issues.How do computers and robots change the meaning of being human? How do we deal with the epidemic of fake news? Are nations and religions still relevant? What should we teach our children?Yuval Noah Harari's 21 Lessons for the 21st Century is a probing and visionary investigation into today's most urgent issues as we move into the uncharted territory of the future. As technology advances faster than our understanding of it, hacking becomes a tactic of war, and the world feels more polarized than ever, Harari addresses the challenge of navigating life in the face of constant and disorienting change and raises the important questions we need to ask ourselves in order to survive.In twenty-one accessible chapters that are both provocative and profound, Harari builds on the ideas explored in his previous books, untangling political, technological, social, and existential issues and offering advice on how to prepare for a very different future from the world we now live in: How can we retain freedom of choice when Big Data is watching us? What will the future workforce look like, and how should we ready ourselves for it? How should we deal with the threat of terrorism? Why is liberal democracy in crisis?Harari's unique ability to make sense of where we have come from and where we are going has captured the imaginations of millions of readers. Here he invites us to consider values, meaning, and personal engagement in a world full of noise and uncertainty. When we are deluged with irrelevant information, clarity is power. Presenting complex contemporary challenges clearly and accessibly, 21 Lessons for the 21st Century is essential reading."
,,,,,11067.0,0.097,,Hegemony or Survival: America's Quest for Global Dominance,"An immediate national bestseller, Hegemony or Survival demonstrates how, for more than half a century the United States has been pursuing a grand imperial strategy with the aim of staking out the globe. Our leaders have shown themselves willing-as in the Cuban missile crisis-to follow the dream of dominance no matter how high the risks. World-renowned intellectual Noam Chomsky investigates how we came to this perilous moment and why our rulers are willing to jeopardize the future of our species.With the striking logic that is his trademark, Chomsky tracks the U.S. government's aggressive pursuit of ""full spectrum dominance"" and vividly lays out how the most recent manifestations of the politics of global control-from unilateralism to the dismantling of international agreements to state terrorism-cohere in a drive for hegemony that ultimately threatens our existence. Lucidly written, thoroughly documented, and featuring a new afterword by the author, Hegemony or Survival is a definitive statement from one of today's most influential thinkers."
,,,,,12239.0,0.096,,To Live and Drink in L.A.,"If David Sedaris, Chelsea Handler, and Charles Bukowski had ever consummated a threesome, the result would most likely be Shawn Michals, the protagonist of TO LIVE AND DRINK IN L.A. This series of semi-autobiographical stories follows Shawn as he moves from the Midwest to Los Angeles, and deals with topics such as his stubborn refusal to own either a car or a cellphone, his use of pro wrestling to deal with his manic-depressive motherâs suicide, finding meaning in menial jobs, and many other adventures. Like Shawn often does, readers of this work may find themselves in uncharted territory, while at the same time discovering how one can learn lessons and experience growth in the most unlikely of places, even in a city many people believe to be shallower than a puddle. If a phone call from a telemarketer can lead to spearheading a march on the Pentagon, as it does for Shawn, anything is possible in the City of Angels. Cheers. âBen Peller has a fine eye and a wonderful ear, but most of all and best of all, he writes with his heart.â - Bob Greene, best-selling author of BE TRUE TO YOUR SCHOOL"
,,,,,7917.0,0.095,,Maybe You Should Talk to Someone,"From a psychotherapist, and national advice columnist comes a thought-provoking new book that takes us behind the scenes of a therapist's world -- where her patients are looking for answers (and so is she). One day, Lori Gottlieb is a therapist who helps patients in her Los Angeles practice. The next, a crisis causes her world to come crashing down. Enter Wendell, the quirky but seasoned therapist in whose office she suddenly lands. With his balding head, cardigan, and khakis, he seems to have come straight from Therapist Central Casting. Yet he will turn out to be anything but. As Gottlieb explores the inner chambers of her patients' lives -- a self-absorbed Hollywood producer, a young newlywed diagnosed with a terminal illness, a senior citizen threatening to end her life on her birthday if nothing gets better, and a twenty-something who can't stop hooking up with the wrong guys -- she finds that the questions they are struggling with are the very ones she is now bringing to Wendell. With startling wisdom and humor, Gottlieb invites us into her world as both clinician and patient, examining the truths and fictions we tell ourselves and others as we teeter on the tightrope between love and desire, meaning and mortality, guilt and redemption, terror and courage, hope and change.Maybe You Should Talk to Someone is revolutionary in its candor, offering a deeply personal yet universal tour of our hearts and minds and providing the rarest of gifts: a boldly revealing portrait of what it means to be human, and a disarmingly funny and illuminating account of our own mysterious lives and our power to transform them."
,,,,,9002.0,0.095,,A Million Miles in a Thousand Years: What I Learned While Editing My Life,"Full of beautiful, heart-wrenching, and hilarious stories, A Million Miles in a Thousand Years details one man's opportunity to edit his life as if he were a character in a movie.Years after writing his best-selling memoir, Donald Miller went into a funk and spent months sleeping in and avoiding his publisher. One story had ended, and Don was unsure how to start another.But he gets rescued by two movie producers who want to make a movie based on his memoir. When they start fictionalizing Don's life for film--changing a meandering memoir into a structured narrative--the real-life Don starts a journey to edit his actual life into a better story. A Million Miles in a Thousand Years details that journey and challenges readers to reconsider what they strive forÂ in life. It shows how to get a second chance atÂ life theÂ first time around."
,,,,,2046.0,0.095,,Siddhartha,Siddhartha is a novel that deals with the spiritual journey of a boy known as Siddhartha from the Indian subcontinent during the time of the Buddha.
,,,,,8654.0,0.094,,The Bachelor Farmers,"The Bachelor Farmers is a story about two Norwegian brothers who learn the meaning of love from a most unlikely source. Hans and Jon, the youngest of four immigrant brothers have just inherited land from their recently deceased father. They set out to develop the land, thus perpetuating the family dream of success in America. When Jon learns that the husband of Mahal, a beautiful half-breed Ojibwa woman has been injured on their property and cannot work, Jon hires her and brings her home. Under the eye of his disapproving brother, Jon finds himself falling in love, but when a terrible blizzard blows into town without warning, the three of them must deal with the consequences, and Mahal is forced to make a decision that reshapes their lives in profound and unimaginable ways. The Bachelor Farmers takes us into a world where true meaning and healing are found in the complexity of human relationships and dreams of a better life fuel a family's drive for success."
,,,,,5394.0,0.094,,Forward the Foundation,"Librarian's Note: Alternate cover for this ISBN can be found hereHere, from a grand master of science fiction, is the long awaited final novel of the greatest series ever told. Completed just before his death, Forward The Foundation is the crowning achievement of a great writer's life, a stirring testament to the creative genius of Isaac Asimov. As Hari Seldon struggles to perfect his revolutionary theory of psychohistory and ensure a place for humanity among the stars, the great Galactic Empire totters on the brink of apocalyptic collapse. Caught in the maelstrom are Seldon and all he holds dear, pawns in the struggle for dominance. Whoever can control Seldon will control psychohistoryâand with it the future of the Galaxy. Among those seeking to turn psychohistory into the greatest weapon known to man are a populist political demagogue, the weak-willed Emperor Cleon I, and a ruthless militaristic general. In his last act of service to humankind, Hari Seldon must somehow save his life's work from their grasp as he searches for his true heirsâa search the begins with his own granddaughter and the dream of a new Foundation."
,,,,,195.0,0.094,,Lost in the Crowd,"Lost in the Crowd
 is an engaging, humorous, and sometimes poignant autobiographical story that will have you feeling as though you are right there with the author - laughing, crying, and stumbling through all the ups and downs of his amazing, hard-to-believe, often hilarious, crazy, heartwarming journey through life - a journey that recurrently seems to be influenced by mysterious forces beyond his control and understanding.The book is defined by events that occurred in the author's life during the two years it was being written. These events bring the book to life and give it a whole new meaning - a meaning that could never have been envisaged when the writing started in October 2015.It has been described as a brilliantly compelling quirky book of inspiration, coincidence, love, luck, loss, life, chance, opportunism, emotion, comedy, stupidity, amazement, danger, worry, survival, happiness, laughter, and WTF!See www.litcbook.com to learn more.Contains original artwork by chrisriversart.com."
,,,,,13053.0,0.094,,Being and Nothingness,"Being & Nothingness is without doubt one of the most significant philosophical books of the 20th century. The central work by one of the century's most influential thinkers, it altered the course of western philosophy. Its revolutionary approach challenged all previous assumptions about the individual's relationship with the world. Known as 'the Bible of existentialism', its impact on culture & literature was immediate & was felt worldwide, from the absurdist drama of Samuel Beckett to the soul-searching cries of the Beat poets.Being & Nothingness is one of those rare books whose influence has affected the mindset of subsequent generations. Seventy years after its 1st publication, its message remains as potent as ever--challenging readers to confront the fundamental dilemmas of human freedom, choice, responsibility & action."
,,,,,6804.0,0.094,,Dyllys,"Dyllys is an android. Made to look like a human, act like a human, but not have the spirit of a human. However, Dyllys wasn't always this way. Once she had been human. Hundreds of years as a slave unable to feel, Dyllys is coming to the end of her life. Can she learn how to regain her humanity and once again have a human soul before she disappears forever?"
