algorithm,elapsed_time,iterations_done,total_iterations,iterations_per_second,book_index,similarity_score,,book_title,recommended_description
,,,,,11761.0,0.183,,The Theory and Practice of Hell,"A former Buchenwald prisoner's report to the Allied liberation forces describes the purpose, character, administration, and human impact of Nazi concentration camps. Reprint."
,,,,,8778.0,0.169,,The Meaning of Life: A Guide to Finding Your Life's Purpose,"""What is the meaning of life?"" Throughout history, people have spent much of their lives trying to explain how the world works and why. Initially, they seek to live better lives and thrive. Ultimately, they seek to find purpose and significance in their existence.Experience the scientific and philosophical journey billions of years in the making to answer the question that all living beings capable of rational thought will ask themselves: why are we here? Over the course of that journey, you will come to understand how humans determine their meaning and, with some of your own analysis, discover your own purpose along the way."
,,,,,13249.0,0.164,,In Heaven as on Earth: A Vision of the Afterlife,"The best-selling author of The Road Less Traveled and In Search of Stones presents a novel of the afterlife that teaches important spiritual lessons for his life. The soul of Daniel - the author-psychiatrist who narrates this story - awakens in the afterlife infused with fear and excitement. Two spiritual ""greeters"" guide him as he begins to negotiate the ""corridors"" of this new environment, encountering welcome and unwelcome spirits. But ultimately only his own spiritual convictions and discoveries will lead him past seductive enchantment to the achievement of his destiny and an understanding of the fundamental moral principles that transcend mortality.Rich in lessons on finding a place and purpose in this life and beyond, Daniel's odyssey into eternity, like Dr. Peck's other inspirational classics, flows with nourishment for both the soul and the psyche."
,,,,,9223.0,0.16,,Hope for the Troubled Heart: Finding God in the Midst of Pain,"What hopeless situation troubles your heart? The death of a loved one? The memories of childhood abuse? The diagnosis of terminal illness? The strain of financial failure? A stormy marriage? A body wracked by pain? A lonely sense of emptiness? Into your hopeless situation comes beloved evangelist Billy Graham bearing God's gift of hope, one of the strongest ""medicines"" known to humanity, an amazing resource that ""can cure nearly everything."" Filled with unforgettable stories of real-life people and irrefutable lessons of biblical wisdom, Hope for the Troubled Heart inspires and encourages you with God's healing and strengthening truths. It shows you how to cope when your heart is breaking, how to pray through your pain, how to avoid the dark pit of resentment and bitterness, and how to be a comforter to others who hurt. You'll be reminded that ""before we can grasp any meaning from suffering we must rest in God's unfailing love."" And you'll find the ""joy to be discovered in the midst of suffering."" Here you'll learn how hope helps troubled hearts find peace."
,,,,,10532.0,0.158,,The Gospel According to Jesus Christ,"This is a skeptic's journey into the meaning of God and of human existence. At once an ironic rendering of the life of Christ and a beautiful novel, Saramago's tale has sparked intense discussion about the meaning of Christianity and the Church as an institution. Translated by Giovanni Pontiero."
,,,,,1819.0,0.155,,Nothing You Don't Already Know,"Nothing you don't already know is a brief guide to making the most of your life. It's for everyone who wants to take on the journey of fulfilling their potential and live a deeply meaningful life. In 2015, the author started sharing his writings about life on his Instagram page. This book holds a selection of his most popular quotes and writings that have already positively impacted thousands of people. Alexander is a Dutch inspirational speaker who's teachings are about living with purpose, overcoming fear, transformation, and making a difference.This concise handbook is full of remarkable reminders about meaning, purpose, and self-realization.The title refers to the idea that if you learn something profound, it's not as if you have learned something new. Rather, it's as if something is being unveiled to you that you have always known."
,,,,,11508.0,0.15,,Destiny of Souls: New Case Studies of Life Between Lives,"A pioneer in uncovering the secrets of life, internationally recognized spiritual hypnotherapist Dr. Michael Newton takes you once again into the heart of the spirit world. His groundbreaking research was first published in the bestsellingÂ Journey of Souls, the definitive study on the afterlife. Now, inÂ Destiny of Souls, the saga continues with 70 case histories of real people who were regressed into their lives between lives. Dr. Newton answers the requests of the thousands of readers of the first book who wanted more details about various aspects of life on the other side.Â Destiny of SoulsÂ is also designed for the enjoyment of first-time readers who haven't readÂ Journey of Souls.Â  Explore the meaning behind your own spiritual memories as you read the stories of people in deep hypnosis, and learn fascinating details about: âOur purpose on EarthâSoul matesÂ and spirit guidesâSpiritual settings and where souls go after deathâSoul travel between livesâWays spirits connect with and comfort the livingâThe soul-brain connectionÂ Â Â Â Â Â Â Â Â âWhy we choose certain bodies"
,,,,,8981.0,0.147,,"If I Could Live Again: A heart wrenching, thought provoking novel that spans lifetimes","Sometimes dreams do come true-but not in the way we expect.Spanning three generations and nearly one hundred years, this is a heart-wrenching story about love, loss, family-both blood and the people you choose, spiritual connection, and a dream coming true in an unexpected way.In 1925, Margaret, born with a gift for music, is growing up in an abusive and unloving home, caring for her younger siblings and working hard on their dairy farm in Nova Scotia. She aspires to be a successful singer/songwriter but as life moves along and she settles in Alberta, it becomes less and less likely that she will ever achieve her dream.In 2015, as Sarah is going through her parents' belongings after their unexpected deaths, she stumbles across a box of transcripts of stories she told them when she was a child. The tales take on a more personal meaning when she falls in love with Alex, and as she spends time with his family, begins to feel a spiritual bond to Margaret.How are these two women connected?If I Could Live Again will touch your heart and inspire you to never let go of your dreams."
,,,,,11507.0,0.146,,Desolation,"A year has passed since the biological agent dubbed âPT-12â ravaged the United States of America. The tide of undeath caused by the outbreak has receded, and what remains of society has splintered between those living in FEMA camps and those risking life in a world without walls.  Jerri is one young woman living in such a camp, aged beyond her years by what she witnessed during the viral apocalypse and what life in the camps has become. Here in this desolate new world, both her ethics and her will to survive will be tested by the living, the dead, the campâand beyond."
,,,,,10917.0,0.141,,Nothing,"When Pierre-Anthon realizes there is no meaning to life, the seventh-grader leaves his classroom, climbs a tree, and stays there. His classmates cannot make him come down, not even by pelting him with rocks. So to prove to Pierre-Anthon that life has meaning, the children decide to give up things of importance. The pile starts with the superficialâa fishing rod, a new pair of shoes. But as the sacrifices become more extreme, the students grow increasingly desperate to get Pierre-Anthon down, to justify their belief in meaning. Sure to prompt intense thought and discussion, Nothing âalready a treasured work overseasâis not to be missed."
,,,,,11375.0,0.14,,Born Again,"In 1974 Charles W. Colson pleaded guilty to Watergate-related offenses and, after a tumultuous investigation, served seven months in prison. In his search for meaning and purpose in the face of the Watergate scandal, Colson penned Born Again. This unforgettable memoir shows a man who, seeking fulfillment in success and power, found it, paradoxically, in national disgrace and prison. In the decades since its initial publication, Born Again has brought hope and encouragement to millions. This remarkable story of new life continues to influence lives around the world through a dozen foreign editions."
,,,,,1411.0,0.138,,Sexual Secrets Please your man for 60 minutes & more,"How can you master the human body to bring your significant other pleasure? The answer isnât as hard as youâd think. The human body is a temple that must be loved and respected. Lovemaking is an art that must be worked on and practiced. Thankfully, you can give your partner the best pleasure EVER, and this guide is your access to just that. Let us guide you through different traditions and spiritual outlooks on life that will create a stronger bond with your partner, awakening a sexual drive youâve never known you or your partner had. Connecting with your body is one of the greatest things you can learn to do, and knowing how exactly to touch someone can bring the greatest joy and greatest pleasure possible. If youâre ready to find out how to feel pleasure, and give pleasure, like youâve never known, dive into this guide! You wonât regret it."
,,,,,609.0,0.135,,"Don't Just Fly, SOAR: The Inspiration and tools you need to rise above adversity and create a life by design","Are you struggling to rise above adversity? Looking for the deeper purpose for your life? Don't Just Fly, tells a deeply personal account of an immigrant conqueror. Markey unveils her own fractured heart, coherent to the sound of humanities cries and painted by her own tears. Cultured calligraphy glides from her quill to depict traces of humankind and specifically where real victory dwells. Only you can define the tapestry of your character and the fashion that it spills into our world. This testimony is more than words, it is life changing motivation to live better. It is a witness that you can achieve professional success, change the narrative dished out to you, harness meaningful relationships, ignite your self-worth and find peace in the most intense storms of life. Drenched with palatable experience and insightful gleans Kelly shows that the power to change your life depends on you despite unfavourable circumstances. A book that's ignites you to find your goodness guide. In this book, Kelly draws on her life experience wisdom intended to supply guidance and daily help, with all the pitfalls and possibilities to benefit you towards understanding how Define your purpose and vision for life Understand the lessons & blessings of your past Create authentic & meaningful relationships Thrive in a world that sometimes feels unfair Design the future that inspires youDon't Just Fly, SOAR includes 25 powerful self-help tools for transforming your life and creating a future by design. Each points you toward a better and robust custom of living.This book will guide you to the healing power of empathy and complement the incredible influence of resilience that lurks within you. It will inspire you to shoot for the stars and leave your legacy in the world! _______________________________________________________________________ 'This book is powerful, it will teach you, it will equip you and it will shape you for a healthier walk in life...what an extraordinary journey and experience that turned out an exceptional woman of our era.' - Liz Naidoo. Editor. Woman of Faith Magazine'I believe our personal stories are sources of transformation for others...This book will transform your life and birth a new you. Congratulations on picking it up.' - Dr Samuel Ekundayo"
,,,,,10505.0,0.134,,The Infinite Jeff: A Parable of Change,"Stanley, an out of work tech writer, is deeply unsatisfied with the lack of meaning in his life. Of the three places he feels should provide meaning in his life, religion, work and family, only one gives his life purpose: family. In PART ONE his lack of meaning starts to change. Out of desperation to support his family, he takes a short-term contract job on the other side of the country. He cannot afford to fly so he packs his car for the cross-country journey. The trip gets strange almost immediately when he reluctantly picks up a hitchhiker who transforms Stanley's religious views by answering questions that have kept religion at arm's length."
,,,,,10109.0,0.131,,How Should We Then Live? The Rise and Decline of Western Thought and Culture,"Drawing upon forty years of study in theology, philosophy, history, sociology and the arts, Dr. Schaeffer contemplates the reasons for modern society's sorry state of affairs and argues for total affirmation of the Bible's morals, values, and meaning."
,,,,,9173.0,0.13,,Love's Executioner and Other Tales of Psychotherapy,"The collection of ten absorbing tales by master psychotherapist Irvin D. Yalom uncovers the mysteries, frustrations, pathos, and humor at the heart of the therapeutic encounter.Â  In recounting his patients' dilemmas, Yalom not only gives us a rare and enthralling glimpse into their personal desires and motivations but also tells us his own story as he struggles to reconcile his all-too human responses with his sensibility as a psychiatrist.Â  Not since Freud has an author done so much to clarify what goes on between a psychotherapist and a patient."
,,,,,7933.0,0.13,,Hattie,"HATTIE begins with the endâthe end of a womanâs life. In a spare and powerful narrative, this soulful novel takes us on an intimate journey through the meaning of Hattieâs life and life in general, delving fearlessly into the complexity of our human relationships, our yearning for the divine, and the ways in which these paths cross throughout our lives. For Hattie, love and loss are so intertwined it is hard to separate the two. By sharing her stories, Hattie reconnects with parts of her lost life and loves and finds the courage to tell the whole truths of her lifeâin death she discovers her voice. HATTIE is a mystical, spiritual, and very human experience.HATTIE is an excellent choice for book clubs and includes a CONVERSATION GUIDE with questions for discussion."
,,,,,12235.0,0.128,,Trainspotting,"The bestselling novel by Irvine Welsh that provided the inspiration for Danny Boyleâs hit film'Choose us. Choose life. Choose mortgage payments; choose washing machines; choose cars; choose sitting oan a couch watching mind-numbing and spirit-crushing game shows, stuffing fuckin junk food intae yir mooth. Choose rotting away, pishing and shiteing yersel in a home, a total fuckin embarrassment tae the selfish, fucked-up brats ye've produced. Choose life."
,,,,,12231.0,0.126,,The Art of Happiness,"Nearly every time you see him, he's laughing, or at least smiling. And he makes everyone else around him feel like smiling. He's the Dalai Lama, the spiritual and temporal leader of Tibet, a Nobel Prize winner, and an increasingly popular speaker and statesman. What's more, he'll tell you that happiness is the purpose of life, and that ""the very motion of our life is towards happiness."" How to get there has always been the question. He's tried to answer it before, but he's never had the help of a psychiatrist to get the message across in a context we can easily understand. Through conversations, stories, and meditations, the Dalai Lama shows us how to defeat day-to-day anxiety, insecurity, anger, and discouragement. Together with Dr. Cutler, he explores many facets of everyday life, including relationships, loss, and the pursuit of wealth, to illustrate how to ride through life's obstacles on a deep and abiding source of inner peace."
,,,,,11988.0,0.126,,The Book of Secrets,"In this comprehensive and practical guide, the secrets of the ancient science of Tantra become available to a contemporary audience for the first time. Confined to small, hidden mystery schools for centuries, and often misunderstood and misinterpreted today. Tantra is not just a collection of techniques to enhance sexual experience. As Osho shows in these pages, it is a complete science of self-realizatoin, based on the cumulative wisdom of centuries of exploration into the meaning of life and consciousness. Tantra-the very word means ""technique""-is a set of powerful, transformative tools that can be used to bring new meaning andjoy to every aspect of our daily lives."
,,,,,11965.0,0.126,,Life Lessons: Everything You Ever Wished You Had Learned in Kindergarten,"There is a SECRET TO THE WAY LIFE WORKS...Are you ready to hear it?Life Lessons is a practical and inspiring guide to help you understand why things happen the way they do in life. You are NEVER being punished. You are NEVER a victim of your life. If it is happening in your life, it is because it is there to teach you something. And the sooner you can get that lesson, the sooner you can move on with your life.In clear and easy language, Donnalynn Civello, CHHC, AADP, Certified Intuitive Life Coach and Holistic Nutritionist helps you to understand the nature of life and the many life lessons that we encounter on a daily basis.Lessons that can explain:* Why did I lose that job?* Why did I lose that relationship?* Why does it seem like i have to go through difficult periods?* Why do other people seem to get ahead and i struggle?* Why does it seem so difficult to find happiness?* How do I know if i am living my purpose?* How can I recognize true love?Everything happens for a reason and when you can start to understand that there are some basic life lessons in place â you can better understand how to deal with lifeâs ups and downs more successfully and be able to turn them around to your advantage effortlessly.We will explore:â How to play the game of lifeâ How to be who you areâ Self-love, self-worth, self esteemâ Relationshipsâ Difficult transitions, letting go, changeâ Life lessons and patternsâ Overcoming obstaclesâ Painful emotionsâ Money and abundance issuesLife would be so much easier if we had learned some of these simple life lessons in Kindergarten. But with ""Life Lessons: Everything You Ever Wished You Had Learned in Kindergarten,"" now you will have them. Time to live YOUR BEST LIFE!"
,,,,,2489.0,0.124,,Mann Chalay Ka Sauda / ÙÙ ÚÙÛ Ú©Ø§ Ø³ÙØ¯Ø§,"An unforgettable spiritual journey! Undoubtedly, one of Ashfaq Ahmed's greatest works of literature. This drama will move you, inspire you, and probably even change your life."
,,,,,9186.0,0.124,,The Myth of Sisyphus and Other Essays,"One of the most influential works of this century, this is a crucial exposition of existentialist thought. Influenced by works such as Don Juan, and the novels of Kafka, these essays begin with a meditation on suicide: the question of living or not living in an absurd universe devoid of order or meaning. With lyric eloquence, Camus posits a way out of despair, reaffirming the value of personal existence, and the possibility of life lived with dignity and authenticity."
,,,,,11204.0,0.123,,à¤®à¥à¤¤à¥à¤¯à¥à¤à¤à¤¯,"The search for the meaning of Being is man's eternal quest and the subject of his greatest creations. Shivaji Sawant's Mrityunjaya is an outstanding instance of such a literary masterpiece in which a contemporary Marathi novelist investigates the meaning of the bewildering skein that is life through the personae of the Mahabharata protagonists. For over two decades since its first publication the vast non- Marathi and non-Hindi readership remained deprived of this remarkable exploration of the human psyche till the publication of this English translation by the Writers workshop â a contribution for which there is much to be grateful for. Mrityunjaya is the autobiography of Karna, and yet it is not just that. With deceptive case, Sawant brings into play an exceptional stylistic innovation by combining six ""dramatic soliloquies"" to form the nine books of this novel of epic dimensions. Four books are spoken by Karna. These are interspersed with a book each from the lips of his unwed mother Kunti, Duryodhana (who considers Karna his mainstay), Shon (Shatruntapa, his foster-brother, who here-worships him), his wife Vrishali to whom he is like a god and, last of all, Krishna. Sawant depicts an uncanny similarity between Krishna and Karna and hints at a mystic link between them, investing his protagonist with a more-than-human aura to offset the un-heroic and even unmanly acts which mar this tremendously complex and utterly fascinating creating of Vyasa."
,,,,,12188.0,0.122,,War Is a Force That Gives Us Meaning,"As a veteran war correspondent, Chris Hedges has survived ambushes in Central America, imprisonment in Sudan, and a beating by Saudi military police. He has seen children murdered for sport in Gaza and petty thugs elevated into war heroes in the Balkans. Hedges, who is also a former divinity student, has seen war at its worst and knows too well that to those who pass through it, war can be exhilarating and even addictive: ""It gives us purpose, meaning, a reason for living.""Drawing on his own experience and on the literature of combat from Homer to Michael Herr, Hedges shows how war seduces not just those on the front lines but entire societies, corrupting politics, destroying culture, and perverting the most basic human desires. Mixing hard-nosed realism with profound moral and philosophical insight, War Is a Force That Gives Us Meaning is a work of terrible power and redemptive clarity whose truths have never been more necessary.Listening Length: 6 hours and 27 minutes"
