algorithm,elapsed_time,iterations_done,total_iterations,iterations_per_second,book_index,similarity_score,,book_title,recommended_description
,,,,,5282.0,0.122,,Spiritual Symbols,"Spiritual Symbols with their Meaning, AoL Mindfulness Book #8. To all Mindfulness and Alchemy Explorers who see the beauty in every-day Nature & Universal sacred language of symbols and signs. We will not talk about spiritual symbols worshiped by major religions but about trees, numbers, spirals that we meet daily. Through symbols to mindfulness meditations. Symbols and signs are the languages of the soul. Symbols and signs are the language of dreams. Occultists believe that signs and symbols are given a supernatural power at their creation. Words, signs and symbols, images, colors, light, are all used for eons to convey a spiritual meaning. The Mystics of India In ancient India yogis observed the world as an illusion. Yet, the magic of the spiritual world stayed deeply connected to the sense world. Within the science of yoga, the way we treat our spine influences our health and well-being, the way we treat our thoughts, or the practice of meditation influences our current incarnation. The Mystics of Greece For the philosophers of ancient Babylonia and Greece the sense world was not considered an illusion. In the search for Divine, they turned towards art, towards symbols and signs within myths and legends. In mysterious ways the wisdom of the initiates poured into poets, artists, and thinkers. Manipulating the elements, they turned towards the Lady Science and carried her principles to the point that we are now able to manipulate the sound, the light, the matter and its manifestation. The Mystics of China Chinese created I Ching that within its symbolism reflects the universe in miniature. The book is at the heart of Confucian thought and Taoism, but also a common tool among the fortune tellers that use it as a divination text and a roadside oracle. The Mystics of Kabbalah Kabbalists designed the Tree of Life and the Tarot symbolism followed it. Kabbalah is an esoteric teaching, a science that explores metaphysical principles of the universe. Any material object and action from both the micro and the macro world is controlled by the spiritual forces. Kabbalah attempts to understand these spiritual sources, to know their nature and properties. Mystics Magic and God To a Chinese sage, a Yogi, and a Cabbalist Mystic, the earth is a field of activity that has to be transformed, so that it carries an imprint of human will. The Mystics, the Magi initiates, the guardians of the oracle mysteries acquired deep knowledge of the laws of the spiritual world and their interaction with the sense world. Some of them worked hard all through their lives to decipher the spiritual forces behind the forces of nature and to learn how to control the elements. Just as God is hidden, so are the inner secrets of Her divine message. We read about them, hear them uttered, but we cannot possibly comprehend their meaning unless we have a direct experience of their truth. That is why to be able to talk to our souls we use meditation, we use rituals, symbols and signs, we use dreams and careful observation of soulsâ subconscious messages. The mystics of our past help us in this quest. From Zarathustra who comes from the ancient Persian spiritual culture, to Pythagoras who comes from the Greco-Latin cultural epoch, to Lao Tzu, Buddha and Christ, they all carry the keys to the secrets of the most varied mysteries. In March 2015, Artof4Elements developed and launched the Alchemy of Love Mindfulness Training Series of 9 fiction and non-fiction books with 7 authors focusing on spiritual growth, creativity and mindfulness. A series of many genre's, including poetry, personal development, historical fiction, the world of Alchemy of Love Mindfulness Training explores numerous self development themes. The main theme that books and courses explore is mindfulness, alchemy, and reaching ones highest potential."
,,,,,7554.0,0.122,,"The Elegant Universe: Superstrings, Hidden Dimensions, and the Quest for the Ultimate Theory","Brian Greene, one of the world's leading string theorists, peels away the layers of mystery surrounding string theory to reveal a universe that consists of eleven dimensions, where the fabric of space tears and repairs itself, and all matter, from the smallest quarks to the most gargantuan supernovas, is generated by the vibrations of microscopically tiny loops of energy.Today, physicists and mathematicians throughout the world are feverishly working on one of the most ambitious theories ever proposed: superstring theory. String theory, as it is often called, is the key to the Unified Field Theory that eluded Einstein for more than thirty years. Finally, the century-old antagonism between the large and the small--General Relativity and Quantum Theory--is resolved. String theory proclaims that all of the wondrous happenings in the universe, from the frantic dancing of subatomic quarks to the majestic swirling of heavenly galaxies, are reflections of one grand physical principle and manifestations of one single entity: microscopically tiny vibrating loops of energy, a billionth of a billionth the size of an atom. In this brilliantly articulated and refreshingly clear book, Greene relates the scientific story and the human struggle behind twentieth-century physics' search for a theory of everything.Through the masterful use of metaphor and analogy, The Elegant Universe makes some of the most sophisticated concepts ever contemplated viscerally accessible and thoroughly entertaining, bringing us closer than ever to understanding how the universe works."
,,,,,12377.0,0.121,,A Dog's Purpose,"This is the remarkable story of one endearing dog's search for his purpose over the course of several lives. More than just another charming dog story, this touches on the universal quest for an answer to life's most basic question: Why are we here? Surprised to find himself reborn as a rambunctious golden haired puppy after a tragically short life as a stray mutt, Bailey's search for his new life's meaning leads him into the loving arms of 8 year old Ethan. During their countless adventures Bailey joyously discovers how to be a good dog. But this life as a beloved family pet is not the end of Bailey's journey. Reborn as a puppy yet again, Bailey wonders, will he ever find his purpose? Heartwarming, insightful, and often laugh out loud funny, this book is not only the emotional and hilarious story of a dog's many lives, but also a dog's eye commentary on human relationships and the unbreakable bonds between man and man's best friend. This story teaches us that love never dies, that our true friends are always with us, and that every creature on earth is born with a purpose."
,,,,,156.0,0.12,,Veronika Decides to Die,"In his latest international bestseller, the celebrated author of The Alchemist addresses the fundamental questions asked by millions: What am I doing here today? and Why do I go on living?Twenty-four-year-old Veronika seems to have everything she could wish for: youth and beauty, plenty of attractive boyfriends, a fulfilling job, and a loving family. Yet something is lacking in her life. Inside her is a void so deep that nothing could possibly ever fill it. So, on the morning of November 11, 1997, Veronika decides to die. She takes a handful of sleeping pills expecting never to wake up.Naturally Veronika is stunned when she does wake up at Villete, a local mental hospital, where the staff informs her that she has, in fact, partially succeeded in achieving her goal. While the overdose didn't kill Veronika immediately, the medication has damaged her heart so severely that she has only days to live.The story follows Veronika through the intense week of self-discovery that ensues. To her surprise, Veronika finds herself drawn to the confinement of Villete and its patients, who, each in his or her individual way, reflect the heart of human experience. In the heightened state of life's final moments, Veronika discovers things she has never really allowed herself to feel before: hatred, fear, curiosity, love, and sexual awakening. She finds that every second of her existence is a choice between living and dying, and at the eleventh hour emerges more open to life than ever before.In Veronika Decides to Die, Paulo Coelho takes the reader on a distinctly modern quest to find meaning in a culture overshadowed by angst, soulless routine, and pervasive conformity. Based on events in Coelho's own life, Veronika Decides to Die questions the meaning of madness and celebrates individuals who do not fit into patterns society considers to be normal. Poignant and illuminating, it is a dazzling portrait of a young woman at the crossroads of despair and liberation, and a poetic, exuberant appreciation of each day as a renewed opportunity."
,,,,,11744.0,0.12,,All But My Life,"All But My Life is the unforgettable story of Gerda Weissmann Klein's six-year ordeal as a victim of Nazi cruelty. From her comfortable home in Bielitz (present-day Bielsko) in Poland to her miraculous survival and her liberation by American troopsâincluding the man who was to become her husbandâin Volary, Czechoslovakia, in 1945, Gerda takes the reader on a terrifying journey. Gerda's serene and idyllic childhood is shattered when Nazis march into Poland on September 3, 1939. Although the Weissmanns were permitted to live for a while in the basement of their home, they were eventually separated and sent to German labor camps. Over the next few years Gerda experienced the slow, inexorable stripping away of ""all but her life."" By the end of the war she had lost her parents, brother, home, possessions, and community; even the dear friends she made in the labor camps, with whom she had shared so many hardships, were dead. Despite her horrifying experiences, Klein conveys great strength of spirit and faith in humanity. In the darkness of the camps, Gerda and her young friends manage to create a community of friendship and love. Although stripped of the essence of life, they were able to survive the barbarity of their captors. Gerda's beautifully written story gives an invaluable message to everyone. It introduces them to last century's terrible history of devastation and prejudice, yet offers them hope that the effects of hatred can be overcome."
,,,,,8760.0,0.12,,In My Hands: Compelling Stories from a Surgeon and His Patients Fighting Cancer,"In In My Hands , surgical oncologist Dr. Steven Curley shares the empowering lessons he's learned over 25 years from his cancer patients' unique stories of struggle, perseverance, and triumph.As Chief of Surgical Oncology at Baylor College of Medicine, Dr. Steven Curley has worked with cancer patients for over two decades. While his life's work has been to help his patients live longer lives, he found that they helped him in ways he never could have expected. In My Hands is a rare, often emotional look at some of Dr. Curley's real patients and real situations in modern cancer care. These stories of resilience, hope, and determination changed and inspired Dr. Curley, and he uses these same stories to encourage patients dealing with the fear and uncertainty coupled with a diagnosis of cancer. Every story in the book has a theme inspired by his Hope, Courage, Strength, Determination, Wonder, Cooperation, Creativity, Diligence, Service, Perseverance, Wisdom, Grace, Consideration, Gratitude, Discernment, Reverence, Resourcefulness, Faith, Beauty, Acceptance, and Empathy. Some are positive messages, reminding us of the importance of maintaining balance between family, work, and leisure activities. Others are examples of the remarkable resilience of the human spirit when facing the reality of and the surgical risks that accompany a cancer diagnosis. Realistically, despite remarkable advances in multidisciplinary cancer care, some remind us cancer is still a potentially lethal and destructive disease affecting patients and the family and friends supporting them. While many people are told that there is no hope in their situation, Dr. Curley's patients taught him to always provide hope, to push the envelope and give people a chance, and that hope is a critical component of treatment and care. In My Hands is medical narrative at its finest, and provides insight into medicine and patient care along with fascinating details about one of our most feared diseases."
,,,,,1089.0,0.118,,Are We Muslims?,"An important work by Sheikh Muhammad Qutb about the true meaning of being a Muslim, questioning whether the life we are living today as a nation of Muslims is truly the Islamic life taught by the Qur'an and Sunnah."
,,,,,9183.0,0.116,,"Words to Ponder About Life, Love and Men","When Karen Michelle Miller was a teenager, her mother and brother died suddenly and tragically. Unable to cope with the loss, she turned to alcohol and drugs and headed on a downward spiral for many years. She has since recovered and lives a life filled with purpose and happiness. She is committed to spreading the message of hope to women who are suffering. In ""Words to Ponder About Life, Love and Men,"" she conveys via verse poetry the lessons she has learned on her journey from utter despair to contentment and happiness."
,,,,,8486.0,0.116,,"Firsthand Lessons, Secondhand Dogs","Have you ever felt like it is too late to start over? Told through a story of how an unwanted dog became a life-changing mentor, Firsthand Lessons, Secondhand Dogs is a book about getting a second chance at enjoying a first-rate existence. The story begins with the unlikely adoption of a secondhand dog, Bruno, and is paralleled to the life of his adoptive father, author Scott Carbonara. As Scott s life changes, through work promotions and challenges, Bruno subtly yet strongly demonstrates how to have fun, focus, forgive, and finally, pay it forward all lessons that serve us whether in business or life. As Scott illustrates through the poignant and often humorous story and accompanying lessons and exercises, as long as you strive to keep learning and teaching others, your work continues. This book provides an opportunity to laugh, learn, and love your life again, all while finding concrete ways to pay it forward."
,,,,,6.0,0.115,,The Book Thief,"Librarian's note: An alternate cover edition can be found hereIt is 1939. Nazi Germany. The country is holding its breath. Death has never been busier, and will be busier still.By her brother's graveside, Liesel's life is changed when she picks up a single object, partially hidden in the snow. It is The Gravedigger's Handbook, left behind there by accident, and it is her first act of book thievery. So begins a love affair with books and words, as Liesel, with the help of her accordian-playing foster father, learns to read. Soon she is stealing books from Nazi book-burnings, the mayor's wife's library, wherever there are books to be found.But these are dangerous times. When Liesel's foster family hides a Jew in their basement, Liesel's world is both opened up, and closed down.In superbly crafted writing that burns with intensity, award-winning author Markus Zusak has given us one of the most enduring stories of our time.(Note: this title was not published as YA fiction)"
,,,,,7244.0,0.115,,Escape from Camp 14: One Man's Remarkable Odyssey from North Korea to Freedom in the West,"A New York Times bestseller, the shocking story of one of the few people born in a North Korean political prison to have escaped and survived.North Korea is isolated and hungry, bankrupt and belligerent. It is also armed with nuclear weapons. Between 150,000 and 200,000 people are being held in its political prison camps, which have existed twice as long as Stalin's Soviet gulags and twelve times as long as the Nazi concentration camps. Very few born and raised in these camps have escaped. But Shin Donghyuk did.In Escape from Camp 14, acclaimed journalist Blaine Harden tells the story of Shin Dong-hyuk and through the lens of Shin's life unlocks the secrets of the world's most repressive totalitarian state. Shin knew nothing of civilized existence-he saw his mother as a competitor for food, guards raised him to be a snitch, and he witnessed the execution of his own family. Through Harden's harrowing narrative of Shin's life and remarkable escape, he offers an unequaled inside account of one of the world's darkest nations and a riveting tale of endurance, courage, and survival."
,,,,,9117.0,0.113,,A History of Light,"A memoir, of a first love set in Costa Rica of the 1930's"
,,,,,8335.0,0.113,,Charles and Emma: The Darwins' Leap of Faith,"Charles Darwin published The Origin of Species, his revolutionary tract on evolution and the fundamental ideas involved, in 1859. Nearly 150 years later, the theory of evolution continues to create tension between the scientific and religious communities. Challenges about teaching the theory of evolution in schools occur annually all over the country. This same debate raged within Darwin himself, and played an important part in his marriage: his wife, Emma, was quite religious, and her faith gave Charles a lot to think about as he worked on a theory that continues to spark intense debates.Deborah Heiligman's new biography of Charles Darwin is a thought-provoking account of the man behind evolutionary theory: how his personal life affected his work and vice versa. The end result is an engaging exploration of history, science, and religion for young readers.Charles and Emma is a 2009 National Book Award Finalist for Young People's Literature."
,,,,,9017.0,0.112,,The Real America: Messages from the Heart and Heartland,"Glenn Beck has entertained, inspired, and informed millions with his self-effacing humor, heartfelt conviction, and down-to-earth approach to life. And in The Real America , a powerful collection of his early writings, he calls it as he sees it, cutting through the fog of those who have made it their mission to underestimate -- and undermine -- the greatness of America and the power of ""We the People."" Whether the topic is family, religion, personal responsibility, rampant political correctness, presidential elections, or out-of-control celebrities, Glenn Beck rails against the forces that keep us from uniting and fulfilling our potential and explains how to overcome them. His compelling, patriotic, and spiritually driven message will inspire you to connect with your own power and help lead us back to that place that is quickly being forgotten... THE REAL AMERICA ."
,,,,,10691.0,0.112,,The Wisdom of Insecurity: A Message for an Age of Anxiety,"In this fascinating book, Alan Watts explores man's quest for psychological security, examining our efforts to find spiritual and intellectual certainty in the realms of religion and philosophy. The Wisdom of Insecurity underlines the importance of our search for stability in an age where human life seems particularly vulnerable and uncertain. Watts argues our insecurity is the consequence of trying to be secure and that, ironically, salvation and sanity lie in the recognition that we have no way of saving ourselves."
,,,,,10509.0,0.11,,Sam's Letters to Jennifer,"Grief-stricken by a recent tragedy, Jennifer returns to the resort village where she grew up to help her beloved grandmother. There, Jennifer will discover new meaning in life and experience not one, but two of the most amazing love stories ever."
,,,,,6967.0,0.11,,Gilead,"Nearly 25 years after Housekeeping, Marilynne Robinson returns with an intimate tale of three generations, from the Civil War to the 20th century: a story about fathers and sons and the spiritual battles that still rage at America's heart. In the words of Kirkus, it is a novel ""as big as a nation, as quiet as thought, and moving as prayer. Matchless and towering."" GILEAD tells the story of America and will break your heart."
,,,,,12936.0,0.11,,The First and Last Freedom,"Krishnamurti is a leading spiritual teacher of our century. In The First and Last Freedom he cuts away symbols and false associations in the search for pure truth and perfect freedom. Through discussions on suffering, fear, gossip, sex and other topics, Krishnamurtiâs quest becomes the readers, an undertaking of tremendous significance."
,,,,,11960.0,0.11,,Attached: The New Science of Adult Attachment and How It Can Help You Findâand KeepâLove,"Is there a science to love? In this groundbreaking book, psychiatrist and neuroscientist Amir Levine and psychologist Rachel S. F. Heller reveal how an understanding of attachment theory-the most advanced relationship science in existence today-can help us find and sustain love. Attachment theory forms the basis for many bestselling books on the parent/child relationship, but there has yet to be an accessible guide to what this fascinating science has to tell us about adult romantic relationships-until now.Attachment theory owes its inception to British psychologist and psychoanalyst John Bowlby, who in the 1950s examined the tremendous impact that our early relationships with our parents or caregivers has on the people we become. Also central to attachment theory is the discovery that our need to be in a close relationship with one or more individuals is embedded in our genes.In Attached, Levine and Heller trace how these evolutionary influences continue to shape who we are in our relationships today. According to attachment theory, every person behaves in relationships in one of three distinct ways:*ANXIOUS people are often preoccupied with their relationships and tend to worry about their partner's ability to love them back.*AVOIDANT people equate intimacy with a loss of independence and constantly try to minimize closeness.*SECURE people feel comfortable with intimacy and are usually warm and loving.Attached guides readers in determining what attachment style they and their mate (or potential mates) follow. It also offers readers a wealth of advice on how to navigate their relationships more wisely given their attachment style and that of their partner. An insightful look at the science behind love, Attached offers readers a road map for building stronger, more fulfilling connections."
,,,,,12477.0,0.109,,"Many Lives, Many Masters: The True Story of a Prominent Psychiatrist, His Young Patient, and the Past Life Therapy That Changed Both Their Lives","The true story of a prominent psychiatrist, his young patient, and the past-life therapy that changed both their lives. As a traditional psychotherapist, Dr. Brian Weiss was astonished and skeptical when one of his patients began recalling past-life traumas that seemed to hold the key to her recurring nightmares and anxiety attacks. His skepticism was eroded, however, when she began to channel messages from the space between lives, which contained remarkable revelations about Dr. Weiss' family and his dead son. Using past-life therapy, he was able to cure the patient and embark on a new, more meaningful phase of his own career."
,,,,,13062.0,0.109,,Messages from the Masters: Tapping into the Power of Love,"The true story of a prominent psychiatrist, his young patient, and the past-life therapy that changed both their lives. As a traditional psychotherapist, Dr. Brian Weiss was astonished and skeptical when one of his patients began recalling past-life traumas that seemed to hold the key to her recurring nightmares and anxiety attacks. His skepticism was eroded, however, when she began to channel messages from the ""space between lives,"" which contained remarkable revelations about Dr. Weiss' family and his dead son. Using past-life therapy, he was able to cure the patient and embark on a new, more meaningful phase of his own career."
,,,,,12221.0,0.109,,Slaughterhouse-Five,"Selected by the Modern Library as one of the 100 best novels of all time, Slaughterhouse-Five, an American classic, is one of the world's great antiwar books. Centering on the infamous firebombing of Dresden, Billy Pilgrim's odyssey through time reflects the mythic journey of our own fractured lives as we search for meaning in what we fear most."
