algorithm,elapsed_time,iterations_done,total_iterations,iterations_per_second,book_index,similarity_score,,book_title,recommended_description
,,,,,10591.0,0.123,,"A History of God: The 4,000-Year Quest of Judaism, Christianity, and Islam","Over 700,000 copies of the original hardcover and paperback editions of this stunningly popular book have been sold. Karen Armstrong's superbly readable exploration of how the three dominant monotheistic religions of the worldâJudaism, Christianity, and Islamâhave shaped and altered the conception of God is a tour de force. One of Britain's foremost commentators on religious affairs, Armstrong traces the history of how men and women have perceived and experienced God, from the time of Abraham to the present. From classical philosophy and medieval mysticism to the Reformation, the Enlightenment, and the modern age of skepticism, Armstrong performs the near miracle of distilling the intellectual history of monotheism into one compelling volume."
,,,,,2952.0,0.123,,The Girl & Her Ren,"âWhat do you do when you write down all your secrets? Noâ¦thatâs not enough. What do you do when you write down all your secrets and the one person who should never read them does? Iâll tell you what you do.You hope.â RENRen didnât know the meaning of love until he took Della for his own.To begin with he hated her, but as the months bled into years, he learned the opposite of hate, dedicating his life to giving her everything.Every sacrifice, every gift, he gave wholeheartedly.But then love turned to lust and ruined everything.DELLAI was stupid to write my secrets down, but Iâd been stupid before so it was nothing new.I couldnât blame him, hate him, fix him.I tried to move on without him.But no matter what I did, I couldnât seem to delete the secrets Iâd written.Until something happened.Until he came back and read my stupid secrets.And nothing was the same after that."
,,,,,3085.0,0.123,,Oath Taker,"Light magic is forbidden.Â  Dark magic spellsÂ death.Â  Haven has both. â After the Prince of Penryth saved her from captivity, seventeen-year-old Haven Ashwood spends her days protecting the kind prince and her nights secretly fighting the monsters outside the castle walls.Â   When one of those monsters kidnaps Prince Bell, Haven must ally with Archeron Halfbane and his band of immortals to rescue her friend.Â   Her quest takes her deep into the domain of a warped and vicious queen where the rules are simple: break her curse or die.  Lost in a land of twistedÂ magic andÂ fabled creatures, Haven finds herselfÂ unprepared, not just for the feelings she develops for Archeron,Â but for the warring powers raging inside her.Â   Her rare and forbidden type of magic may be their only hope . . . but mixing light and dark comes with a steep price.Â   Havenâs soul.  Faced with impossible love, heartbreaking betrayals, and a queen intent on destroying the realm, only one thing remains certain.Â   Haven must shatter the curse or it will devour everything she loves.Â    Welcome to the Kingdom of Runes where immortals and humans clash, light and dark magic reign, and mythical creatures lurk in the shadows. If you like fierce heroines, enemies-to-lovers romance, wild plot twists, and endearing characters that stay with you long after you reach the end, you need to discover the book readers are calling dark fantasy at its best. Just make sure to clear out some space on your calendar first!   Oath Taker was previously published in the boxed set Shattered Worlds under the name Curse Breaker. This is a revised second edition. The Kingdom of Runes series is upper/mature YA and contains mild cursing and adult situations, including romance."
,,,,,12717.0,0.123,,The Winner,"The DreamShe is twenty, beautiful, dirt-poor, and hoping for a better life for her infant daughter when LuAnn Tyler is offered the gift of a lifetime, a $100 million lottery jackpot. All she has to do is change her identity and leave the U.S. forever.The KillerIt's an offer she dares to refuse...until violence forces her hand and thrusts her into a harrowing game of high-stakes, big-money subterfuge. It's a price she won't fully pay...until she does the unthinkable and breaks the promise that made her rich.The WinnerFor if LuAnn Tyler comes home, she will be pitted against the deadliest contestant of all: the chameleonlike financial mastermind who changed her life. And who can take it away at will..."
,,,,,6823.0,0.122,,In the Window Room,"""There are secret passages all around you if you know where to look for them.""Delany was being punished, and deep in her heart, past the excuses she'd like to make for herself, she knew she'd almost deserved it. And even though that girl, Mattie, had said something dreadful about her father, she knew that she should not have fought with her. Though one can never rewind history to change the past, and so this would be her punishment: to live alone in the old abandoned Greyford house on the outskirts of the Mayfield School for Girls -- a place with its covered furniture, and rooms leading to other unexpected rooms, and she would be completely, and purposefully, alone... or so she thought. Yet there was more to this house than first met the eye: there were secret passages, and hidden treasures, lost and forgotten with the passing time, and a room... a fantastic and otherworldly sort of room, which she had decided to call ""the Window Room"". This is a story about the dangerous and mysterious adventures she found there. This is a story about friends made from enemies, about a kingdom in peril, and a wrongly accused prince who would need saving. These are the sorts of things Delany found -- In the Window Room."
,,,,,5094.0,0.122,,Skeleton Key,"Alex Rider is now an IMDb TV/Amazon Original Series!Alex Rider is an orphan turned teen superspy who's saving the world one mission at a timeâfrom #1 New York Times bestselling author!Alex Rider has been through a lot for his fourteen years. He's been shot at by international terrorists, chased down a mountainside on a makeshift snowboard, and has stood face-to-face with pure evil. Twice, young Alex has managed to save the world. And twice, he has almost been killed doing it. But now Alex faces something even more dangerous. The desperation of a man who has lost everything he cared his country and his only son. A man who just happens to have a nuclear weapon and a serious grudge against the free world. To see his beloved Russia once again be a dominant power, he will stop at nothing. Unless Alex can stop him first... Uniting forces with America's own CIA for the first time, teen spy Alex Rider battles terror from the sun-baked beaches of Miami all the way to the barren ice fields of northernmost Russia.From the author of Magpie Murders and Moriarty ."
,,,,,6846.0,0.122,,Train Wreck: A Novel,"What if I told you there is a secret stock market that assigns a dollar value to the life of every man, woman and child?Would you believe it? And more importantly, how much do you think you'd be worth?Nick Buchanan faces that question every day. He works for a nontraditional insurance firm that gambles on the lives of ordinary Americans and cashes in when they die.After one of his clients is murdered, Nick finds himself in the middle of a tangled conspiracy that he must unravel before the killers can claim another victim."
,,,,,10354.0,0.122,,Madame Bovary,"Madame Bovary is the debut novel of French writer Gustave Flaubert, published in 1856. The character lives beyond her means in order to escape the banalities and emptiness of provincial life. When the novel was first serialized in La Revue de Paris between 1 October 1856 and 15 December 1856, public prosecutors attacked the novel for obscenity. The resulting trial in January 1857 made the story notorious. After Flaubert's acquittal on 7 February 1857, Madame Bovary became a bestseller in April 1857 when it was published in two volumes. A seminal work of literary realism, the novel is now considered Flaubert's masterpiece, and one of the most influential literary works in history."
,,,,,11249.0,0.122,,The Adventure of the Christmas Pudding,"An English country house at Christmas time should be the perfect place to get away from it all - but nothing is ever simple for Hercule Poirot, as he finds not one but five baffling cases to solve.First comes a sinister warning on his pillow to avoid the plum pudding...then the discovery of a corpse in a chest...next, an overheard quarrel that leads to murder...the strange case of a dead man's eating habits...and the puzzle of a victim who dreams of his own suicide.Add an extra bonus - Miss Marple investigates Greenshaw's Folly."
,,,,,8767.0,0.122,,The Little Women Letters,"When Josephine March's great-great-granddaughter stumbles across her letters, the ""Little Women"" shed a glorious light on a new generation of sisters. The Atwaters are a loving, sprawling mess of a family and Fee's three daughters, Emma, Lulu and Sophie couldn't be less alike if they tried. Emma is planning her wedding, Sophie is an up-and-coming actress, but Lulu - the cleverest of them all - is more than a little lost. If life is for living, why is she stuck in a series of dead-end jobs? Grandma Jo's letters had been gathering dust in the attic for decades, but when Lulu gets her hands on them, everything seems to change and different worlds begin to open up. And even though dark family secrets emerge, Jo's words offer comfort and guidance across the centuries. Sometimes family is all that matters. And sisters are the closest friends you can find."
,,,,,5752.0,0.121,,Heavenly,"I met someone who changed everything. Matthias. My autistic sister's guardian angel. Honest. Inspiring. Funny. Hot. And immortal. That was the problem. What could I do? I did what any other girl would do-I fell in love with him.Zoe's sister darts in front of cars. Her brother's a pothead. Her parents are so overwhelmed; they don't see Zoe lost in her broken life. Zoe escapes the only way she knows how: partying. Matthias, a guardian sent from Heaven, watches over Zoe's autistic sister. After Zoe is convinced he's legit, angel and lost girl come together in a love that changes destiny. But Heaven on Earth can't last forever."
,,,,,505.0,0.121,,A Ghostly Shade of Pale,"The diverse elements of a Southern Gothic nightmare converge and occupy the same stage. History files on a bygone era are ripped open and rewritten in temporal games with eternal consequences at the intersection between heaven and hell, between the visible and the Invisible.Mississippi Bureau of Narcotics Captain Michael Parker is an unlikely player in a struggle for the soul of America. A ghostly pale embodiment of evil becomes his obsession, and his tormentor leaves a trail of bodies across the South.As snipers ambush Michael and his agents on frozen fields of regret and the woman he loves is stalked by death, he learns that he is not alone as he has to fight for his life against enemies seen and unseen."
,,,,,5107.0,0.121,,Unstoppable,"My father is a genius.A scientist determined to unlock the human potential.Only his experiments?He conducted them on me.I managed to escape his cruel, painful control, and for years I hid.Until one day, news comes of his death.Along with the fact his experiments are still being carried out.This time I cannot run, I cannot hide.I must stop them once and for all.He thought he was invincibleâ¦. but me?"
,,,,,3927.0,0.121,,Sand & Snow: A Novella,"From the Amazon Bestselling Sand & Clay Rocker Series... In this heart warming romantic comedy novella, rockstar Logan Clay is back with all his bandmates and friends as they travel to his parent's home in East Haven, Connecticut for Christmas. The snowy holiday is heavy with questions about the future and everybody is looking for different answers. Logan is debating the next steps in his relationship. Caroline needs to decide on a career and learn to stand on her own. Aralia is lost and looking for a purpose in her life. Dylan is hiding secrets behind a playboy facade. Over the course of the holiday, tears are shed, hearts are broken, laughter is at an all time high, and new relationships are formed. Everybody has questions, but only some will find their answers. * This novella ties up some of the main story lines from Sand & Clay: Her Forbidden Rockstar, as well as hinting toward the next story line for the fourth book in the Sand & Clay series. This is meant to be a fun, playful, holiday read. *DISCLAIMER: Due to some slight adult content, this book is meant for 18+ years old."
,,,,,10167.0,0.121,,Nikola Tesla: Imagination and the Man That Invented the 20th Century,"If you want to learn about one of historyâs most fascinating minds and uncover some of his secrets of imaginationâsecrets that enabled him to invent machines light years ahead of his time and literally bring light to the worldâthen you want to read this book.Imagination amplifies and colors every other element of genius, and unlocks our potential for understanding and ability. Itâs no coincidence that geniuses not only dare to dream of the impossible for their work, but do the same for their lives. Theyâre audacious enough to think that theyâre not just ordinary players. Few stories better illustrate this better than the life of the father of the modern world, a man of legendary imaginative power and wonder: Nikola Tesla.In this book, youâll be taken on a whirlwind journey through Teslaâs life and work, and not only learn about the successes and mistakes of one of historyâs greatest inventors, but also how to look at the world in a different, more imaginative way.Read this book now and learn lessons from Nikola Tesla on why imagination is so vital to awakening your inner genius, and insights into the real âsecretâ to creativity, as explained by people like Jobs, Picasso, Dali, and Twain."
,,,,,12968.0,0.121,,Loving Ordinary Life: The Self-Help Book for People Who Are Tired of Self-Help Books,"Loving Ordinary Life is written for us: living, emotional people.We all want to live a happy life, but we can easily fall into a state of despondency. We prefer to smile, but more often we frown.We like being inspired, but most likely, we canât recall the last time when we were.There are many books and courses about self-motivation and inspiration. You might have heard hundreds of platitudes and affirmations. Each of them sounds valid but their utility is limited when you actually find yourself stuck in a pit of pain and despair.Loving Ordinary Life is meant to make a functional difference. Itâs not a treatment for depression. It is about living a life where depression has no place.Loving Ordinary Life is your guide. It is designed so that you can open any page and find the inspiration to act and improve your life when youâre feeling down. Each chapter in Loving Ordinary Life is a tool for moving from a negative idle state to a positive proactive state. It displays to you the art of being present, free, and genuine every day.If you want to be more fulfilled and enjoy life more, if youâre open to quality changes, Loving Ordinary Life will become your loyal companion.Everything is within your power. You are the master of your life. How you experience it depends only on you. Take the lead.âVery little is needed to make a happy life; it is all within yourself, in your way of thinking.""Marcus Aurelius"
,,,,,4090.0,0.121,,Heroes 'Til Curfew,"In the world of the Talent Chronicles, kids with supernatural abilities, Talents, are taken away to government-run research facilities from which they do not return. In this sequel to HUSH MONEY, all Joss wants is to be left alone with Dylan. But as more Talents are imprisoned by the government, everyone's looking for a leader. Some look to Joss, some to her worst enemy, Marco, whose new criminal plan threatens Joss's family and friends. Joss wants to stand up to Marco, but Dylan's protective instincts are putting him in harm's way. As the stakes get higher, can Joss find a way to embrace both the boy and her hero within?Heroes 'Til Curfew contains strong language, violence, and some sensuality. Recommended for mature teens and up."
,,,,,13000.0,0.121,,A Perfect Spy,"John le Carre's classic novels deftly navigate readers through the intricate shadow worlds of international espionage with unsurpassed skill and knowledge, and have earned him unprecedented worldwide acclaim.Immersing readers in two parallel dramas -- one about the making of a spy, the other chronicling his seemingly imminent demise -- le Carre offers one of his richest and most morally resonant novels.Magnus Pym -- son of Rick, father of Tom, and a successful career officer of British Intelligence -- has vanished, to the dismay of his friends, enemies, and wife. Who is he? Who was he? Who owns him? Who trained him? Secrets of state are at risk. As the truth about Pym gradually emerges, the reader joins Pym's pursuers to explore the unsettling life and motives of a man who fought the wars he inherited with the only weapons he knew, and so became a perfect spy."
,,,,,3482.0,0.121,,Circlet of Orchids,"""Fasten your seatbelt"" for debut author Autumn Murray's ""witty, fast paced, emotional read"" inspired by her real life second chance love."
,,,,,5080.0,0.121,,Once Upon Stilettos,"Click your heels three times and say, âThereâs no place like Bloomies!âKatie Chandlerâs life is pure magicâliterally. As an executive assistant at Magic, Spells, and Illusions, Inc., sheâs seen more than her share of fantastical occurrences. A mere Manhattan mortal, Katie is no wizard, but sheâs a wiz at exposing âhokumâ pocus, cloaked lies, and deceptive enchantments. And sheâs fallen under the all-too-human spell of attraction to Owen, a hunky wizard and coworker. Owen, however, is preoccupied. Someone has broken into his office and disrupted top-secret files, and it reeks of an inside job. CEO Merlin (yes, the Merlin) taps Katie and her special ability to uncover the magical mole.Keeping her feelings in check while sleuthing alongside Owen, Katie is shocked to discover that her immunity to magic is waning, putting her in grave danger. Soon sheâs surrendering to the charms and enchantments of everyone and everything around her, including a killer pair of red stilettos. Katie must now conjure up her natural instincts to get to the bottom of the break-in, regain her power, and win the wizard of her dreams."
,,,,,2696.0,0.121,,One Night Promised,"Livy notices him the moment he walks into the coffee shop. He's heart-stoppingly stunning, with a blue-eyed gaze so piercing she's almost too distracted to take his order. When he walks out the door, she thinks she'll never see him again. Then she finds the note he left on his napkin . . . signed M.All he wants is one night to worship her. No feelings, no commitment, nothing but pleasure. Every defense mechanism Livy has adopted during her solitary life is at risk of being obliterated by this confounding man. He's obnoxious but well-mannered. He's a gentleman but aloof. He's passionate but emotionless. Yet the fascination is so powerful, Livy can't deny him... or herself.M awakens something in Livy, something deep and addictive that she never knew existed -- and that she fears only he can satisfy. But she senses that behind the fast cars, fancy suits, and posh apartment, he's aching inside. To have him, body and soul, she'll have to brave his dark secrets. Delving into his world and breaking down his defenses become her obsession - an obsession that could shatter her heart beyond repair.."
,,,,,9488.0,0.12,,Cover Your Eyes,"Don't Look At first, they struggle to escape. Then a torrent of blows rains down upon their bodies until their eyes cloud over in final agony. The killer shows no remorse--just a twisted need to witness each victim's last terrified moments.Don't SpeakPublic defender Rachel Wainwright is struggling to reopen a decades-old case, convinced that the wrong man is in prison. Homicide detective Deke Morgan doesn't want to agree. But if Rachel's hunch is correct, whoever fatally bludgeoned young, beautiful Annie Dawson thirty years ago could be the source of a new string of brutal slayings.Just Prepare To DieRachel's investigation is about to reveal answers--but at a price she never thought to pay. Now she's become the target of a rage honed by years of jealousy and madness. And a murderer is ready to show her just how vicious the truth can be. . ."
,,,,,12740.0,0.12,,Mindful Self-Discipline: Living with Purpose and Achieving Your Goals in a World of Distractions,"If you want to live a life of purpose, build good habits and achieve your goals, there is one skill that is more important than anything Self-Discipline.Self-discipline is not about punishment, itâs about self-respect. It is not about being inflexible, but about living your best life. It is the superpower of focus in a world of distractions â allowing you to overcome procrastination, excuses, bad habits, low motivation, failures, and self-doubt. With it, you can stay on track with your values and goals even through the times when you are least inspired.Self-discipline allows you to choose who you want to be and live by design rather than by default.As a meditation teacher and self-discipline coach, Giovanni Dienstmann has helped hedge fund managers, CEOs, entrepreneurs, ambitious professionals, artists and pro athletes to live a more focused and disciplined life. Since 2014 he has been successfully coaching people to overcome distractions, procrastination, self-doubt, fear, and other forms of self-sabotage. Whatever self-discipline challenge you face, whatever excuse you are telling yourself â Mindful Self-Discipline is a collection of all these years of experience, converted into a tool for you to use.This revolutionary book is a comprehensive and practical guide for you to develop self-discipline in a balanced way â without beating yourself up. It emphasizes the use of mindfulness and awareness as key components for building habits, rather than forcefulness and willpower. If you have tried other methodologies and failed, then this is for you.This manual for living your life purposefully * Over 50 step-by-step exercises* Over 100 illustrations and diagrams* Links to the scientific studies about each topic* Many, many examples â all to make it as easy as possible for you to actually apply all this knowledge and transform your daily life.If you have tried other approaches (Miracle Morning, Atomic Habits, Willpower Instinct, Tiny Habits, Discipline is Freedom, Hooked, Canât Hurt Me) and didnât get the results you were after, then this is for you. Mindful Self-Discipline goes much beyond building habits, time management, and forcing yourself. It is gentler, more achievable, and rooted in living a life of purpose.Think you are not made to be self-disciplined? Think again."
,,,,,745.0,0.12,,The Innocence of Father Brown,"Chesterton portrays Father Brown as a short, stumpy Roman Catholic priest, with shapeless clothes and a large umbrella, and an uncanny insight into human evil. ""How in Tartarus,"" cried Flambeau, ""did you ever hear of the spiked bracelet?"" -- ""Oh, one's little flock, you know!"" said Father Brown, arching his eyebrows rather blankly. ""When I was a curate in Hartlepool, there were three of them with spiked bracelets."" Not long after he published Orthodoxy, G. K. Chesterton moved from London to Beaconsfield, and met Father O'Connor. O'Connor had a shrewd insight to the darker side of man's nature and a mild appearance to go with it--and together those came together to become Chesterton's unassuming Father Brown. Chesterton loved the character, and the magazines he wrote for loved the stories. The Innocence of Father Brown was the first collection of them, and it's a great lot of fun."
,,,,,4251.0,0.12,,If you only Knew,"Is the past about to destroy the future for Faith when she discovers her new boyfriend and her first love are in business together?Would you have the courage to feel the fear and fall in love anyway...?Faith owns The Coffee Pot in the outdoor adventure sports mecca of Derbyshireâs Peak District. She hasnât had a man in her life for a while, as she has been too busy serving cakes to weary rock climbers and mountain bikers to find time for the complications of a relationship with the male of the species.Then Zane and Matt arrive on the scene as the new owners of the Carrdale Adventure Sports Centre.Dating Zane, she soon discovers heâs not the Mr Perfect she thought he was; and why is he so reluctant to talk about his past?As for Matt â well, to Faith he isnât Matt at all because he was a completely different person when he broke her heart all those years ago.With her new boyfriend and her first love running Carrdale as business partners â Matt out to cause trouble and Zane keeping secrets â Faith struggles to keep the peace between them whilst trying to figure out how she feels about the two men in her lifeâ¦"
,,,,,13198.0,0.119,,A Scandal in Bohemia,"This is an adaptation, containing 6 stories; for the original story, see A Scandal in BohemiaA Scandal in Bohemia is collection of six short stories featuring the great detective Sherlock Holmes and his friend Dr Watson. From shopkeepers to kings, everyone wants the help of Sherlock Holmes, but can he solve these mysteries?"
