algorithm,elapsed_time,iterations_done,total_iterations,iterations_per_second,book_index,similarity_score,,book_title,recommended_description
,,,,,1470.0,0.153,,unChristian: What a New Generation Really Thinks about Christianity... and Why It Matters,"David Kinnaman is president of The Barna Group, which provides research and resources that facilitate spiritual transformation in people's lives. Since joining Barna in 1995, David has designed and analyzed nearly five hundred studies for a variety of churches, nonprofits, and corporations. He and George Barna write a free research report published online at www.barna.org. David and his wife Jill have three children and live in Ventura, California.Gabe Lyons founded Fermi Project, a broad collective of innovators, social entrepreneurs, and church and society leaders working together to make positive contributions to culture (www.fermiproject.com). Prior to Fermi Project, Gabe cofounded Catalyst, a national gathering of young leaders, while serving as vice president for John Maxwell's INJOY organization. Gabe, his wife Rebekah, and their three children reside in Atlanta, Georgia.To meet the contributors and learn more about this book and the conversations it is creating, visit www.unchristian.com.This work was commissioned by Fermi Project.The New Testament writer Paul told the first-century Christians: ""You yourselves are our letter . . . known and read by everybody.""When a person ""reads"" your life, what does it say? What does your faith look like to outsiders?A major new research project, unveiled for the first time in this book, describes the increasingly negative reputation of Christians, especially among young Americans.The research shows that Christians are best known for what they are against. They are perceived as being judgmental, antihomosexual, and too political. And young people are quick to point out they believe that Christianity is no longer as Jesus intended. It is unChristian.It shouldn't be this way.What Christians believe may not be popular, but Paul also advised the first believers to ""live wisely among those who are not Christians"" and to ""let your conversation be gracious and effective.""In this eye-opening book, David Kinnaman and Gabe Lyons--along with more than two dozen leading voices within Christianity--unpack the major criticisms leveled against Christians. Understand why those negative images exist and how you can best represent Jesus to your friends, neighbors, and co-workers.Your life is an open book. Is it unChristian?"
,,,,,310.0,0.153,,4â3â2â1,"Nearly two weeks early, on March 3, 1947, in the maternity ward of Beth Israel Hospital in Newark, New Jersey, Archibald Isaac Ferguson, the one and only child of Rose and Stanley Ferguson, is born. From that single beginning, Fergusonâs life will take four simultaneous and independent fictional paths. Four identical Fergusons made of the same DNA, four boys who are the same boy, go on to lead four parallel and entirely different lives. Family fortunes diverge. Athletic skills and sex lives and friendships and intellectual passions contrast. Each Ferguson falls under the spell of the magnificent Amy Schneiderman, yet each Amy and each Ferguson have a relationship like no other. Meanwhile, readers will take in each Fergusonâs pleasures and ache from each Fergusonâs pains, as the mortal plot of each Fergusonâs life rushes on.As inventive and dexterously constructed as anything Paul Auster has ever written, yet with a passion for realism and a great tenderness and fierce attachment to history and to life itself that readers have never seen from Auster before. 4 3 2 1 is a marvelous and unforgettably affecting tour de force."
,,,,,9609.0,0.152,,Everything You Want Me to Be,"No one knows who she really isâ¦Hattie Hoffman has spent her whole life playing many parts: the good student, the good daughter, the good girlfriend. But Hattie wants something more, something bigger, and ultimately something that turns out to be exceedingly dangerous. When sheâs found brutally stabbed to death, the tragedy rips right through the fabric of her small-town community.It soon comes to light that Hattie was engaged in a highly compromising and potentially explosive secret online relationship. The question is: Did anyone else know? And to what lengths might they have gone to end it? Hattieâs boyfriend seems distraught over her death, but had he fallen so deeply in love with her that she had become an obsession? Or did Hattieâs impulsive, daredevil nature simply put her in the wrong place at the wrong time, leading her to a violent death at the hands of a stranger?Full of twists and turns, Everything You Want Me to Be reconstructs a year in the life of a dangerously mesmerizing young woman, during which a small townâs darkest secrets come to the forefrontâ¦and she inches closer and closer to death.Evocative and razor-sharp, Everything You Want Me to Be challenges you to test the lines between innocence and culpability, identity and deception. Does love lead to self-discoveryâor destruction?"
,,,,,2345.0,0.152,,Eisenhower in War and Peace,"NAMED ONE OF THE BEST BOOKS OF THE YEAR BY
The Christian Science Monitor â¢ St. Louis Post-Dispatch
In his magisterial bestseller FDR, Jean Edward Smith gave us a fresh, modern look at one of the most indelible figures in American history. Now this peerless biographer returns with a new life of Dwight D. Eisenhower that is as full, rich, and revealing as anything ever written about Americaâs thirty-fourth president. As America searches for new heroes to lead it out of its present-day predicaments, Jean Edward Smithâs achievement lies in reintroducing us to a hero from the past whose virtues have become clouded in the mists of history. Here is Eisenhower the young dreamer, charting a course from Abilene, Kansas, to West Point, to Paris under Pershing, and beyond. Drawing on a wealth of untapped primary sources, Smith provides new insight into Ikeâs maddening apprenticeship under Douglas MacArthur in Washington and the Philippines. Then the whole panorama of World War II unfolds, with Eisenhowerâs superlative generalship forging the Allied path to victory through multiple reversals of fortune in North Africa and Italy, culminating in the triumphant invasion of Normandy. Smith also gives us an intriguing examination of Ikeâs finances, details his wartime affair with Kay Summersby, and reveals the inside story of the 1952 Republican convention that catapulted him to the White House.Smithâs chronicle of Eisenhowerâs presidential years is as compelling as it is comprehensive. Derided by his detractors as a somnambulant caretaker, Eisenhower emerges in Smithâs perceptive retelling as both a canny politician and a skillful, decisive leader. Smith convincingly portrays an Eisenhower who engineered an end to Americaâs three-year no-win war in Korea, resisted calls for preventative wars against the Soviet Union and China, and boldly deployed the Seventh Fleet to protect Formosa from invasion. This Eisenhower, Smith shows us, stared down Khrushchev over Berlin and forced the withdrawal of British, French, and Israeli forces from the Suez Canal. He managed not only to keep the peaceâafter Ike made peace in Korea, not one American soldier was killed in action during his tenureâbut also to enhance Americaâs prestige in the Middle East and throughout the world.Domestically, Eisenhower reduced defense spending, balanced the budget, constructed the interstate highway system, and provided social security coverage for millions who were self-employed. Ike believed that traditional American values encompassed change and progress.Unmatched in insight, Eisenhower in War and Peace at last gives us an Eisenhower for our timeâand for the ages.Praise for Eisenhower in War and Peace
Â 
 â[A] fine new biography . . . [Eisenhowerâs] White House years need a more thorough exploration than many previous biographers have given them. Smith, whose long, distinguished career includes superb one-volume biographies of Grant and Franklin Roosevelt, provides just that.ââThe Washington Post Â  âHighly readable . . . [Smith] shows us that [Eisenhowerâs] ascent to the highest levels of the military establishment had much more to do with his easy mastery of politics than with any great strategic or tactical achievements.ââThe Wall Street Journal Â  âAlways engrossing . . . Smith portrays a genuinely admirable Eisenhower: smart, congenial, unpretentious, and no ideologue. Despite competing biographies from Ambrose, Perret, and DâEste, this is the best.ââPublishers Weekly (starred review)"
,,,,,11201.0,0.152,,"Ultralearning: Master Hard Skills, Outsmart the Competition, and Accelerate Your Career","Now a Wall Street Journal bestseller. Learn a new talent, stay relevant, reinvent yourself, and adapt to whatever the workplace throws your way. Ultralearning offers nine principles to master hard skills quickly. This is the essential guide to future-proof your career and maximize your competitive advantage through self-education. In these tumultuous times of economic and technological change, staying ahead depends on continual self-educationâa lifelong mastery of fresh ideas, subjects, and skills. If you want to accomplish more and stand apart from everyone else, you need to become an ultralearner. The challenge of learning new skills is that you think you already know how best to learn, as you did as a student, so you rerun old routines and old ways of solving problems. To counter that, Ultralearning offers powerful strategies to break you out of those mental ruts and introduces new training methods to help you push through to higher levels of retention. Scott H. Young incorporates the latest research about the most effective learning methods and the stories of other ultralearners like himselfâamong them Benjamin Franklin, chess grandmaster Judit PolgÃ¡r, and Nobel laureate physicist Richard Feynman, as well as a host of others, such as little-known modern polymath Nigel Richards, who won the French World Scrabble Championshipâwithout knowing French. Young documents the methods he and others have used to acquire knowledge and shows that, far from being an obscure skill limited to aggressive autodidacts, ultralearning is a powerful tool anyone can use to improve their career, studies, and life. Ultralearning explores this fascinating subculture, shares a proven framework for a successful ultralearning project, and offers insights into how you can organize and exe - cute a plan to learn anything deeply and quickly, without teachers or budget-busting tuition costs. Whether the goal is to be fluent in a language (or ten languages), earn the equivalent of a college degree in a fraction of the time, or master multiple tools to build a product or business from the ground up, the principles in Ultralearning will guide you to success."
,,,,,9697.0,0.151,,The Everlasting Man,"What, if anything, is it that makes the human uniquely human? This, in part, is the question that G.K. Chesterton starts with in this classic exploration of human history. Responding to the evolutionary materialism of his contemporary (and antagonist) H.G. Wells, Chesterton in this work affirms human uniqueness and the unique message of the Christian faith. Writing in a time when social Darwinism was rampant, Chesterton instead argued that the idea that society has been steadily progressing from a state of primitivism and barbarity towards civilization is simply and flatly inaccurate. ""Barbarism and civilization were not successive stages in the progress of the world,"" he affirms, with arguments drawn from the histories of both Egypt and Babylon.  As always with Chesterton, there is in this analysis something (as he said of Blake) ""very plain and emphatic."" He sees in Christianity a rare blending of philosophy and mythology, or reason and story, which satisfies both the mind and the heart. On both levels it rings true. As he puts it, ""in answer to the historical query of why it was accepted, and is accepted, I answer for millions of others in my reply; because it fits the lock; because it is like life."" Here, as so often in Chesterton, we sense a lived, awakened faith. All that he writes derives from a keen intellect guided by the heart's own knowledge."
,,,,,6241.0,0.151,,Going Down in Flames,"If her love life is going down in flames, she might as well spark a revolution.Finding out on your sixteenth birthday youâre a shape-shifting dragon is tough to swallow. Being hauled off to an elite boarding school is enough to choke on.Since Bryn is the only crossbreed at the Institute for Excellence, all eyes are on her, but itâs a particular black dragon, Zavien, who catches her attention.Zavien is tired of the Councilâs rules. Segregated clans, being told who to love, and close-minded leaders make freedom of choice almost impossible. The new girl with the striped hair is a breath of fresh air, and with Brynâs help, they may be able to change the rules.At the Institute, old grudges, new crushes, and death threats are all part of a normal day for Bryn. Sheâll need to learn to control her dragon powers if she wants to make it through her first year at school. But even focusing on staying alive is difficult when youâre falling for someone you can't have."
,,,,,103.0,0.15,,The Spy Who Came In from the Cold,"In this classic, John le Carre's third novel and the first to earn him international acclaim, he created a world unlike any previously experienced in suspense fiction. With unsurpassed knowledge culled from his years in British Intelligence, le Carre brings to light the shadowy dealings of international espionage in the tale of a British agent who longs to end his career but undertakes one final, bone-chilling assignment. When the last agent under his command is killed and Alec Leamas is called back to London, he hopes to come in from the cold for good. His spymaster, Control, however, has other plans. Determined to bring down the head of East German Intelligence and topple his organization, Control once more sends Leamas into the fray -- this time to play the part of the dishonored spy and lure the enemy to his ultimate defeat."
,,,,,11590.0,0.15,,Edge of Eternity,"Edge of Eternity is the sweeping, passionate conclusion to Ken Follettâs extraordinary historical epic, The Century Trilogy.
Throughout these books, Follett has followed the fortunes of five intertwined families â American, German, Russian, English, and Welsh â as they make their way through the twentieth century. Now they come to one of the most tumultuous eras of all: the enormous social, political, and economic turmoil of the 1960s through the 1980s, from civil rights, assassinations, mass political movements and Vietnam to the Berlin Wall, the Cuban Missile Crisis, presidential impeachment, revolution â and rock and roll.East German teacher Rebecca Hoffman discovers sheâs been spied on by the Stasi for years and commits an impulsive act that will affect her family for the rest of their lives.â¦George Jakes, the child of a mixed-race couple, bypasses a corporate law career to join Robert F. Kennedyâs Justice Department, and finds himself in the middle not only of the seminal events of the civil rights battle, but a much more personal battle of his own.â¦Cameron Dewar, the grandson of a senator, jumps at the chance to do some official and unofficial espionage for a cause he believes in, only to discover that the world is a much more dangerous place than heâd imagined.â¦Dimka Dvorkin, a young aide to Nikita Khrushchev, becomes a prime agent both for good and for ill as the United States and the Soviet Union race to the brink of nuclear war, while his twin sister, Tania, carves out a role that will take her from Moscow to Cuba to Prague to Warsaw â and into history.As always with Follett, the historical background is brilliantly researched and rendered, the action fast-moving, the characters rich in nuance and emotion. With the hand of a master, he brings us into a world we thought we knew but now will never seem the same again."
,,,,,5408.0,0.15,,The Winner's Crime,"Book two of the dazzling Winner's Trilogy is a fight to the death as Kestrel risks betrayal of country for love.The engagement of Lady Kestrel to Valoriaâs crown prince means one celebration after another. But to Kestrel it means living in a cage of her own making. As the wedding approaches, she aches to tell Arin the truth about her engagement... if she could only trust him. Yet can she even trust herself? Forâunknown to ArinâKestrel is becoming a skilled practitioner of deceit: an anonymous spy passing information to Herran, and close to uncovering a shocking secret.As Arin enlists dangerous allies in the struggle to keep his countryâs freedom, he canât fight the suspicion that Kestrel knows more than she shows. In the end, it might not be a dagger in the dark that cuts him open, but the truth. And when that happens, Kestrel and Arin learn just how much their crimes will cost them."
,,,,,8189.0,0.15,,The King Who Disappeared,"The King Who Disappeared is a fantasy adventure tale. It tells the story of King Bohan who is trapped in cave for over 200 years by Jerado, an evil wizard. The sleep spell cast by Bohan's wizard, Ansgar, is finally broken when an earthquake opens the cave.With no idea how long they slept, Bohan, Ansgar and the king's body guard, all heroes, come across a constable named Leticia who tells the year and other basic information. She recognizes the group as the legenday King Who Disappeared from school lessons. Letica aslo tells Bohan that the country's dictator is a wizard named Jerado.Realizing that this Jerado is his nemisis, Bohan resolves to travel to the capital city, Dun Hythe and extract his revenge. Leticia decides to go with Bohan because Jerado's daughter, Flavia, imprisoned her father and Leticia whats to know where her father is.Jerado discovers Bohan is still alive and headed to Dun Hythe. He tells his children, Flavia and his son, Lithgow, about Bohan. Lithgow is in charge of the miltary and Flavia is the Secretary of the Interior. Both children use their troops in attempts to stop Bohan. His hereoes brush the troops aside.Meanwhile, the leading citizens of Dun Hythe have grown tired of Jerado and his family and they throw their lot in with Bohan. They help Bohan sneak into the city and give him a hiding place. Soon after, Bohan and Asngar confront Jerado and overthrow him. Bohan declares himself King and receives the support of Dun Hythe's citizens.The King who Disappeared is filled with humor and political satire."
,,,,,10130.0,0.149,,A Light in the Window,Book by Karon Jan
,,,,,10366.0,0.149,,The Foundation Trilogy,"Foundation begins a new chapter in the story of man's future. As the Old Empire crumbles into barbarism throughout the million worlds of the galaxy, Hari Seldon and his band of psychologists must create a new entity, the Foundation-dedicated to art, science, and technology-as the beginning of a new empire. Foundation and Empire describes the mighty struggle for power amid the chaos of the stars in which man stands at the threshold of a new enlightened life which could easily be destroyed by the old forces of barbarism. Second Foundation follows the Seldon Plan after the First Empire's defeat and describes its greatest threat-a dangerous mutant strain gone wild, which produces a mind capable of bending men's wills, directing their thoughts, reshaping their desires, and destroying the universe.This adaptation for BBC Radio 4 was first broadcast in 1973 with a cast which included Lee Montague, Maurice Denham, John Justin, Angela Plesence, Wolfe Morris, Julian Glover and Prunella Scales."
,,,,,10651.0,0.149,,The Great Book of Amber,"Alternate cover edition can be found  here Roger Zelazny's chronicles of Amber have earned their place as all-time classics of imaginative literature. Now, here are all ten novels, together in one magnificent omnibus volume. Witness the titanic battle for supremacy waged on Earth, in the Courts of Chaos, and on a magical world of mystery, adventure and romance.--back cover"
,,,,,11026.0,0.148,,Love Warrior,"#1 New York Times BestsellerOprah's Book Club 2016 SelectionA memoir of marriage and self-discovery by bestselling author Glennon Doyle Melton, Love Warrior is a gorgeous and inspiring account of how we are all born to be warriors: strong, powerful, and brave; able to confront the pain and claim the love that exists for us all. This chronicle of a beautiful, brutal journey speaks to anyone who yearns for deeper, truer relationships and a more abundant, authentic life."
,,,,,4903.0,0.148,,The Sky Is Everywhere,"Adrift after her sister Bailey's sudden death, Lennie finds herself torn between quiet, seductive TobyâBailey's boyfriend who shares her griefâand Joe, the new boy in town who bursts with life and musical genius. Each offers Lennie something she desperately needs... though she knows if the two of them collide her whole world will explode.Join Lennie on this heartbreaking and hilarious journey of profound sorrow and mad love, as she makes colossal mistakes and colossal discoveries, as she traipses through band rooms and forest bedrooms and ultimately right into your heart.As much a celebration of love as a poignant portrait of loss, Lennie's struggle to sort her own melody out of the noise around her is always honest, often uproarious, and absolutely unforgettable."
,,,,,11221.0,0.148,,The Book: On the Taboo Against Knowing Who You Are,"At the root of human conflict is our fundamental misunderstanding of who we are. The illusion that we are isolated beings, unconnected to the rest of the universe, has led us to view the âoutsideâ world with hostility, and has fueled our misuse of technology and our violent and hostile subjugation of the natural world. To help us understand that the self is in fact the root and ground of the universe, Watts has crafted a revelatory primer on what it means to be humanâand a mind-opening manual of initiation into the central mystery of existence.In The Book, Alan Watts provides us with a much-needed answer to the problem of personal identity, distilling and adapting the Hindu philosophy of Vedanta. A revelatory primer on what it means to be human, from ""the perfect guide for a course correction in life"" (Deepak Chopra)âand a mind-opening manual of initiation into the central mystery of existence."
,,,,,4940.0,0.147,,Beat the Reaper,"Dr. Peter Brown is an intern at Manhattan's worst hospital, with a talent for medicine, a shift from hell, and a past he'd prefer to keep hidden. Whether it's a blocked circumflex artery or a plan to land a massive malpractice suit, he knows what evil lurks in the hearts of men.Pietro ""Bearclaw"" Brnwna is a hitman for the mob, with a genius for violence, a well-earned fear of sharks, and an overly close relationship with the Federal Witness Relocation Program. More likely to leave a trail of dead gangsters than a molecule of evidence, he's the last person you want to see in your hospital room.Nicholas LoBrutto, aka Eddy Squillante, is Dr. Brown's new patient, with three months to live and a very strange idea: that Peter Brown and Pietro Brnwa might-just might-be the same person ...Now, with the mob, the government, and death itself descending on the hospital, Peter has to buy time and do whatever it takes to keep his patients, himself, and his last shot at redemption alive. To get through the next eight hours-and somehow beat the reaper.Spattered in adrenaline-fueled action and bone-saw-sharp dialogue, BEAT THE REAPER is a debut thriller so utterly original you won't be able to guess what happens next, and so shockingly entertaining you won't be able to put it down."
,,,,,11539.0,0.146,,A Flicker of Light,"As of 5/22/12 this entire book has been rewritten and reeditedIn 1935, the Nazis established a program called âThe Lebensborn.â Their agenda, to genetically engineer perfect Aryan children.These children were to be the new master race, once HItler had cleared all undesirable elements out of Europe. Within a year the first institution was built.The year is 1943....The forests of Munich are crawling with danger under the rule of ""The Third Reich,"" but in order to save the life of her unborn child Petra Jorgenson must escape from the Lebensborn Institute. Alone, seven months pregnant, and penniless avoiding the watchful eyes of the armed guards in the overhead tower, she waits until the dead of night. Then, Petra climbs under the flesh shredding barbed wire that surrounds the institute and at the risk of being captured and murdered she runs headlong into the terriying desolate woods.Even during one of the darkest periods in the history of mankind, when horrific acts of cruelty became commonplace and Germany seemed to have gone crazy following the direction of a madman, unexpected heros came to light. And although there were those who would try to destroy it, true love would prevail. Here, in this lost land ruled by human monsters, Petra will learn that even when one faces what appears to be the end of the world if one looks hard enough one will find that there is always ""A Flicker Of Light."""
