algorithm,elapsed_time,iterations_done,total_iterations,iterations_per_second,book_index,similarity_score,,book_title,recommended_description
,,,,,11353.0,0.133,,A Day No Pigs Would Die,"Out of a rare American tradition, sweet as hay, grounded in the gentle austerities of the Book of Shaker, and in the Universal countryman's acceptance of birth, death, and the hard work of wresting a life from the land comes this haunting novel of a Vermont farm boyhood.In the daily round of his thirteenth year, as the seasons turn and the farm is tended, the boyâwhose time is the only-yesterday of Calvin Coolidge, whose people are the Plain People living without ""frills"" in the Shaker Wayâbecomes a man.That is all, and it is everything. The boy is mauled by Apron, the neighbor's ailing cow whom he helps, alone, to give birth. The grateful farmer brings him a giftâa newborn pig. His father at first demurs (""We thank you, Brother Tanner,"" said Papa, ""but it's not the Shaker Way to take frills for being neighborly. All that Robert done was what any farmer would do for another"") but is persuaded. Rob keeps the pig, names her, and gives her his devotion... He wrestles with grammar in the schoolhouse. He hears rumors of sin. He is takenâat lastâto the Rutland Fair. He broadens his heart to make room even for Baptists. And when his father, who can neither read nor cipher, whose hands are bloodied by his trade, whose wisdom and mastery of country things are bred in the bone, entrusts Rob with his final secret, the boy makes the sacrifice that completes his passage into manhood.All is told with quiet humor and simplicity. Here are lives lived by earthy reasonâin a novel that, like a hoedown country fiddler's tune, rings at the same time with both poignancy and cheer."
,,,,,9457.0,0.133,,Understanding Bible Prophecy for Yourself,"Tim LaHaye's bestselling book (more than 110,000 copies sold) has been redesigned to make its content even more accessible to readers and updated to include timely information relevant to biblical prophecy and current events.This easy-to-follow guide offers the tools believers need to accurately interpret biblical prophecy. Includes: solid guidelines for accurately interpreting Bible prophecycharts that present a clear outline of the futurestep-by-step examples of how to interpret Bible passages on the rapture, second coming, and millennial kingdomexercises that help readers understand key Bible propheciesa comprehensive overview of God's plan for the futureThis resource leads readers to a deeper understanding of how to navigate the exciting and challenging days to come as they also discover the strength and peace of God's sovereignty."
,,,,,1487.0,0.132,,Barely Breathing,"Continuing the Assumption Series with Book 2  The fear of drowning in oneâs own life, never seeing the light to bring you back out, the suffocation one feels when lifeâs problems become too much is something each of us feels at least once in our lives. Is it possible to jump and overcome every hurdle placed in your way? What happens when lifeâs problems make you feel as if youâre caught in a riptide and thereâs no escape but to go under and give into the pull which is dragging you down? Welcome back to Bayshore High School. We join Ayma, Colton, Tabby, Reagan and the rest of the crew where Broken: Book One of the Assumption Series left off. When it seems Aymaâs world canât get any more complicated, more life changing events are thrown her way. She will face turmoil in love and friendship, never knowing whether she will survive the storm or become a victim of its path of destruction. Ayma and Colton have never had it easy in their relationship. Now the threat of a new love interest, the emergence of an old flame, and a possible addition means more controversy in their love affair. What are the secrets that some of Bayshore students are keeping? What will happen to friendships and love relationships when these secrets are revealed? Finally, light is shed on the secrets of several characters we have grown to love from Broken. Each has their story to tell, and a past which can affect all of their futures. There is more drama and heated romance than a soap opera and as the storyline begins to unfold, you will be drawn in as you begin to either love or hate the students of Bayshore High."
,,,,,11639.0,0.132,,Nov-09,"Fallon meets Ben, an aspiring novelist, the day before her scheduled cross-country move. Their untimely attraction leads them to spend Fallonâs last day in L.A. together, and her eventful life becomes the creative inspiration Ben has always sought for his novel. Over time and amidst the various relationships and tribulations of their own separate lives, they continue to meet on the same date every year. Until one day Fallon becomes unsure if Ben has been telling her the truth or fabricating a perfect reality for the sake of the ultimate plot twist.Can Benâs relationship with Fallonâand simultaneously his novelâbe considered a love story if it ends in heartbreak?Beloved #1 New York Times bestselling author Colleen Hoover returns with an unforgettable love story between a writer and his unexpected muse."
,,,,,2081.0,0.132,,The Blind Side: Evolution of a Game,"The young man at the center of this extraordinary and moving story will one day be among the most highly paid athletes in the National Football League. When we first meet him, he is one of thirteen children by a mother addicted to crack; he does not know his real name, his father, his birthday, or any of the things a child might learn in school such as, say, how to read or write. Nor has he ever touched a football.What changes? He takes up football, and school, after a rich, Evangelical, Republican family plucks him from the mean streets. Their love is the first great force that alters the world's perception of the boy, whom they adopt. The second force is the evolution of professional football itself into a game where the quarterback must be protected at any cost. Our protagonist turns out to be the priceless combination of size, speed, and agility necessary to guard the quarterback's greatest vulnerability: his blind side."
,,,,,298.0,0.132,,The Shadow Crucible,"In a world where angels, demons, and gods fight over the possession of mortal souls, two conflicted pawns are ensnared in a cruel game. The enigmatic seer Estella finds herself thrown together with Count Mikhail, a dogmatic Templar dedicated to subjugating her kind. But when a corrupted cardinal and puppet king begin a systematic genocide of her people, the two become unlikely allies.Taking humanity back to their primordial beliefs and fears, Estella confronts Mikhailâs faith by revealing the true horror of the lucrative trade in human souls. All organized religions are shops orchestrated to consume mankind. Every deity, religion, and spiritual guide has been corrupted, and each claims to have the monopoly on truth and salvation.In a perilous game where the truth is distorted and meddling ancient deities converge to partake of the unseen battle, Estella unwittingly finds herself hunted by Lucifer. Traversing the edge of hellâs precipice, Estella and Mikhail are reduced to mere instruments. Their only means to overcome is through courting the Threefold Death, the ancient ritual of apotheosisâof man becoming God.The Shadow Crucible is a gripping epic set in medieval England where the struggle for redemption is crushed by the powers of evil. Tamara Lakomy is a new and compelling voice in the world of dark fantasy."
,,,,,13077.0,0.132,,Popular: Vintage Wisdom for a Modern Geek,"A touchingly honest, candidly hysterical memoir from breakout teen author Maya Van Wagenen
Stuck at the bottom of the social ladder at pretty much the lowest level of people at school who arenât paid to be here,â Maya Van Wagenen decided to begin a unique social experiment: spend the school year following a 1950s popularity guide, written by former teen model Betty Cornell. Can curlers, girdles, Vaseline, and a strand of pearls help Maya on her quest to be popular? The real-life resultsÂ are painful, funny, and include a wonderful and unexpected surpriseâmeeting and befriending Betty Cornell herself. Told with humor and grace, Mayaâs journey offers readers of all ages a thoroughly contemporary example of kindness and self-confidence."
,,,,,6289.0,0.132,,Crimson Shadows,"A sequel to ""Crimson Kiss"" and ""Crimson Night"": decades have passed since Meghann O'Neill fell in love with Simon Baldeva, a vampire who bestowed upon her his gift of immortality and bound her to him with the birth of their two children - one mortal and one a vampire."
,,,,,12379.0,0.132,,Wir Kinder vom Bahnhof Zoo,"Sie ist heute sechzehn, kam mit zwÃ¶lf in einem evangelischen Jugendheim zum Haschisch, mit dreizehn in einer Diskothek zum Heroin. Sie wurde sÃ¼chtig, ging morgens zur Schule und nachmittags mit ihren ebenfalls heroinabhÃ¤ngigen Freunden auf den Kinderstrich am Bahnhof Zoo, um das Geld fÃ¼r die Droge zu beschaffen. Ihre Mutter bemerkte fast zwei Jahre Iang nichts vom Doppelleben ihrer Tochter. Christiane F. berichtet mit minuziÃ¶sem ErinnerungsvermÃ¶gen und rÃ¼ckhaltioser Offenheit Ã¼ber Schicksale von Kindern, die von der Ãffentlichkeit erst als Drogentote zur Kenntnis genommen werden. Die Geschichte der Christiane F. wiederholt sich in Berlin, in KleinstÃ¤dten und DÃ¶rfern bereits zehntausendfach."
,,,,,4525.0,0.131,,Paint Me Beautiful,"A Tale of Anorexia, a Love Story, and the Rebirth of Claire SimoneâI'm dying to be beautiful.âMy story isn't unique. You've heard it before. I'm just a girl who doesn't eat as much as she should. See, I have goals, big ones, and nobody is going to stop me, not even a boy named Emmett. He has good intentions and he's hot as hell, but he doesn't understand what it's like to want something so bad that you'll do anything for it. I'm going to become a model, even if it kills me. Dream big or go home, that's what they always say, right?Paint Me Beautiful, a New Adult/Contemporary Romance Novel Recommended for Ages 18 and Up.From the Bestselling Author of the Never say Never Trilogy (Tasting Never, Finding Never, & Keeping Never)"
,,,,,4778.0,0.131,,Dead Witch Walking,"All the creatures of the night gather in ""the Hollows"" of Cincinnati, to hide, to prowl, to party... and to feed.Vampires rule the darkness in a predator-eat-predator world rife with dangers beyond imagining - and it's Rachel Morgan's job to keep that world civilized.A bounty hunter and witch with serious sex appeal and an attitude, she'll bring 'em back alive, dead... or undead."
,,,,,10061.0,0.131,,Slugs,"They slime, they ooze, they kill... A novel of mind-shattering horror, and a new breed of slime-ridden, oozing slugs lurking in the waist-high grass, developing a taste for new things...for blood, for flesh...human flesh!"
,,,,,2449.0,0.131,,Abandon,"A gripping thriller from Blake Crouch, internationally bestselling author of the Wayward Pines trilogy.On Christmas Day in 1893, every man, woman, and child in a remote gold-mining town disappeared, belongings forsaken, meals left to freeze in vacant cabinsâand not a single bone was ever found.One hundred sixteen years later, two backcountry guides are hired by a history professor and his journalist daughter to lead them to the abandoned mining town so they can learn what happened. Recently, a similar party had also attempted to explore the town and was never heard from again. Now the area is believed to be haunted. This crew is about to discover, twenty miles from civilization with a blizzard bearing down, that they are not alone, and the past is very much alive.Revised edition: This edition of Abandon includes editorial revisions."
,,,,,2750.0,0.131,,Explosion in Paris,"Explosion in Paris is the story of one woman's determination to better her life because she has finally found the man of her dreams! By refusing to accept her husband's death sentence assessment of her soul, Angela Briann Scott is challenging herself to reach beyond her limits. This is especially true since her accidental meeting with the devastatingly handsome Ross Leigh Stafford. He's a man of high principles, irreproachable character, unsinkable spirit, and unwavering compassion, all the qualities that her husband, Mitch, is seriously lacking. Angie's adopted country of France glows with charm and beauty through her eyes. By reinventing herself to save her life, she discovers her true essence and she develops a strong sense of self-worth. Her impressive success and enduring strength tell a story that will keep readers engrossed to the very end!"
,,,,,3688.0,0.131,,Ripped From the Pages,"When book-restoration expert Brooklyn Wainwright temporarily relocates to her parentsâ place in Northern California, she finds that wooden barrels arenât the only things buried in the wine caves of Sonomaâ¦. Â  Excited to explore the secrets of wine country, Brooklyn attends an excavation of the caves hidden deep under her parentsâ communeâand the findings are explosive. A room is unearthed, and it contains a treasure trove of artwork, rare books, a chest of jewelryâ¦and a perfectly mummified body. Â  A closer examination of the murdered manâs possessions reveals a valuable first edition of Jules Verneâs A Journey to the Center of the Earth. Hidden in the book is a secret map that unveils an even greater hoard of treasures brought to California by French winemakers fleeing the Nazi invasion with the commune leaderâs grandfather, Anton, among them. Â  As reporters and art appraisers flock to Sonoma to see the precious bounty, questions begin to riseâdid Anton hide these items to protect them, or did he steal them for himself? Who is the mysterious man left for dead inside the cave? But not all crime is buried in the past. When a new presence threatens the townâs peace, Brooklyn decides to do a little excavating of her own and solve the mystery of the treasure before anyone else is written off.â¦"
,,,,,10242.0,0.13,,Talking to Humans,"With a foreword from Steve Blank, Talking to Humans is a practical guide to the qualitative side of customer development, an indispensable skill for vetting and improving any new startup or innovation. This book will teach you how to structure and run effective customer interviews, find candidates, and turn learnings into action."
,,,,,10663.0,0.129,,Pedagogy of the Oppressed,"First published in Portuguese in 1968, Pedagogy of the Oppressed was translated and published in English in 1970. The methodology of the late Paulo Freire has helped to empower countless impoverished and illiterate people throughout the world. Freire's work has taken on especial urgency in the United States and Western Europe, where the creation of a permanent underclass among the underprivileged and minorities in cities and urban centers is increasingly accepted as the norm. With a substantive new introduction on Freire's life and the remarkable impact of this book by writer and Freire confidant and authority Donaldo Macedo, this anniversary edition of Pedagogy of the Oppressed will inspire a new generation of educators, students, and general readers for years to come."
,,,,,6009.0,0.129,,For the May Queen,"It's 1981 and 17-year-old Norma Rogers' parents drop her off at the college dorms. Soon, Norma finds herself drunk and nearly naked with three strangers. The strip poker event is the first of many experiences that prompt Norma to question who she is-and who she wants to be. Norma's relationships with an array of characters induce her to grapple with society's messages about women, sex, and freedom. These characters include Jack, her aloof on-again, off-again boyfriend; Goat, her antsy dorm neighbor; Liz Chan, a pot-smoking sorority girl; Benny Moss, a nerdy guy who has a thing for Liz; and Paul Fellows, Benny's roommate, whom Norma calls Chuck because he reminds her of Charlie Brown. Chuck, a witty aficionado of old films, plays a pivotal role in Norma's discoveries about life's possibilities, as does Norma's roommate Stacy-a beautiful, kind, and somewhat mysterious blonde. Many tumultuous events take Norma through an array of troubles, pleasures, and thrills: from drug use and ominous encounters with strangers, to rowdy parties and road trips, to queer coming-out surprises. In the midst of these incidents-which are peppered with 1970's and 1980's pop cultural references-Norma reflects on her desire for freedom (sexual and otherwise). Reinforcing these themes are the intermittent appearances of her middle-class parents and her sister, as well as her best friend from high school whose life in a small town-as she prepares for her upcoming wedding-is poles apart from Norma's. Ultimately Norma comes to see that there are many ways to live and love."
,,,,,9267.0,0.129,,Stained,"An intensely powerful account of a teen, bullied for her port-wine stain, who must summon her personal strength to survive abduction and horrific abuse at the hands of a deranged killer.Sixteen-year-old Sarah Meadows longs for ""normal."" Born with a port wine stain covering half her face, all her life she's been plagued by stares, giggles, bullying, and disgust. But when she's abducted on the way home from school, Sarah is forced to uncover the courage she never knew she had, become a hero rather than a victim, and learn to look beyond her face to find the beauty and strength she has inside. It's that-or succumb to a killer."
,,,,,378.0,0.129,,Wool,"Thousands of them have lived underground. They've lived there so long, there are only legends about people living anywhere else. Such a life requires rules. Strict rules. There are things that must not be discussed. Like going outside. Never mention you might like going outside.Or you'll get what you wish for."
,,,,,3266.0,0.129,,Veiled,"She just wanted a normal life. He had other plans for her.Death.It's something that Ada Palomino has always known so well, having grown up in a house of horrors, surrounded by a family plagued by ghosts and demons and things that go bump in the night.But after the sudden and tragic death of her mother two years ago, death has never felt so personal. Or so close.Now eighteen, Ada is trying to move on with her life and the last month of summer holds nothing but sunshine and promises with her first year at a Portland design school just around the bend. That is until her increasingly violent and realistic dreams, dreams of other worlds, of portals and veils where her mother is tortured and souls bleed for mercy, start to blend into reality. Ada has to lean on her older sister, Perry, to try and make sense of it all but even then, she's never felt more alone. Then there's Jay. Tall, handsome and deeply mysterious, Jay would be just another stranger, a familiar face on the bus, if it wasn't for the fact that Ada has met him before. Every night. In every single dream. And the more that Ada is drawn to him in both worlds, the more she's in danger of losing everything. Including her heart.And her very soul."
,,,,,5162.0,0.128,,Ash,"Cinderella retold
In the wake of her father's death, Ash is left at the mercy of her cruel stepmother. Consumed with grief, her only joy comes by the light of the dying hearth fire, rereading the fairy tales her mother once told her. In her dreams, someday the fairies will steal her away, as they are said to do. When she meets the dark and dangerous fairy Sidhean, she believes that her wish may be granted.The day that Ash meets Kaisa, the King's Huntress, her heart begins to change. Instead of chasing fairies, Ash learns to hunt with Kaisa. Though their friendship is as delicate as a new bloom, it reawakens Ash's capacity for love-and her desire to live. But Sidhean has already claimed Ash for his own, and she must make a choice between fairy tale dreams and true love.Entrancing, empowering, and romantic, Ash is about the connection between life and love, and solitude and death, where transformation can come from even the deepest grief."
,,,,,6907.0,0.128,,Dark Places,"Libby Day was just seven years old when her evidence put her fifteen-year-old brother behind bars.Since then, she has been drifting. But when she is contacted by a group who are convinced of Ben's innocence, Libby starts to ask questions she never dared to before. Was the voice she heard her brother's? Ben was a misfit in their small town, but was he capable of murder? Are there secrets to uncover at the family farm or is Libby deluding herself because she wants her brother back?She begins to realise that everyone in her family had something to hide that day... especially Ben. Now, twenty-four years later, the truth is going to be even harder to find.Who did massacre the Day family?"
,,,,,10874.0,0.128,,A Pair of Blue Eyes,"Elfride Swancourt is the daughter of the Rector of Endelstow, a remote sea-swept parish in Corwall based on St Juliot, where Hardy began A Pair of Blue Eyes during the beginning of his courtship of his first wife, Emma. Blue-eyed and high-spirited, Elfride has little experience of the world beyond, and becomes entangled with two men: the boyish architect, Stephen Smith, and the older literary man, Henry Knight. The former friends become rivals, and Elfride faces an agonizing choice. Written at a crucial time in Hardy's life, A Pair of Blue Eyes expresses more directly than any of his novels the events and social forces that made him the writer he was. Elfride's dilemma mirrors the difficult decision Hardy himself had to make with this novel: to pursue the profession of architecture, where he was established, or literature, where he had yet to make his name. This updated edition contains a new introduction, bibliography, and chronology."
,,,,,11136.0,0.127,,Sackett,"A drifter by circumstance, William Tell Sackett hungered for a place he couldnât name but knew he had to find. South of the Tetons, through a keyhole pass, he found it: a lonely yet beautiful valleyâwith a fortune in gold. Then he found an even greater treasure: Ange Kerry, a courageous and resourceful woman. But the harsh ways it takes to protect his claimâand their livesâmay be the one thing that drives Ange away."
,,,,,6589.0,0.127,,Magic Graves,"New York Times bestselling authors Jeaniene Frost and Ilona Andrews bring you two short stories of paranormal.  Jeaniene Frost's story, One for the Money, features vampires Cat and Bones trying to protect a spoiled heiress with a price on her head and an undead hitman on her trail. Previously published in Death's Excellent Vacation. Also includes the first three chapters from Jeaniene's story in The Bite Before Christmas anthology, as well as a sneak peek at ONCE BURNED, the first novel in the new Night Prince series.  Ilona Andrews' story, A Questionable Client, is a prequel to her award-winning Kate Daniels series. In a world beset by magic waves, Kate Daniels works as a mercenary. She is tired, hungry, and there is foul-smelling blood on her boots. All she wants to do is to go home, but when Mercenary Guild offers her a job she can't refuse, she finds herself protecting a man against Russian wizards. Previously published in Dark and Stormy Knights. Also includes first two chapters of FATE'S EDGE, book 3 in the Edge series, and first two chapters of Magic Grieves, a Kate Daniels novella."
,,,,,9213.0,0.127,,Last Light,"In the face of a crisis that sweeps an entire high-tech planet back to the age before electricity, Deni Branning's career ambitions have vanished. She's not about to let her dream of marriage go as well.But keeping it alive will require extraordinary measures. Yesterday's world is gone. All Deni and her family have left is each other and their neighbors. Their little community will either stand or fall together. But they're only beginning to realize it - and trust doesn't come easily.Particularly when one of them is a killer.Best-selling suspense author Terri Blackstock weaves a masterful what-if novel in which global catastrophe reveals the darkness in human hearts - and lights the way to restoration for a self-centered world."
,,,,,8321.0,0.127,,"The Prize Winner of Defiance, Ohio: How My Mother Raised 10 Kids on 25 Words or Less","Evelyn Ryan, wife of an alcoholic husband and mother of ten children, lived in a small town in a time and place when women did not seek jobs outside the home. When finances ran low, feeling desperate, she turned to her parish priest who suggested she ""take in laundry."" Ryan had to laugh at the advice because she could barely keep up with her own family's washing and ironing. A lesser woman might have succumbed to poverty, but she was determined to keep her family financially afloat and to teach her children that the life of the mind was important. In the early 1950s, Ryan started entering contests, composing her jingles, poems, and essays at the ironing board. She won household appliances, bikes, watches, clocks, and, occasionally, cash. She won a freezer, and several weeks later, she won a supermarket shopping-spree. When the family was faced with eviction, she received a $5000 first place check from the regional Western Auto Store. Ryan's unconventionality and sense of humor triumphed over poverty, and her persistence makes the reader cheer her on."
