algorithm,elapsed_time,iterations_done,total_iterations,iterations_per_second,book_index,similarity_score,,book_title,recommended_description
,,,,,10815.0,0.232,,Case Histories,"In #1 of series, Jackson Brodie PI follows three 30-years cold, unconnected Cambridge family cases:  1 A little girl disappears in the night.  2 A beautiful young office worker falls to a maniac's attack. 3 A new mother is overwhelmed by demands from her baby and husband - until a fit of rage creates a grisly, bloody escape.Result : Startling connections and discoveries emerge. . . ."
,,,,,9845.0,0.221,,American Ulysses: A Life of Ulysses S. Grant,"NEW YORK TIMES BESTSELLER - From the author of A. Lincoln, a major new biography of one of America's greatest generals--and most misunderstood presidentsFinalist for the Gilder-Lehrman Military History Book Prize In his time, Ulysses S. Grant was routinely grouped with George Washington and Abraham Lincoln in the ""Trinity of Great American Leaders."" But the battlefield commander-turned-commander-in-chief fell out of favor in the twentieth century. In American Ulysses,  Ronald C. White argues that we need to once more revise our estimates of him in the twenty-first.Based on seven years of research with primary documents--some of them never examined by previous Grant scholars--this is destined to become the Grant biography of our time. White, a biographer exceptionally skilled at writing momentous history from the inside out, shows Grant to be a generous, curious, introspective man and leader--a willing delegator with a natural gift for managing the rampaging egos of his fellow officers. His wife, Julia Dent Grant, long marginalized in the historic record, emerges in her own right as a spirited and influential partner.Grant was not only a brilliant general but also a passionate defender of equal rights in post-Civil War America. After winning election to the White House in 1868, he used the power of the federal government to battle the Ku Klux Klan. He was the first president to state that the government's policy toward American Indians was immoral, and the first ex-president to embark on a world tour, and he cemented his reputation for courage by racing against death to complete his Personal Memoirs. Published by Mark Twain, it is widely considered to be the greatest autobiography by an American leader, but its place in Grant's life story has never been fully explored--until now.One of those rare books that successfully recast our impression of an iconic historical figure, American Ulysses gives us a finely honed, three-dimensional portrait of Grant the man--husband, father, leader, writer--that should set the standard by which all future biographies of him will be measured.Praise for American Ulysses""[Ronald C. White] portrays a deeply introspective man of ideals, a man of measured thought and careful action who found himself in the crosshairs of American history at its most crucial moment.""--USA Today""White delineates Grant's virtues better than any author before. . . . By the end, readers will see how fortunate the nation was that Grant went into the world--to save the Union, to lead it and, on his deathbed, to write one of the finest memoirs in all of American letters.""--The New York Times Book Review""Ronald White has restored Ulysses S. Grant to his proper place in history with a biography whose breadth and tone suit the man perfectly. Like Grant himself, this book will have staying power.""--The Wall Street Journal""Magisterial . . . Grant's esteem in the eyes of historians has increased significantly in the last generation. . . . [American Ulysses] is the newest heavyweight champion in this movement.""--The Boston Globe ""Superb . . . illuminating, inspiring and deeply moving . . . The Grant we meet in American Ulysses is richly deserving of a fuller understanding and of celebration for the man he was and the legacy he left us.""--Chicago Tribune""In this sympathetic, rigorously sourced biography, White . . . conveys the essence of Grant the man and Grant the warrior.""--Newsday"
,,,,,6037.0,0.217,,Men of the Cave,"Raised by unorthodox parents, Kasey Reese has always struggled to be invisible, to not be noticed, to avoid conflict. Running from a broken relationship, Kasey flees to Spain on a scholarship, to restore the comfort she finds in anonymity. Destiny, however, has other plans for her - a life threatening, life-altering journey into the supernatural when she meets the men of the cave."
,,,,,177.0,0.214,,Prodigal Summer,"Prodigal Summer weaves together three stories of human love within a larger tapestry of lives inhabiting the forested mountains and struggling small farms of southern Appalachia.From her outpost in an isolated mountain cabin, Deanna Wolfe, a reclusive wildlife biologist, watches a den of coyotes that have recently migrated into the region. She is caught off-guard by a young hunter who invades her most private spaces and confounds her self-assured, solitary life. On a farm several miles down the mountain, Lusa Maluf Landowski, a bookish city girl turned farmer's wife, finds herself unexpectedly marooned in a strange place where she must declare or lose her attachment to the land that has become her own. And a few more miles down the road, a pair of elderly feuding neighbors tend their respective farms and wrangle about God, pesticides, and the possibilities of a future neither of them expected.Over the course of one humid summer, these characters find their connections to one another and to the flora and fauna with whom they share a place. Prodigal Summer demonstrates a balance of narrative, drama and ideas that is characteristic of Barbara Kingsolver's finest work."
,,,,,7512.0,0.211,,The Cold Moon,"On a freezing December night, with a full moon hovering in the black sky over New York City, two people are brutally murdered -- the death scenes marked by eerie, matching calling cards: moon-faced clocks investigators fear ticked away the victims' last moments on earth. Renowned criminologist Lincoln Rhyme immediately identifies the clock distributor and has the chilling realization that the killer -- who has dubbed himself the Watchmaker -- has more murders planned in the hours to come.Rhyme, a quadriplegic long confined to his wheelchair, immediately taps his trusted partner and longtime love, Amelia Sachs, to walk the grid and be his eyes and ears on the street. But Sachs has other commitments now -- namely, her first assignment as lead detective on a homicide of her own. As she struggles to balance her pursuit of the infuriatingly elusive Watchmaker with her own case, Sachs unearths shocking revelations about the police force that threaten to undermine her career, her sense of self and her relationship with Rhyme. As the Rhyme-Sachs team shows evidence of fissures, the Watchmaker is methodically stalking his victims and planning a diabolical criminal masterwork.... Indeed, the Watchmaker may be the most cunning and mesmerizing villain Rhyme and Sachs have ever encountered."
,,,,,5726.0,0.202,,Spark,"Gabriel Merrick plays with fire. Literally. Sometimes he can even control it. And sometimes he can't. Gabriel has always had his brothers to rely on, especially his twin, Nick. But when an arsonist starts wreaking havoc on their town, all the signs point to Gabriel. Only he's not doing it. And no one seems to believe him. Except a shy sophomore named Layne, a brainiac who dresses in turtlenecks and jeans and keeps him totally off balance. Because Layne has a few secrets of her own..."
,,,,,12949.0,0.197,,Why the World Sucks and What We Can Do About It,"Tired of watching the news, which is almost always bad? Frustrated at the deterioration of our society? Concerned about the world we will leave to our children? Think that the average person was a better person a generation or two ago?Politics won't solve the problem. It's now a game which goes round in circles, accomplishing little. Financial mismanagement is everywhere. Look at Greece, Spain and Italy. But also look at France and the United States. We're managing our governments like spoiled children. And it doesn't matter whether it's liberals or conservatives who are in charge.Both left and right are to blame because the problem is the system itself. âWhy the World Sucksâ outlines the issues and provides possible solutions. From a slightly eccentric point of view and with a little bit of humor. What more could you ask for?"
,,,,,13180.0,0.197,,Fireproof,"INSIDE BURNING BUILDINGS, Captain Caleb Holt lives by the firefighter's adage: NEVER LEAVE YOUR PARTNER. Yet at home, in the cooling embers of his marriage, he lives by his own rules.Growing up, his wife Catherine always dreamed of marrying a loving, brave firefighter . . . just like her father.Now, after seven years of marriage, she wonders when she stopped being ""good enough.""Countless arguments and anger have them wanting to move on to something with more sparks.As they prepare for divorce, Caleb's father challenges him to commit to a 40-day experiment: ""The Love Dare."" Wondering if it's even worth the effort, Caleb reluctantly agrees, not realizing how it will change his world forever.Surprised by what he discovers about the meaning of love, Caleb begins to see his wife and marriage as worth fighting for.But is it too late? His job is to rescue others.Now Captain Holt must face his toughest job ever. . . rescuing his wife's heart."""
,,,,,3292.0,0.19,,Charity Rising,"In this fast-paced, two-part sequel Charity is finally settling into her new role as alpha female to the Drake pack. With Prom and Graduation approaching, this should be the best time of her life, but something is wrong with Leviâdangerously wrong. With his odd behavior growing daily and her now blackening connection symbol, Charity is spurred into action. Itâs a race against time, and any delay could result in the death of the only man she can ever love. Can she save him in time? If so, will their undying love and a stronger-than-ever heart connection be enough to withstand the damage created? This installment in the Charity Series is fully loaded with everything from unlikely alliances, battles and romance, to humor, mystery, and even betrayal, as well as a few other surprises along the way. You have officially been warned."
,,,,,8287.0,0.187,,Two Little Girls in Blue,"In this riveting thriller from Queen of Suspense and #1 New York Times bestselling writer Mary Higgins Clark brilliantly weaves the mystery of twin telepathy into a mother's search for a kidnapped child, presumed dead.When Margaret and Steve Frawley come home to Connecticut from a black-tie dinner in New York, their three-year-old twins, Kathy and Kelly, are gone. The police found the babysitter unconscious, and a ransom note from the Pied Piper demands eight million dollars. Steve's global investment firm puts up the money, but when they go to retrieve the twins, only Kelly is in the car. The dead driver's suicide note says he inadvertently killed Kathy.At the memorial, Kelly tugs Margaret's arm and says: Mommy, Kathy is very scared of that lady. She wants to come home right now. At first, only Margaret believes that the twins are communicating and that Kathy is still alive. But as Kelly's warnings become increasingly specific and alarming, FBI agents set out on a desperate search."
,,,,,11070.0,0.186,,The Hard Thing About Hard Things: Building a Business When There Are No Easy Answers,"A lot of people talk about how great it is to start a business, but only Ben Horowitz is brutally honest about how hard it is to run one.In The Hard Thing About Hard Things, Ben Horowitz, cofounder of Andreessen Horowitz and one of Silicon Valley's most respected and experienced entrepreneurs, draws on his own story of founding, running, selling, buying, managing, and investing in technology companies to offer essential advice and practical wisdom for navigating the toughest problems business schools don't cover. His blog has garnered a devoted following of millions of readers who have come to rely on him to help them run their businesses. A lifelong rap fan, Horowitz amplifies business lessons with lyrics from his favorite songs and tells it straight about everything from firing friends to poaching competitors, from cultivating and sustaining a CEO mentality to knowing the right time to cash in.His advice is grounded in anecdotes from his own hard-earned riseâfrom cofounding the early cloud service provider Loudcloud to building the phenomenally successful Andreessen Horowitz venture capital firm, both with fellow tech superstar Marc Andreessen (inventor of Mosaic, the Internet's first popular Web browser). This is no polished victory lap; he analyzes issues with no easy answers through his trials, includingdemoting (or firing) a loyal friend;whether you should incorporate titles and promotions, and how to handle them;if it's OK to hire people from your friend's company;how to manage your own psychology, while the whole company is relying on you;what to do when smart people are bad employees;why Andreessen Horowitz prefers founder CEOs, and how to become one;whether you should sell your company, and how to do it.Filled with Horowitz's trademark humor and straight talk, and drawing from his personal and often humbling experiences, The Hard Thing About Hard Things is invaluable for veteran entrepreneurs as well as those aspiring to their own new ventures."
,,,,,1421.0,0.185,,Amish Under Fire,"After Maria Mastâs abusive ex-boyfriend is arrested for being involved in sex trafficking and modern-day slavery, she thinks that she and her son Carter are finally safe.   But the danger has only just begun.  Someone begins stalking her, and they want blood and revenge.  Agent Derek Turner of Covert Police Detectives Unit is assigned as her bodyguard. From the moment they meet in a bank robbery where she saves a little girl's life, he is fascinated by her.  When Maria returns home to her former Amish community in Unity, Maine, Derek goes with her as her undercover bodyguard, and tried to blend in with the other Amish men.  For him, itâs personal. Heâs determined to arrest her stalker and shut down the sex trafficking ring that he believes may have killed his late wife two years ago.  Maria's secretive eyes, painful past, and cautious demeanor intrigue him.   As the human trafficking ring begins to target the Amish community, Derek wonders if the distraction of her will cost him his careerâ¦and Maria's life.    Don't miss Book 1, the bestselling Undercover Amish. These books are stand-alone novels but may be read in order for the best reading experience.  Go to ashleyemmaauthor.com to download free eBooks!   FACT: Did you know there is still slavery today, even in the USA?  There are more people in slavery today than there were during the Civil War or any other time in history. And it's happening where you live.  Help end human trafficking (modern-day slavery)!  I, Ashley Emma, am passionate about raising awareness about human trafficking. A portion of this book's profits goes to International Justice Mission, an organization that rescues and offers rehabilitation and shelter to survivors of this heinous crime.  So far, they've  rescued more than 40,000 people  from violence and oppression. And, today, their work is helping to protect 21 million people globally from violence. Find out more or donate at www.ijm.org."
,,,,,7088.0,0.184,,The Bad Beginning,"Dear Reader,I'm sorry to say that the book you are holding in your hands is extremely unpleasant. It tells an unhappy tale about three very unlucky children. Even though they are charming and clever, the Baudelaire siblings lead lives filled with misery and woe. From the very first page of this book when the children are at the beach and receive terrible news, continuing on through the entire story, disaster lurks at their heels. One might say they are magnets for misfortune.In this short book alone, the three youngsters encounter a greedy and repulsive villain, itchy clothing, a disastrous fire, a plot to steal their fortune, and cold porridge for breakfast.It is my sad duty to write down these unpleasant tales, but there is nothing stopping you from putting this book down at once and reading something happy, if you prefer that sort of thing.With all due respect,Lemony Snicket"
,,,,,4309.0,0.182,,The Line,"I was a thief. The invisible girl only he could see. The woman who wanted to be more. He was the mark. The extraordinary cowboy who stole my sixteen-year-old heart. The damaged man who still owned it, even four years later.The Line was where we began.Where fates collided. Where truths derailed.The place where our love story ends."
,,,,,10148.0,0.18,,Dog on It,"Meet Chet, the wise and lovable canine narrator of Dog on It, who works alongside Bernie, a down-on-his-luck private investigator. Chet might have flunked out of police school (""I'd been the best leaper in K-9 class, which had led to all the trouble in a way I couldn't remember exactly, although blood was involved""), but he's a detective through and through.In this, their first adventure, Chet and Bernie investigate the disappearance of Madison, a teenage girl who may or may not have been kidnapped, but who has definitely gotten mixed up with some very unsavory characters. A well-behaved, gifted student, she didn't arrive home after school and her divorced mother is frantic. Bernie is quick to take the case â something about a cash flow problem that Chet's not all that clear about â and he's relieved, if vaguely suspicious, when Madison turns up unharmed with a story that doesn't add up. But when she disappears for a second time in a week, Bernie and Chet aren't taking any chances; they launch a full-blown investigation. Without a ransom demand, they're not convinced it's a kidnapping, but they are sure of one thing: something smells funny.Their search for clues takes them into the desert to biker bars and other exotic locals, with Chet's highly trained nose leading the way. Both Chet and Bernie bring their own special skills to the hunt, one that puts each of them in peril. But even as the bad guys try to turn the tables, this duo is nothing if not resourceful, and the result is an uncommonly satisfying adventure.With his doggy ways and his endearingly hardboiled voice, Chet is full of heart and occasionally prone to mischief. He is intensely loyal to Bernie, who, though distracted by issues that Chet has difficulty understanding â like divorce, child custody, and other peculiar human concerns â is enormously likable himself, in his flawed, all-too-human way."
,,,,,3608.0,0.179,,Winter Hopes,"Author Jennifer Gracen reunites sexy, sophisticated Sam and sweet but wounded Lydia in Book Two of the Seasons of Love series, âWinter Hopesâ. Newly divorced mom Lydia is still getting back on her feet, and still reeling from her intense encounter with Sam at a friendâs destination wedding. As they tentatively explore the demands and rewards of long-distance dating, their instant connection evolves against the vibrant backdrop of New York City. Each begins to trust again â opening up is difficult, even painful, but the joy and hope they feel in each otherâs arms demands they lay their hearts on the line. Can their love survive the miles that separate them, and the complexities of nurturing a relationship via email, text and phone? And when Sam finally meets Lydiaâs family, will old resentments and unspoken biases bring them closer together or driv e them apart? Full of the passion and tension any newly-joined couple experiences, this steamy yet hopeful book lays the foundation for Lydiaâs budding relationship with Sam, and offers hope for second chances and a deep appreciation for the value of a loyal friend."
,,,,,3865.0,0.177,,Searching for Dragons,"Kidnap a dragon? How daring!How stupidCimorene, the princess who refuses to be proper, is back--but where is Kazul the dragon? That's what Cimorene is determined to find out. Luckily--or perhaps not-so-luckily--she's got help: Mendenbar, the not-very-kingly King of the Enchanted Forest, has joined her in her quest. So with the aid of a broken-down magic carpet, a leaky magical sword, and a few buckets of soapy lemon water, they set off across the Enchanted Forest to tackle the dragon-napping and save the King of the Dragons."
,,,,,7850.0,0.174,,Carrier,"Twenty-two -year-old Naya has spent nearly half her life as a sex slave in a government institution called The Line. When sheâs kicked out after getting pregnant with twins, sheâs got no way to earn a living and a horrifying choice to make: find someone to replace her, or have her babies taken in her stead.A doctor with a history of aiding ex-Line girls, Ric Bennett, wants to help. He runs a team of rebels that can delete Nayaâs records and free her forever. But when The Line sniffs out his plan, things get bloody, fast. Naya means more to them than just a chance at fresh facesâher twins are part of the governmentâs larger plan.As they hide from government search parties, Ric comes to admire Nayaâs quiet strength. And Naya realizes Ric might be a man she can trust. If they make it off the grid, they could build a new life. But first theyâll have to survive the long, vicious reach of The Line."
,,,,,2321.0,0.174,,The Belles,"Camellia Beauregard is a Belle. In the opulent world of OrlÃ©ans, Belles are revered, for they control Beauty, and Beauty is a commodity coveted above all else. In OrlÃ©ans, the people are born gray, they are born damned, and only with the help of a Belle and her talents can they transform and be made beautiful.But itâs not enough for Camellia to be just a Belle. She wants to be the favoriteâthe Belle chosen by the Queen of OrlÃ©ans to live in the royal palace, to tend to the royal family and their court, to be recognized as the most talented Belle in the land. But once Camellia and her Belle sisters arrive at court, it becomes clear that being the favorite is not everything she always dreamed it would be. Behind the gilded palace walls live dark secrets, and Camellia soon learns that the very essence of her existence is a lieâthat her powers are far greater, and could be more dangerous, than she ever imagined. And when the queen asks Camellia to risk her own life and help the ailing princess by using Belle powers in unintended ways, Camellia now faces an impossible decision. With the future of OrlÃ©ans and its people at stake, Camellia must decideâsave herself and her sisters and the way of the Bellesâor resuscitate the princess, risk her own life, and change the ways of her world forever."
,,,,,10318.0,0.172,,The Gift of the Magi,"O. Henry's classic tale of the wisest gifts of Christmas is itself a gift to share and treasure.In a shabby New York flat, Della sobs as she counts the few coins she has saved to buy a Christmas present for her husband, Jim. One dollar and eighty-seven cents is all the money she has in the world. A gift worthy of her devotion will require a great sacrifice: selling her long, beautiful hair. Set in New York at the turn of the twentieth century, this classic piece of American literature tells the story of a young couple and the value of love.Jim, meanwhile, has made a sacrifice for Della that is no less difficult. As they exchange gifts on Christmas Eve, the discovery of what each has done fills them with despair, until they realize that the true gifts of Christmas can be found more readily in their humble apartment than in any fine store. Set in New York at the turn of the twentieth century, this classic piece of American literature tells the story of a young couple and the value of love.
O. Henry
 paints a masterly portrait of unfaltering love, a haven from the harsh world outside. The poignancy of his story is captured in Zwerger's eloquent art, wherein every glance, every gesture, tells a subtle truth."
,,,,,1638.0,0.172,,American on Purpose: The Improbable Adventures of an Unlikely Patriot,"In his memoir American on Purpose, Craig Ferguson, host of The Late, Late Show, traces his journey from working-class Glasgow to the comedic limelight of Hollywood and American citizenship. Moving and achingly funny, American on Purpose moves from Fergusonâs early life as an alcoholic to his stint on The Drew Carey Show to his decision to become a U.S. citizen in its unique and honest look at his version of the American dream."
