book_index,similarity_score,title,author,rating,no_of_ratings,no_of_reviews,genres
11761.0,0.183,The Shadow of the Sun,Ryszard KapuÅciÅski,4.39,14015,1132,"Nonfiction, Africa, Travel, History, Journalism, Polish Literature, Memoir"
8778.0,0.169,The Struggle: Striving to Survive,Johnny Franklin Jr.,5.0,2,0,
13249.0,0.164,Bloomsday: The Bostoniad,David B. Lentz,4.24,21,12,"Fiction, Literature, Contemporary"
9223.0,0.16,Jo's Boys,Louisa May Alcott,3.83,35655,1196,"Classics, Fiction, Young Adult, Historical Fiction, Childrens, Historical, Literature"
10532.0,0.158,The Sword of Shannara,Terry Brooks,3.76,94571,4686,"Fantasy, Fiction, Epic Fantasy, Science Fiction Fantasy, High Fantasy, Adventure, Magic"
1819.0,0.155,Death in Holy Orders,P.D. James,3.91,16379,891,"Mystery, Fiction, Crime, Detective, Mystery Thriller, British Literature, Thriller"
11508.0,0.15,The Starving Heart,Lydia West,4.28,25,3,Science Fiction
8981.0,0.147,Shyness and Dignity,Dag Solstad,3.86,3805,414,"Fiction, Scandinavian Literature, Novels, Contemporary, Literature, Roman, Literary Fiction"
11507.0,0.146,Liberty,Kim Iverson Headlee,4.01,122,36,"Historical Fiction, Romance, Fiction, Historical, Historical Romance"
10917.0,0.141,The Closers,Michael Connelly,4.17,53302,2152,"Mystery, Fiction, Crime, Thriller, Detective, Mystery Thriller, Audiobook"
11375.0,0.14,Fighting The Storm,Marcia Burns,4.38,8,2,
1411.0,0.138,Horn-Horn,A.D.T. McLellan,4.52,111,56,"Fantasy, Young Adult, Fiction"
609.0,0.135,Hunted,Sophie  Davis,4.35,2206,150,"Young Adult, Paranormal, Dystopia, Romance, Fantasy, Paranormal Romance, Science Fiction"
10505.0,0.134,Time Chain,Steven Decker,4.12,1450,65,"Science Fiction, Time Travel, Fiction, Fantasy, Drama, Contemporary"
10109.0,0.131,The Broken Way: A Daring Path into the Abundant Life,Ann Voskamp,4.19,6008,684,"Christian, Nonfiction, Faith, Christian Living, Spirituality, Christianity, Christian Non Fiction"
9173.0,0.13,"Networking for People Who Hate Networking: A Field Guide for Introverts, the Overwhelmed, and the Underconnected",Devora Zack,3.58,1872,203,"Nonfiction, Business, Self Help, Psychology, Personal Development, Communication, Reference"
7933.0,0.13,The Last Graduate,Naomi Novik,4.28,80768,10353,"Fantasy, Young Adult, Fiction, Magic, Romance, Urban Fantasy, Audiobook"
12235.0,0.128,The World Without Us,Alan Weisman,3.81,41149,3820,"Nonfiction, Science, Environment, Nature, History, Ecology, Post Apocalyptic"
12231.0,0.126,The Joy of Cooking,Irma S. Rombauer,4.12,180903,1332,"Cookbooks, Cooking, Food, Nonfiction, Reference, Classics, Culinary"
11988.0,0.126,Welcome to Felicity's World Â· 1774: Growing Up in Colonial America,Pleasant Company,4.2,612,22,"History, Nonfiction, Childrens, Picture Books, American History, Historical, School"
11965.0,0.126,There's No Such Place As Far Away,Richard Bach,3.94,4443,227,"Fiction, Philosophy, Spirituality, Short Stories, Childrens, Fantasy, Self Help"
2489.0,0.124,The Wrong Decision,Danyelle Scroggins,4.75,44,12,
9186.0,0.124,Maiden Voyage,Tania Aebi,4.16,2985,264,"Nonfiction, Travel, Adventure, Memoir, Biography, Autobiography, Maritime"
11204.0,0.123,Who Could That Be at This Hour?,Lemony Snicket,3.84,27418,2767,"Mystery, Middle Grade, Fiction, Childrens, Young Adult, Humor, Adventure"
12188.0,0.122,The Art of Happiness,Dalai Lama XIV,4.17,113096,3174,"Nonfiction, Philosophy, Spirituality, Self Help, Buddhism, Psychology, Religion"
5282.0,0.122,Stuff & Things and What Boredom Brings,Rue Volley,4.14,167,52,"Paranormal, Witches, Young Adult"
7554.0,0.122,Speaks the Nightbird,Robert R. McCammon,4.13,12964,1364,"Historical Fiction, Mystery, Horror, Fiction, Historical, Thriller, Witches"
12377.0,0.121,Ø£ÙÙØ§Ø¯ Ø­Ø§Ø±ØªÙØ§,ÙØ¬ÙØ¨ ÙØ­ÙÙØ¸,4.09,27464,3267,"Fiction, Novels, Classics, Literature, Egypt, Historical Fiction, Africa"
156.0,0.12,Veronika Decides to Die,Paulo Coelho,3.72,212573,10504,"Fiction, Contemporary, Philosophy, Novels, Psychology, Romance, Mental Health"
11744.0,0.12,The Desire Map,Danielle LaPorte,3.91,8078,394,"Self Help, Nonfiction, Personal Development, Spirituality, Productivity, Psychology, Business"
8760.0,0.12,Mukher Arale Mukhosh,Sarasij Sengupta,3.0,2,0,
1089.0,0.118,Saint Peter's Fair,Ellis Peters,4.11,10203,563,"Mystery, Historical Fiction, Fiction, Historical, Crime, Medieval, Historical Mystery"
9183.0,0.116,Rhapsodic,Laura Thalassa,3.95,104916,9657,"Fantasy, Romance, Paranormal, New Adult, Fae, Fantasy Romance, Paranormal Romance"
8486.0,0.116,Cybertraps for the Young,Frederick S. Lane,4.38,13,3,
6.0,0.115,The Book Thief,Markus Zusak,4.39,2410045,138420,"Historical Fiction, Fiction, Young Adult, Historical, Classics, War, World War II"
7244.0,0.115,I Am the Messenger,Markus Zusak,4.03,156690,15684,"Young Adult, Fiction, Mystery, Contemporary, Realistic Fiction, Australia, Audiobook"
9117.0,0.113,Gran-sdur: The Games,Jan Raymond,4.65,97,30,Fantasy
8335.0,0.113,Up from Slavery,Booker T. Washington,4.09,32718,2151,"History, Biography, Nonfiction, Classics, Memoir, Autobiography, African American"
9017.0,0.112,The Stone Raft,JosÃ© Saramago,3.82,8333,613,"Fiction, Portugal, Magical Realism, Literature, Portuguese Literature, Nobel Prize, Novels"
10691.0,0.112,Oblomov,Ivan Goncharov,4.11,36928,1702,"Classics, Fiction, Russia, Russian Literature, Literature, 19th Century, Novels"
10509.0,0.11,Nothing to Envy: Ordinary Lives in North Korea,Barbara Demick,4.44,82528,8931,"Nonfiction, History, Politics, Asia, Biography, Audiobook, Journalism"
6967.0,0.11,Freedom,Jonathan Franzen,3.78,165421,14607,"Fiction, Contemporary, Novels, Literary Fiction, Literature, American, Adult Fiction"
12936.0,0.11,"Horn-Horn, Cracked",A.D.T. McLellan,4.65,17,12,
11960.0,0.11,Desperation,Stephen King,3.85,136983,3599,"Horror, Fiction, Thriller, Fantasy, Suspense, Supernatural, Paranormal"
12477.0,0.109,"A Return to Love: Reflections on the Principles of ""A Course in Miracles""",Marianne Williamson,4.25,33103,1322,"Spirituality, Self Help, Nonfiction, Personal Development, Philosophy, Inspirational, Psychology"
13062.0,0.109,Chase of Choices,Hari Parameshwar,4.08,39,28,
12221.0,0.109,Matching Configurations,Kyle Keyes,4.3,7504,34,"Fiction, Novels, Science Fiction, Young Adult, Space Opera, Space, Teen"
12287.0,0.109,Desecrating Solomon,Lucian Bane,4.08,505,177,"Romance, Dark, Horror"
2115.0,0.105,Wicked Nights,Gena Showalter,4.07,25609,1618,"Paranormal Romance, Paranormal, Romance, Angels, Fantasy, Demons, Adult"
11069.0,0.104,"Handcuffs, Kisses and Awkward Situations: Mystery Romance",Olivia Harvard,4.12,1057,65,"Romance, Young Adult, Fiction, Mystery, Teen, Young Adult Romance"
12134.0,0.103,Doing Max Vinyl,Frederick Lee Brooke,3.76,1508,62,"Mystery, Fiction, Mystery Thriller"
10902.0,0.103,The Nerdist Way: How to Reach the Next Level,Chris Hardwick,3.67,5760,449,"Nonfiction, Self Help, Humor, Biography, Audiobook, Memoir, Comedy"
1427.0,0.103,The God of Small Things,Arundhati Roy,3.95,287179,18035,"Fiction, India, Historical Fiction, Classics, Contemporary, Literary Fiction, Indian Literature"
672.0,0.102,Old Man's War,John Scalzi,4.23,188024,11392,"Science Fiction, Fiction, Space Opera, Science Fiction Fantasy, War, Military Fiction, Space"
12823.0,0.101,The Philosophy of Andy Warhol,Andy Warhol,3.83,45220,638,"Art, Nonfiction, Philosophy, Biography, Memoir, Autobiography, Art History"
7700.0,0.101,Johnny Got His Gun,Dalton Trumbo,4.19,41890,3033,"Fiction, Classics, War, Historical Fiction, Horror, Literature, Novels"
12164.0,0.1,Linked,Hope Welsh,3.49,190,45,"Paranormal, Romance, Paranormal Romance, Amazon, Fiction"
6875.0,0.098,Becoming,Michelle Obama,4.47,970973,65280,"Nonfiction, Memoir, Biography, Audiobook, Autobiography, Politics, Biography Memoir"
1868.0,0.098,Bad Boy,Peter Robinson,3.99,8069,453,"Mystery, Crime, Fiction, British Literature, Thriller, Mystery Thriller, Detective"
10073.0,0.098,A Chance to Die: The Life and Legacy of Amy Carmichael,Elisabeth Elliot,4.05,9010,354,"Biography, Christian, Nonfiction, Christianity, Faith, Biography Memoir, Christian Living"
10804.0,0.098,The Five Love Languages for Singles,Gary Chapman,4.12,11700,1037,"Nonfiction, Self Help, Relationships, Christian, Psychology, Personal Development, Christian Living"
829.0,0.097,"Rosie Revere, Engineer",Andrea Beaty,4.46,12016,1330,"Picture Books, Childrens, Science, Feminism, Storytime, Growth Mindset, Poetry"
485.0,0.097,The Interesting Narrative of the Life of Olaudah Equiano,Olaudah Equiano,3.74,12728,602,"History, Nonfiction, Classics, Biography, Memoir, Africa, Autobiography"
11067.0,0.097,Unlimited Power: The New Science Of Personal Achievement,Anthony Robbins,4.21,34212,839,"Self Help, Personal Development, Psychology, Nonfiction, Business, Productivity, Philosophy"
12239.0,0.096,Love Story,Erich Segal,3.64,59255,3372,"Romance, Fiction, Classics, Contemporary, Chick Lit, Love, Novels"
7917.0,0.095,"Manage My Emotions: What I Wish I'd Learned in School about Anger, Fear and Love",Kenneth J. Martz,4.07,69,13,"Self Help, Psychology, Nonfiction, Mental Health, Personal Development, Emotion, Business"
9002.0,0.095,Bad Luck Cadet and Bad Luck Officer,Suzie Ivy,4.52,27,6,
2046.0,0.095,Famous Last Words,Timothy Findley,3.98,1781,98,"Fiction, Canada, Historical Fiction, War, Historical, Literature, Canadian Literature"
8654.0,0.094,How to Climb the Eiffel Tower,Elizabeth Hein,4.14,106,44,"Fiction, Chick Lit, Womens Fiction, Humor"
5394.0,0.094,White Noise,Don DeLillo,3.86,109463,7627,"Fiction, Classics, Literature, Novels, Literary Fiction, American, Contemporary"
195.0,0.094,Lost in the Crowd,M.J. Santley,4.36,192,10,"Fiction, Thriller, Mystery, Drama, Dark, Young Adult, Crime"
13053.0,0.094,Blue Labyrinth,Douglas Preston,4.12,22100,1691,"Mystery, Thriller, Fiction, Suspense, Mystery Thriller, Crime, Audiobook"
6804.0,0.094,The Camp of God's Tears,Marilyn Lee,0.0,0,0,
9432.0,0.094,Family Pictures,Sue Miller,3.81,5294,185,"Fiction, Contemporary, Novels, Realistic Fiction, Family, Autistic Spectrum Disorder, Adult Fiction"
8253.0,0.094,It's a Long Story: My Life,Willie Nelson,4.11,7988,1055,"Biography, Music, Nonfiction, Memoir, Autobiography, Audiobook, Biography Memoir"
10544.0,0.094,The City of Dreaming Books,Walter Moers,4.38,19905,1623,"Fantasy, Fiction, Books About Books, German Literature, Humor, Young Adult, Adventure"
10968.0,0.094,In the Country of Last Things,Paul Auster,3.9,13333,1108,"Fiction, Dystopia, Science Fiction, Novels, American, Post Apocalyptic, Literature"
10457.0,0.093,Back To You,Steve  Bates,4.25,3166,48,"Fiction, Novels, Contemporary, Time Travel, Drama, Science Fiction, Fantasy"
12593.0,0.093,Bottle,D.M. Samson,4.65,23,2,
12829.0,0.093,Suddenly Royal,Nichole Chase,3.88,13966,1348,"Romance, New Adult, Contemporary, Contemporary Romance, Chick Lit, Young Adult, Fiction"
12692.0,0.092,Leota's Garden,Francine Rivers,4.12,22682,956,"Christian Fiction, Fiction, Christian, Contemporary, Inspirational, Adult, Novels"
